Review Title|Review Date|Review Score|Review Text
September 1, 2014|Will Be Back Again|5|Our daughter is a student at Brown and Hemenway's has become a favorite stop during our visits. The fish is what the restaurant is known for, so that is what I order. During our most recent visit I had two types of raw oysters - - chosen with the advice of our waiter. Both were extremely fresh and flavorful. Speaking of our waiter, he was present without being overbearing and very knowledgeable. We were fortunate enough to have a table by the water and the views at night are lovely. We will be back again, I am sure.
August 31, 2014|It was a very nice night out service was...|4|It was a very nice night out service was great and very helpful totally enjoyed the experience will go back again
August 30, 2014|Very busy Saturday night.  Had to ask fo...|5|Very busy Saturday night. Had to ask for bread. Food usually outstanding, but out guest had baked stuffed shrimp and thought they were dry.
August 30, 2014|Great food and superb service!|5|Everything was excellent! We dined here for our 6th wedding anniversary and we could not have had a better time! It was nice of the restaurant to decorate our table with rose petals and offer us a complimentary champagne toast to start off our night! Jordan our waiter was excellent! We never had to ask for anything, he was always a step ahead! Our apps, dinner entrees and dessert were all excellent and very well portioned for the price! Their lobster bisque is always amazing and they have a great wine selection! I would definitely reccomend hemenways for a romantic night out or for a great meal with friends!
August 30, 2014|Great food, desserts, and raw bar|5|We luncheoned here for daughters our 21st birthday. Great choice, as she is a culinary arts student and takes restaurant experiences with an eye (and stomach) for detail. She had lobster ravioli, which the waiter described as fresh pasta with a creamy, but light sauce. A+ description and flavor. Our appetizer was bacon-wrapped scallops. I asked for well-done bacon, but tender scallops. Another A+. My wife and daughter had creme brulee, and i had flour-less chocolate cake. The cake was free, 'cause it was her birthday. The cake was delicious, some whipped cream, vanilla ice cream, and a strawberry. Brulee surprise! 3 flavors, each delicious and cooked perfectly. The decor was a bit dark but tempered by the river view. 4/4 stars.
August 29, 2014|Excellent in every respect!!|5|My favorite restaurant so far during this visit to Providence! Food, service and atmosphere all top notch! Guaranteed you won't be disappointed.
Dined on August 27, 2014|First time at Hemenway's|5|Enjoyed our first visit to Hemenway's! Good atmosphere with great food and service.
August 27, 2014|Beautiful place!|4|Excellent food! lovely place with view to the river
August 24, 2014|always outstanding|5|Been to all the so-called seafood specialty places and often disappointed, but never disappointed with Hemenway's - rarely can you say that everything is great like this. parking-service-preparation-quality-seafood-steak-dessert (creme brulee trio!)-coffees... Our go-to restaurant for special occasions, family groups, or just because.
August 24, 2014|Definitely a favorite of Providence|4|Food and ambience were great! You won't be disappointed
August 24, 2014|Special orders don't upset us...|5|I needed a special restaurant for a very special 80 th birthday celebration. The guest of honor needed a puréed meal. Heather at Hemenway's was so knowledgeable and helpful. She informed all the staff who served us what was needed and we had a wonderful and 'normal'dinner!!! Thank you so much to everyone at Hemenway's, especially Heather!!!
August 23, 2014|Very good food but fair service|4|This was our second visit to Hemenway's. The food was quite good; however, the service was not what it should have been. We had to constantly remind our server to bring items we requested including bread. We asked for separate checks (party of 4) which was forgotten about. I had the seafood pasta which was a large dish full of delicious seafood. My wife had fried scallops which she liked very much. We were disappointed with the lack of creativity from the bar when asked for a special martini. Not so sure I would rush back given the many other options in Providence.
August 23, 2014|Water Fire Night|5|A memorable visit to a vibrant restaurant with good food and wine,
August 23, 2014|Hemenways|5|Bill, our server was very attentive. Loved rose petals on table! All apps and entrees were delicious! Great location for Waterfire!
August 23, 2014|Great Night Out|5|We had a lovely dinner before enjoying Providence's unique Waterfire. Very glad we had reservations. There was a long line at the door shortly after we arrived. The restaurant has a very high ceiling which makes the space feel much more voluminous, and helps mitigate the noise, too, I expect. The room feel larger than it is, but in a good way. The food was excellent. She had grilled swordfish and I opted for the seared tuna. It was served very rare, as requested. Danny, our waiter was terrific. A quick sense of humor to match his attentive service. And nice recommendations, too.
August 23, 2014|Thanks for a great experience Danny|5|Food was awesome, but Hemmenways never disappoints.
August 23, 2014|The salads were better than the hot dish...|2|The salads were better than the hot dishes. We order two salads - one with crab, one with yellowfin tuna. We order two hot dishes - clams and linguine, and fried clams - both were way too salty.
August 21, 2014|We had a fantastic dinner of lobster and...|5|We had a fantastic dinner of lobster and Caesar salad. Our server as very attentive. I wish we lived closer so we could return more often. When we are visiting the area we will definitely dine here again.
August 20, 2014|Seafood Delight|5|Great Seafood, Atmosphere. and Service. Can't go wrong.
August 18, 2014|Fabulous service and food|5|Our server Hollie was fantastic, very attentive but not overbearing. We had the seafood tower, 1/2 price on Mondays, all very fresh and tasty. One of the best restaurants in Providence.
August 17, 2014|Fabulous Experience|5|"We celebrated my brother's 60th birthday on a recent Sunday afternoon. They provided a lovely private table that let our party have an intimate dining experience. My sister who was earliest to arrive and found out it was my brother's ""special"" birthday, and asked the management if they could provide a fabulous cake for dessert. The kitchen informed the maître D ' that all cakes had already been prepared for the day and we're not able to help with this request. The manager said he could send out to a nearby bakery and sent staff to get one. My sister was bowled over. The service and food were more than splendid. I keep going back because the restaurant accommodates your every wish to make your dining experience one to remember!"
August 16, 2014|Must Do|5|"If you are in Providence you simply must eat at Hemenway's. The quality of the food was exceeded only by the quality of the service. If you're looking for a ""special"" night out go to Hemenway's. You won't be disappointed !!!!"
August 15, 2014|Service was excellent|5|Had a great experience. Bill, our server was outstanding. Food was great. They timed it perfectly I between meals and appetizers.
August 15, 2014|Exceptional from beginning to end!|5|My wife and I went to Hemenway's on date night the other night. Our expectations were low as we have had a hard time finding good restaurants lately. What a pleasant surprise! From the time we walked in to the time we left, it was nothing but exceptional, exceptional service, exceptional drinks, exceptional appetizers, exceptional meals (the swordfish special was amazing) and exceptional deserts. The price was in line with what I would expect for this level of restaurant, but the difference was Hemenway's is well worth it! We now have a new favorite restaurant.
August 15, 2014|KELLY IS THE BEST SERVER EVER!|5|Had such a wonderful time celebrating my boss' birthday. Service was excellent and food was out of this world.
August 13, 2014|Fresh local seafood, good ambience.|5|This restaurant features locally harvested oysters and clams, but also offers a wide array of fish. I recommend the beet-marinated scallops. Nice wine selection.
August 13, 2014|Perfect for seafood in Providence|4|"Great location and nice view of the river. Service attentive. Food is reliable and good...not over the top ""gourmet"" but really good fresh seafood. Dinner was a bit loud for me as I usually go at lunch. They respond when you have a concern (last time we noted the creme brulee didn't have a good consistency nor was it properly ""bruleed""...this time...perfect. We were impressed they really listened. Calamari outstanding...oysters (raw and my favorite, Hemenway's style) are the reason we keep on going back. Worth the trip and return."
August 10, 2014|Nice spot|5|This is an all round restaurant. It can serve any occasion, and it has for me. We have been for a nice Saturday night, as well as a good Sunday afternoon.
August 9, 2014|A+ Dinner Spot for Waterfire|5|Hemenway's is located at the end of Waterfire and next to Starry Night, so it was easy to go early and enjoy Waterfire before dinner. And parking is validated by Hemenway's, so I think I paid $3 for three hours of valet parking (not counting tip). The Menu was excellent and the food was superb. All in all, it was very easy to pull off a wonderful evening despite the huge crowds of people downtown.
August 9, 2014|A Great Dinner - Start to Finish!|5|Promptly seated at a window table for our 8:15 reservation on a Waterfire Saturday night! Special menu at $35 for a three-course meal was a nice addition to the regular menu. All four of us were impressed with the food quality, selection and presentation, as well as the fine service. Our meals were perfectly cooked and served at the appropriate temperature, paired with a couple of bottles of reasonably priced wine.
August 9, 2014|Fun and Delicious!|5|Hemenway's never disappoints. There is always a lot of energy. Tthe service and atmosphere are great and the food is always so fresh and well prepared. Our waiter Bill was terrific. His knowledge of the menu and timing were perfect. He knows how to make every patron feel like his most important customer. Cocktails and seafood platter at the bar were also terrific. Just wish the cocktail area was a little bigger. Sometimes hard to find a spot. This is one of our favorite spots for a great night out and for a special celebration.
August 9, 2014|Food and service are always top notch. W...|5|Food and service are always top notch. Went on a Waterfire night that made the night just perfect.
August 9, 2014|Hemenways  - excellent dining|5|We arrrived on time for our reservation and opted to wait just a few minutes for a seat by the window, which over looks the canal in Providence. We had a front row view of the waterfire boats - loaded with wood and ready to light the fires which are just steps away. The food was outstanding, we had calamari with peppers and tuna appetizers, both cooked perfectly and very tasty. The lobster ravioli, pasta with seafood and scallops were terrific, the vibe at Hemenways is very upbeat but not too loud. Service was excellent too. I would go back in a heartbeat!
August 8, 2014|THE BEST OYSTERS!|5|Amazing choice of local oysters. Very flavorful! Waitress Louise shared her knowledge of food & local events with us. She was very gracious. Would go back in a Rhode Island minute!
August 8, 2014|Never Disappointed|4|Hemenways - you cannot go wrong for seafood or steak. Certainly have enjoyed every meal there.
August 8, 2014|Excellent Seafood|5|Excellent seafood served in a professional manner. Food was fresh and served hot. Something that seems to be difficult for many places. Waitress was competent, friendly and attentive. A little pricey, but you don't seem to mind when the experience is as good as this.
August 7, 2014|Really good food and service|5|Dinning here was a a great experience. Definitely recommend to all.
August 3, 2014|Perfect evening|5|Super fresh seafood! Oysters were amazing, drinks were tasty and our server was very attentive and intuitive to our needs. Will definitely come again
August 2, 2014|Always great|5|Must eat. I have been coming to providence for 18 years and this restaurant has always been great. Great food, great service, great memories.
July 31, 2014|Missed the Boat|2|While the freshness of the seafood was evident, the manner in preperation and culinary vision was lacking. I would recommend it as an adequate choice but nothing more.
July 26, 2014|Loved it !|4|The seafood hot app was excellent, though I prefer a chopped clam casino, the whole clam was a bit chewy. The fried clams were worth the wait. Perfect. Clearly, Hemenways is one of Providence's best.
July 26, 2014|Spectacular!|5|Amazing food, savored every bite. Great variety of menu choices!
July 26, 2014|Fantastic|5|Great seafood and service. Was a perfect find for the night of the water fires.
July 26, 2014|A most pleasant experience|5|"We were a party of 3, and each chose a different entrée. All were very pleased with the choices, the food was great, the servings substantial, and the service very attentive. We had a ""gluten-free"" person, and were surprised at your ""gluten-free"" menu. The flourless chocolate cake was outstanding, as were the other 2 desserts. We will definitely return to Hemenway's."
July 25, 2014|Our all-time favorite|5|Hemenway's was our all-time favorite seafood experience. Linguini with shrimp was delicious. Paella was off-the charts great. Ellie's stuffed shrimp was delectable.
July 24, 2014|Excellent|4|What a great find. My husband and I stopped in after Rhode Island best of party. We had already had too much food. We wanted a meal, or so we thought. After we ordered we realized we were not that hungry. Our waiter was excellent and wrapped our food to take home. The food was great even though we couldn't eat it. Excellent leftovers on Friday night when I didn't want to cook anyway. Great views of the river in downtown Providence. I Highly recommend it.
Dined on July 24, 2014|We had a superb time here, mostly due to...|5|We had a superb time here, mostly due to our waiter, Cory. He made the evening. He paced the meal so we could enjoy our drinks, then our soup and salad, then the main course, without piling everything on top of each other. The food was very good. We splurged and shared a stuffed lobster...very rich! Such an enjoyable experience overall.
July 21, 2014|Go if you have all night...........|2|We went on a Monday night. Sat outside, street view only. Slow Service.....Took 45 minutes by the time we got appetizers and they were crab cakes and oysters from the raw bar. Dinner took forever arrived at 9:45pm.... We had a 7:45 reservation and was finished dinner at 10:30 we did not order dessert. Eaten alive by mosquitoes. I wish the food was worth the wait.
July 21, 2014|Stellar Again|5|We greatly enjoyed Hemenways, the staff stepped up for our special occasion ( we had notified them in advance). It was a beautiful night, great seafood and remarkable service. We have been there dozens of times over the years and they still make it memorable and top shelf.
July 21, 2014|Tasty and sustainable|5|Four of us had dinner at Hemenway's on Monday evening. Started with a selection of exquisitely fresh oysters and top neck clams steamed in white wine, Granny Smith apples, chorizo and herbs. The broth was so good I could have drunk it from the bowl, but settled for dunking my warm crusty bread in it instead, at our waitress's urging. Followed that with a cup of clam chowder thickened with cream rather than the usual flour. Followed that with succulent, sweet whole bellied clams and grilled artichokes. To top it off, all raw bar items were half price with an entree. Exceptional meal with wonderful service provided by a delightful serve named Nancy. Others had fresh fish & we're equally pleased. Next time I'm in Providence, I'll be back!
July 19, 2014|Great spot!|4|We love Hemenways. It's our go to place for a nice night out. Good is always delicious and service is always great
July 19, 2014|Great Place!|5|I had never been to Hemenway's, but it came highly recommended and it was a great experience! We went for a friend's birthday and it was a great place to go. The food was amazing and the wine and drink list was extensive. We went during Providence restaurant week and got a fantastic deal for our meals. I will be going back for sure.
July 19, 2014|had a great meal  went for my wife birth...|5|had a great meal went for my wife birthday very nice
July 18, 2014|Very good!|4|I took my girlfriend for restaurant week and it was amazing, we enjoyed ourselves a lot. Great oysters, a really good prix fixe menu, and a great wine and beer list. Our waitress was very attentive as well, and did a fantastic job.
July 18, 2014|Good food good service but can get food ...|3|Good food good service but can get food just as good and less expensive elsewhere. Not worth spending the money. Even restaurant week. Nothing AMAZING for which I would expect for the price.
July 18, 2014|Best of both worlds|5|I recently dined at Hemenway's for lunch on a warm summer day. Sitting inside in the AC with a view of the river and the park felt like sitting outside without the heat or the noise. The food and drinks were wonderful and a great value on their lunch menu.
July 18, 2014|Outside dining too noisy|2|The outside dining was so noisy with traffic from the street that everyone was almost shouting to be heard. Would never eat outside here again!
July 17, 2014|Taste E|4|Food very tasty. Service very good. Environment very nice.
July 17, 2014|Always a good experience|5|My colleague and I were there for restaurant week, and the food was great--so was the service, right down to asking if I preferred a black napkin so I didn't leave with white lint on my black pants. The food came out quickly and was very flavorful. I highly recommend Hemenways for lunch and ask for a table with a view of the river.
July 16, 2014|Key time pie is amazing, would go back j...|4|Key time pie is amazing, would go back just for that.
July 16, 2014|Amazing as always!|5|My partner and I went to Hemenway's for our 2 year anniversary since this was where we had our first date. They sat us by the large windows with an amazing view of the river next to the restaurant. We ordered off the restaurant week menu; I got the lobster bisque, seared salmon, and chocolate torte, while my partner got clam chowder, surf & turf, and key lime pie. It was all so amazing we cleaned our plates, even the whole 10oz steak! When we told our waitress about our special day, she brought over rose petals and 2 glasses of champagne on the house! She was very attentive and anything we asked for was brought over promptly. Amazing service, great food, and a wonderful night for us; Thank you for a wonderful anniversary Hemenway's!
July 16, 2014|Very much liked|5|Great service and food delicious. Walked to our tour of Brown University from here.
July 13, 2014|Wonderful experience|5|I chose this restaurant to meet with friends to celebrate our boys graduating high school. The good and service was outstanding. The table was located near the front window which allowed us privacy. Overall a terrific experience.
July 13, 2014|Lobster Crab Cakes|5|By far the best crab cakes in the area. Extremely delicious.
July 13, 2014|Close to Brown University|5|We celebrated my sons birthday and had a wonderful experience. The ambience is upscale but not overly formal. All bottles of wine are half off on Sundays. Parking is no problem as there is a garage next door or on street parking if you go for lunch, or valet parking for dinner.
July 12, 2014|Don't Believe All The Hype|2|I would not recommend this place if you are parent traveling with your college student and looking for an excellent meal in Providence, unless you wanted to be treated like a second class citizen. Where your April 2014 table request is not to be honored and the food order is only done half right. But Hemenway's the perfect place for a place where pushing bottles of wine seems to their top priority. The bottom line is while we don’t expect Hemenway’s to be anywhere close to the caliber of restaurants like those in Boston, New York or Newport. One would expect that considering Hemenway’s has the perfect location for foot traffic and is located in the state’s capital. One would hope the commitment to excellence would be their top priority.
July 12, 2014|SLOW and BUSY|4|I booked the table for 6:45. I knew Waterfire began around 8:30. I thought that would be good timing. Instead we did not get finished until 9:30. Our waiter said that the kitchen was very busy. Food was good but not worth the wait.
July 12, 2014|Service is the key|4|We have dined at Hemenways several times, and always find the service to be wonderful.
July 12, 2014|Excellent Evening|5|The excellence started at the door and continued throughout the evening. Our waitress was exceptional... Knowledge of menu, area attractions, choices support, perfection..... Meal was terrific from calamari, chowder, fish and ice cream!
July 11, 2014|Still a great choice for seafood!|4|Fabulous food. This night the service was a tad slow or I would have given a 5 star recommendation. Unfortunately one large table near us was extremely loud, (no fault of the restaurant), which made conversation difficult. We will definitely be back again!
July 11, 2014|1st time dining in Providence|5|Great food and perfectly timed service with a wonderful view. Restaurant had extensive menu - we were seated right by the window overlooking the boating on the water.
July 11, 2014|Mixed Review of Food; good service|3|We started off with a lot of seafood: Great Beau Solei Oysters! Yummy scallops wrapped in bacon. The calamari was okay and the stuffed clams casino were buttery and dry all at the same time. Not really edible and more like sawdust with butter. I had the short rib for dinner, and although very tender, for some reason they put barbeque sauce on it so you really couldn't taste the beefy flavor. My husband's pork chop also had barbeque sauce on it and it really ruined the flavor of the meat. Service by the main servers was very good, but the food runners are mousy. It was our second time here as this place is 4 hours from home. There are better options in Providence.
July 11, 2014|Delocious|5|Wonderful lunch during a Restaurant Week. I hadn't been back I'm about 15 years when I stopped working downtown. It won't be that long again! Because the day was so lovely we chose to,eat outside this the lower scores for ambiance and noise...our choice. I highly recommend this restaurant. Portions were perfect. Fish Tacos and Jonah Crab Salad so fresh. Due to,it's richness the Lobster Bisque, was also a perfect portion. Yummmmm.
July 11, 2014|disappointing experience|2|"I was excited to try Hemenway's since I heard such wonderful things about it. We were greeted by a very friendly and accommodating hostess. However, our server was unfriendly and extremely slow. We ordered the lunch special which includes appetizer, entree and dessert. The salad I ordered was a little wilted and disappointing. The beer battered fish and chips were just ok and the fries were soggy. The ""dessert"" of a ""fresh baked cookie"" was also disappointing. I thought it would have been presented a little better than thrown at us in a plastic bag! I expected so much more. Won't go back."
July 10, 2014|Fresh seafood|4|The view of the river is beautiful. The seafood is so fresh the fish could flip up and hit me. The service was old-fashioned upscale but the ambience was friendly and warm. Lovely.
July 10, 2014|Lunch|4|Had a great lunch. Food and service very good. Had not been here in a while and was pleased with the visit.
July 9, 2014|DINED DURING RESTAURANT WEEK AND IT WAS ...|5|DINED DURING RESTAURANT WEEK AND IT WAS A GREAT VALUE. QUALITY AND SERVING SIZE WERE VERY GOOD.
July 8, 2014|CCbud|4|It's hard to believe, but this was our first time at Hemenway's. We got there a half hour before our scheduled reservation time but were seated immediately (with great view of the river and city beyond). It was Restaurant Week in Providence and the menu was excellent. We too advantage of the extensive wine list and settled down for a relaxing dinner. We eat out often and will definitely return to Hemenway's on our next visit to Providence.
July 6, 2014|A nice restaurant with some great food o...|4|A nice restaurant with some great food on the menu, particularly if you like fish & seafood. Servings are on the heartier side so no need to worry about going hungry afterwards. The service was good; there was a miscommunication regarding our order that was taken care of in a very nice way (it ended up almost adding to the experience rather than take away from it). Next time we'll try and ask for a booth or a table by the windows to enhance the experience (as compared to a table in the middle of the isle). All-in-all a very nice experience and we'll definitely return (soon!).
July 6, 2014|Great seats, window overlooking the park...|4|Great seats, window overlooking the park. Disappointed in our choice of using Restaurant Week Menu. I was not thrilled with the steak, It was tough to chew.
July 5, 2014|THE SERVICE WAS EXCELLENT AND THE FOOD W...|4|THE SERVICE WAS EXCELLENT AND THE FOOD WAS VERY GOOD. WE SAT BY THE WINDOW AND ENJOYED IT VERY MUCH. THANK YOU.
