Review Title|Review Date|Review Score|Review Text
ays ago|Special Night|5|We celebrated our 40th anniversary last week at Hemenway's. We were escorted to a nice table with scattered rose petals and treated to champagne. Several staff members congratulated us including the manager. Our server Diane was personable and attentive. The lobster bisque was delicious and the calamari was done to perfection. My swordfish was moist and my husband's seafood pasta was tasty and full of treasures from the sea. I am glad I had room for the Blondie dessert as it was a great ending along with good coffee. We truly had a great night.
February 25, 2016|We had an excellent lunch. I had a sword...|5|We had an excellent lunch. I had a swordfish sandwich, which was an open-faced sandwich with perfectly grilled swordfish, arugula and tomato. The staff at Hemenways is always helpful and although our waitress brought me the wrong vegetable, the one I got was delicious, so I didn't mind.
February 24, 2016|I took my friend from Canada here tonigh...|5|I took my friend from Canada here tonight and had probably the best meal I have had in a very long time! The staff was amazing! The food was amazing! And Trevor our waiter was amazing! I have a scallop allergy and multiple staff members came up to me double checking everything I was having was ok. They went above and beyond the call of duty. The meal was out of this world and my friend can't wait to come back to Rhode Island to come back here!
February 20, 2016|Birthday dinner, Sat. 2/20/16|5|Went for my sister's birthday, four sisters together. The food was very good, the drinks were very good, no complaints at all by any of us. Oysters and Littlenecks were so fresh, we would definitely go back. It was loud, but we were lucky we got a window seat at the end of a row so no noise on one side of us. It was a Saturday evening so the noise was expected. The service was excellent, so sad I can't mention the woman's name, I forgot but she was great even though she was so busy. Would highly recommend. And will return.
February 20, 2016|The epitome of excellence in a dining experience!|5|My boyfriend and I went for dinner on 2/20/16 and although we could only get a reservation at 4:15 p.m. we decided it was okay to have an early dinner. Our waiter was Ian and he was very professional, attentive to our needs without being intrusive, and at the end of the meal brought my boyfriend a complimentary dessert as I had told him the dinner was for his birthday in the following week. The ambiance of the restaurant is upscale dining with a twist of professionalism while coupled with a flair for courteous service making the customer feel as though they are there to be served! The food is beyond comparison. We ordered different items to sample the flair of the chef's ability to provide the palate with different tastes and everything surpassed our greatest expectation. Some may think the prices are high but if you think about the price in comparison to the service and the quality of the food you receive, the prices are modest in comparison to some eating establishments. I know we will go back but when depends on where we are at any given time. I just want to give a special thank you to Ian. I have eaten at five-star restaurants across the country in the last 25 years and Ian is the best waiter I have ever had the pleasure to have attend my table. Thank you!
February 19, 2016|"Good food 
Waiter was excellent 
Love th..."|5|Good food Waiter was excellent Love the atmosphere
February 18, 2016|Very good business dinner|5|We utilized Hemenways as a destination for our business dinner and we are very glad we did. The service was excellent. Our server, Shelia, was attentive, friendly and knowledgable without being intrusive. The food was excellent and the noise level was perfect. We didn't have to shout to be heard amongst ourselves. Everyone in our group was impressed with the meal and the restaurant as a whole. We will definitely be back.
February 17, 2016|Another great evening.  The food and ser...|4|Another great evening. The food and service were good to great as usual. The menu features were outstanding. The daily fresh fish choices were amazing. You cannot go wrong, either at a table or dining at the bar or the shellfish bar....its all good!
February 14, 2016|Great night out!|5|We had a wonderful meal and our server Allie was attentive, professional and just fantastic. What a great meal and night out with our family. We can't wait to go back!
February 14, 2016|Excellent service!!!!! Food was great!!!...|5|Excellent service!!!!! Food was great!!! Table is a little small for two.. But overall experience it was great!!
February 13, 2016|The food and service was awesome.|5|The food and service was awesome.
February 13, 2016|They did a great job on a busy V-day weekend.|5|"The food was amazing! The service has always been great and remained so. But the chefs have upped their game. The food has taken on a creative & native touch. I had a great ""RI chowder"" and a simple white fish that was nothing short of amazing. Simple did not mean plain when presented for dinner. i normally do not have dessert but this time the personal sized homemade Key Lime pie felt like it was made just for us. It felt like we had a very special Valentines dinner with a personal server and cook just for us, instead of being another set of people on a busy night."
February 13, 2016|Both my husband and I went to have a rom...|5|Both my husband and I went to have a romantic pre Valentines Dinner. I have to say the service was excellent. Out waitress was so attentive even though the restaurant was very busy as it was a Saturday night. The food came out it was presented so beautifully, almost to good to eat. It was much more then I had anticipated getting for food. I dined on the Lobster Mac and Cheese and my husband tried one of the specials of the night, the Veal . I look forward to going back to this restaurant again and trying something new or even having the same meal I had as it was excellent.
February 12, 2016|Great food and service|5|I have been coming to hemenway's since 2011 thanks to my wife who introduced me, NOT one single disappointing experience. Their seafood is always fresh(hint, hint.. We love seafood), all plates are cooked to perfection and the service is amazing, always going above and beyond.
February 12, 2016|Amazing food and wonderful staff. My onl...|5|Amazing food and wonderful staff. My only complaint would be the noise level. It was the Friday of Valentines weekend so it was very busy. We had to talk loudly in order to hear each other. We come here often enough and will definitely come again!!!
February 6, 2016|Wonderful experience for all of us!|5|We were celebrating an important family event and Hemenway's was THE place to dine. Our server was attentive, but not obtrusive. The food was wonderful-from the lobster bisque and N.E. clam chowder, entrees of swordfish, rib eye, and the tuna, finishing up with the cream brûlée, key lime pie and chocolate dessert. We will be back! The restaurant was even able to accommodate special dietary requests.
February 6, 2016|We had company from NY and they just loved it!|5|We had company from NY for lunch and choose Hemenways because it is always consistently good. Well weren't disappointed. Our guests loved the restaurant and the food! We had the pre-fixed lunch menu with choice of soup/salad and entree and coffee and delicious cookies. We had plenty to eat, the food was hot and of great quality! Thank you!
February 3, 2016|Always a pleasure|5|You can always count on Hemenway's for a business lunch. They are professional and courteous to guests. Food is always great.
January 31, 2016|Absolutely wonderful!|5|I have been here before..always excellent. My friend and I went after PPAC. We got a series of apps and salad..scumptious...oh so good.
January 30, 2016|Service|4|Food and service are always excellent however service was very slow during this visit. The waitress did mention that they were working off a new menu. The manager came by to apologize for the food prep taking so long. This was appreciated.
January 30, 2016|I have been dining at Hemmingway's for o...|2|"I have been dining at Hemmingway's for over 20 years and when asked what my favorite restaurant is I've always responded with ""Hemmingway""s"". It has been a year or so since I have visited and much to my dismay it was not a pleasant experience this time. Arriving early for our reservation, we decided to get a drink and appetizer at the bar. The scallops and bacon we ordered was cold and the shrimp was a little limp. After settling our bill of $120.00 we were seated at our table. The four of us placed our orders starting with fried calamari which would of been delicious if it was warmer the just above room temperature. I ordered 3lb lobster with mashed and again my food was barely warm. Same with the others in my party. Our waitress never came back during our meal, not even with black pepper. This is the first time I have ever had a bad meal at Hemmingway's. Not sure if I will be returning as I can spent my $420.00 and get better service at a number of restaurants in the city. I would also like to mention that our reservations were at 5pm so it was not very busy."
January 29, 2016|One table was loud obnoxious and inebria...|4|"One table was loud obnoxious and inebriated. While I'm up for a good time, they were screaming and cursing up a storm. I complained to manager expecting him to ask the table to bring it down. Instead he found it ""amusing"". Ruined our romantic night"
January 28, 2016|AMAZING|5|I planned a trip to Hemenway's for my a date night for my parents. They enjoyed it and could not stop talking about how amazing it was. They cannot wait to go back for another romantic date night.
January 24, 2016|a sure value|5|everything was good. steamers: top-notch. chowder, bisque: yum. seafood salad: generous and fresh.
January 23, 2016|Special Occasion Made More Special|5|Four of us went to a Saturday lunch at Hemenway's to celebrate my marriage to my partner of 19 years - two brides, one mother, and one minister. The staff had arranged our table in a quiet, scenic corner, decorated table with rose petals, and provided complimentary sparkling wine! They congratulated us warmly and could not have been more friendly and accommodating - even in a snowstorm that meant that two of our anticipated dining companions couldn't join us. Food was delicious, service spectacular, ambiance ideal. STRONGLY recommend for LGBT-friendly establishment and special occasions.
January 22, 2016|Dined here during Providence Restaurant ...|4|Dined here during Providence Restaurant Week. Service was prompt and attentive, but not intrusive. Dinner offerings were well presented, adequate portion sizes, and well prepared.
January 22, 2016|Our server Bill and really everybody wer...|5|Our server Bill and really everybody were wonderful. I had been before but my husband and my child hadn't....they loved it!!! We had a great night... Our meals were scrumptious and the dessert was so delicious.... key lime pie...
January 22, 2016|Great Experience|5|Hemenway's did not disappoint. My boyfriend and I decided to try Hemenway's because of their Restaurant Week promotion and I am very happy we did. From the moment we arrived, the service was amazing. They checked us in, took our coats, and showed us to our seats. Our waiter was extremely friendly and very attentive. I informed him of my food allergy and he said he would speak with the kitchen and make sure my food was prepared carefully. I even had two other employees come over to our table and ensure me that I would be accommodated. We started with the sesame-seared yellowfin tuna and it was delicious. My only critique would be that the portion was very small, but we could taste the quality of the tuna... amazing! I would also recommend the seafood casserole and the salmon as entrees- both were delicious. Lastly, if you are a coffee drinker- try their coffee! It was very fresh and is presented in a french press which made for a great flavor.
January 20, 2016|Great service!|5|Food was excellent; it almost always is! Service was really excellent this time. No long waits but didn't feel pushed either. Perfect table in a corner where it was quiet so we could talk. Definitely enjoyed the experience.
January 19, 2016|EXCELLENT all around. The food, ambience...|5|EXCELLENT all around. The food, ambience, attentive service. The tables are beautiful . 10 STARS !!! I love Hemenways for everything they do and do so well!.
January 18, 2016|Excellent service and ambiance. Food was excellent|5|Excellent service and ambiance. Our waiter was attentive, the food was very good and the pace between plate serving was perfect. Quiet enough to have a nice conversation.
January 17, 2016|GREAT PLACE|5|RELAXING ENVIORNMENT,ATTENTIVE SERVICE AND TASTY NEW ENGLAND FOOD
January 16, 2016|The dining experience was awesome, as al...|5|The dining experience was awesome, as always. The server was attentive and our lunch was fabulous. We took advantage of the restaurant week menu and that was a superb value!
January 15, 2016|Great food|5|The food was excellent and our server was friendly and nice. The New England chowder was the best I ever had thus far. The food was a little pricey but it was worth it! I would definitely go back again.
January 15, 2016|A little disappointed this time.|4|I love Hemenway's but I made the mistake of going during Restaurant Week so the service was simply not up to par. I told the hostess and the waitress that we were on a tight schedule, and we did manage to get out on time, but just barely. Our waitress was pleasant, but not very attentive. She didn't stay on top of the beverages; had to ask for refills on iced tea. Had to ask for bread for the table. Coffee was requested and never brought so we just left without having it. The food was good, but not stellar. I expect that was due to the huge crowds there for Restaurant Week as usually the food is amazing. The lobster bisque was awesome, as always.
January 15, 2016|Great restaurant week choice!|5|The dinning experience is always great there. The food is always wonder! Very good food portions. The service was impeccable! The waitstaff observed my dark colored suit, and asked if I preferred a blk linen napkin instead of the white one on the table to avoid any possible lint. Very attentive to our table the entire service.
January 14, 2016|a great all around seafood place|4|Food is great. Selection good. Not much simple seafood. Busy but easy to get a table.
January 13, 2016|Predictably excellent  food, service and...|5|Predictably excellent food, service and ambience .
January 13, 2016|Three of us had a delicious lunch during...|5|Three of us had a delicious lunch during restaurant week! The food choices were wonderful from the Caesar salad to clam chowder. All of us enjoyed the entree choices, grilled salmon, a perfect burger and scallops. We were also treated to yummy chocolate chip cookies for our dessert. Our waiter, Larry, was simply the best, so attentive, polite and very funny! We look forward to our next visit and it does not have to be restaurant week!
Dined on January 10, 2016|Great dinner|5|My husband and I had a wonderful dinner. We tried Heneways during Providence restaurant week and will definitely be back!
January 10, 2016|Pleasantly surprised|5|Hemenway's was a backup choice for Providence Restaurant Week when I learned another restaurant wasn't honoring the discount on Sundays. I hadn't heard much about this place, so it was a gamble at best. And we won! The meals were spectacular--wonderful tastes (such interesting combinations of flavors) and beautifully presented. Generous portion sizes, especially for their signature seafood casserole. Plenty to share around the table (and you MUST share--it's that good!) Desserts (chocolate mousse cake and creme brulee) and particularly smooth coffee were a wonderful way to end the meal. The whole experience was elevated by our wonderful and knowledgeable server, Morgan. She knows her menu AND the Providence (and greater Providence) restaurant scene. Such a pleasure to have her as our guide.
January 9, 2016|Wonderful Spot - A Providence Must|4|We've been coming here for 25 years and STILL love it. Great food, wonderful atmosphere, and reasonable prices. Ask for Bill as your server. He's an institution here and will guarantee you a fantastic experience!
January 4, 2016|Great spot!|4|I brought out of town family to this spot and we all had a great time and great food ! If you like seafood especially they have some great dishes. Ive always heard good things about this spot and now I know why. And to top it off you have a great view of the city!
January 3, 2016|Wonderful salmon special entrée elegantl...|4|Wonderful salmon special entrée elegantly presented with flavors that really blended well. Loved the lentils, too. Ahi grade tuna prepared to perfection, too. Half-priced wine night on Sundays a nice perk, too.
January 2, 2016|Food just okay - too peppery|3|Maybe it was the dishes we ordered, but we found our seafood to be over-seasoned and way too peppery on several levels. This includes the calamari, paella and the mussels. If I go back, I will order a plain seafood dish so that I could enjoy the taste of the seafood. Not sure if I will go back.
January 2, 2016|Pleasant surprise|4|"Nice setting, comfortable dining, great food and presentation. Front of the house professional and welcoming. Service did not match the rest of the experience. Waitress forgot our coffees, and refered to us a ""you people here"" ... Guess since she was not from this area did not feel connected to the local area. Polite and nice but not up to par. Would return......... Overall very impressive."
January 1, 2016|The food was good, nothing exceptional. ...|3|The food was good, nothing exceptional. The greeting was indifferent, the service ok. There was no feeling of doing or being anything special.
December 31, 2015|We visit Hemenway's a couple of time a y...|5|We visit Hemenway's a couple of time a year and we are always impressed by their service and food. It is a little pricey but well worth it. I have never had a bad meal the service is always on point.
December 31, 2015|Fabulous as always|5|Hemenway's never disappoints. Staff that's friendly, efficient and always seems to know when to approach the table or give another moment or two. Food is always fresh and delicious. Seafood lovers and steak lovers alike will find something perfect at Hemenways.
December 27, 2015|Excellent|5|Excellent restaurant, i was searching for a while. Everything was perfect
December 26, 2015|Sara Bomberger|5|We were a party of 6 and it was my daughter's birthday. Our waiter was wonderful, he explained the menu and made our birthday girl feel special. Everyone in our party were totally satisfied with their choices they made off the menu. We will definitely go back again...haven't been there in years.
December 24, 2015|Extremely loud maitre'd stand and restau...|3|Extremely loud maitre'd stand and restaurant. We had an assortment from the raw bar and an antipasto plate, both good. Out of the 3 entrees we had 1 overcooked, the grilled pepper shrimp were very dry and kale was bitter. At 7:30pm already out of 1 1/2 lbs lobsters, had to jump up to 2 1/2 lb lobster! Made reservation through Open Table, Hemenway's said we never showed and we had to file a dispute to receive points. Staff we saw/dealt with was not on point tonight! We will not return.
December 24, 2015|Seafood Heaven|5|This is one of our favorite spots to celebrate special occasions. As always, the food was outstanding and the service was incomparable. From the greeting to the goodbyes, everything was *****!
December 24, 2015|Christmas Eve Revisited|5|This was our 16th time dining at Hemenways on Christmas Eve and this evening was no different than the others with great food and great service even though our wait person thought it was too slow. She was very attentive at all times and was very friendly. We were familiar with her from previous visits. We had great scallops, alaskan king crab and steak along with wonderful salads and other apps. My scallops were superb! The drinks were excellent. We will be back again soon because we can never wait just for Christmas Eve!
December 19, 2015|Another good meal!|5|We had a great meal and got to the game on time! One of the party has some food restrictions and he was informed of ingredients and accommodated very well. We shared an antipasto appetizer and we all had fish or shellfish for our main meal. Very fresh and everything tasted great. Nice variety on the menu.
December 18, 2015|Great Food and Great Service|5|A friend recommended this restaurant and I am so glad that I went. The food was absolutely delicious and the service was great. The lobster mac and cheese was amazing and very filling. The Rhode Island clam chowder was great and the filet was mouth watering. I give this restaurant a thumbs up and would highly recommend it.
December 18, 2015|Excellent Dinner Choice|4|Always a treat - food was amazing, and the service and ambiance second to none.
December 18, 2015|Lovely Holiday lunch!|5|We had a wonderful Holiday lunch for our department. Everyone enjoyed the food and the view. Our server was very good and we all had a great meal.
December 15, 2015|Going away party|5|Our waitress was the Best. Food was awesome as usual and the Classic Bubbles were awesome. Will definitely revisit when I come back to Providence.
December 14, 2015|Christmas lunch|5|We had a very enjoyable lunch on Monday @ Hemenway's. We were seated by a window which I had requested on OpenTable when I made the reservation. We were three long time girlfriends out to enjoy a pre-Christmas lunch together and everything was excellent. Service was just right, appetizers, entree, dessert, wine, it was all very, very good. Our server, Maura was excellent and added to the overall experience. I've been here several times and have always been satisfied. Liked it so much we made a reservation for Christmas Eve/day.
December 12, 2015|Always a wonderful experience.|5|It always impresses me that you get a dark napkin if you're wearing dark clothes (no lint). It's this attention to detail that makes Hemenway's stand out. Oysters are wonderful and there's a great selection. Not only is the fish good, but the steaks are as well. Cocktails are inventive and there's something for anyone - served in old champagne-like glasses. I only wish I could eat more!
December 11, 2015|Excellent pre-show restaurant.|4|"My sister and I need to find a restaurant for dinner prior to attending a show at the Providence Performing Arts Center. Providence is so great for walking now, that I was able to park my car behind the theatre, and we walked over to Hemenway's for a 5:30 p.m. reservation. Our waiter, Mikolai, was excellent. We enjoyed salads first which was fresh and hearty. My sister order the salmon which we loved. I ordered the yellow fin tuna. Mine was very good, but I wish there had been more in the plate for the price and less white rice. The wakame on the plate tasted ""off"", and I unfortunately experienced indigestion for it throughout the night and into the next morning. The tuna itself was excellent. Overall, I think Hemenway's is a great restaurant, and I would go again."
December 9, 2015|Great food and services!|4|I really enjoyed the surf and turf that our server suggested. The oysters were good, but not super great for the price. I'd recommend getting the oysters during happy hour or just ordering an appetizer instead. Overall, the server was very kind, and I enjoyed my experience there.
December 6, 2015|First time visit|5|First time visit because of a gift card. Wine prices on the high side. Service, food, and everything was great. I would go again for special occation
November 27, 2015|50th Anniversary Dinner|5|Hadn't been at Hemenway's for about 20 years---since I retired from Textron. But, when our best friends 50th anniversary came around and we were going to be in Providence I didn't hesitate to take them to Hemenway's for a special dinner. It was a special evening, food was wonderful as I had remembered it, the atmosphere the same, and the service sublime. Diane, our wait person was terrific and made our evening.
November 25, 2015|Great food|5|One of My wife's favorite restaurants, the food is always really good..
November 24, 2015|terrific food and service!|4|love hemenways!! the consistency of food and service is reassuring.
November 21, 2015|Disappointing...|2|The restaurant has a strange layout - no matter where you stand you are in someone's way. The food is expensive for the value. My meal was okay but mediocre isn't good enough especially for the cost. The service was poor. We ordered sparkling water - got served table water. Ordered wine. It didn't come, didn't come, didn't come. Had to remind the waitress to bring it. Too noisy - I couldn't hear the other people at the table. I won't be returning.
November 17, 2015|Random choice, great find!|5|Immediately recognized this restaurant was not new to the locals and a very popular place! We were greated pomptly and seated in short order. Very pleasant and knowledable staff. The two of us were on a business trip and visiting from the mid-west. I have tried many seafood places all over the country, this is clearly one of the best. The presentation alone for the lobster mac-n-cheeze was worth the visit! Both seafood entrees were perfectly prepared and delicious! Rarely, do I leave a restaurant without some disappointment, except here. Perfect meal, perfect atmoshphere, very classy and a shinning star in Providence. Look no further for great seafood!
