Review Title|Review Date|Review Score|Review Text
May 11, 2013|Phenomenal food & service...|4|Phenomenal food & service... A little on the pricey side, but a great place for a special occasion.
May 11, 2013|Fabulous as usual|5|We go here whenever we are in the mood for awesome seafood. This was a special occasion so started with a bottle of Moet Chandon and then cherrystones followed by lobster and white chocolate mousse for dessert. All excellent as was our waitress. slmetimes we go just to sit at the bar or lounge area for a martini and their AWESOME cols seafood platter. A fabulous Waterfire Night place too.
Dined on May 11, 2013|Worth going back|4|There are dozens of excellent restaurants in town. This should be considered one of the top 10. Food, service and decor are very good. Nothing to complain about. It was a little loud but it was a Saturday night and you can't blame the management for the acoustics. I'll put this place in my regular rotation of places to dine. Prices are reasonable.
May 11, 2013|Excellent food and service|5|"Hemenway's is one of our ""goto"" places for the fancy dinner or Sunday lunch. We recently too my mother there for mother's day and got a lovely table overlooking the river. The only issue with the restaurant isn't with the restaurant, but parking. It's easy enough to park at the garage right next door and before the restaurant, but if you kiss it, you have to go down and around, which for some not familiar with Providence can be confusing."
May 10, 2013|Disappointed|2|Looking forward to a wonderful dinner - Started with oysters - bad choice- They were so small it , a few shells look empty - Do not understand how they would even serve them, .let alone charge for them. 2 out of the 4 entrees were ok - other 2 - fish dish and lobster - dried out - We used to love Hemingways- the atmoshere ,service and cocktails are still great - but the food is lacking - Unfortunately we won't be back
May 7, 2013|Good place for seafood|4|Everyone in our group of 8 enjoyed their entrees. A little more expensive than other places we dined at in Providence.
May 4, 2013|birthday dinner|2|the mussel appetizer was awful. The mussels were fishy tasting and soft. Too much salt was used on my meal ( mushroom ravoli) swordfish wasn't the best . Wouldn't go again.
May 4, 2013|Hemenway's keeps on giving...|4|We really enjoy our meals at this seafood restaurant in downtown Providence. Attentive service, great location, and good food are what we expect and what we continue to get.
May 3, 2013|Great fresh seafood.|5|The service was absolutely amazing. The food here is always good. This place always has very large lobsters in stock, 4-5+lbs.
May 3, 2013|Great Night Out|5|We had a great night out at Hemenway's for my wife and my dad's wife's birthdays. Great seat with a nice view, awesome service and fabulous food.
April 28, 2013|A Lovely Sunday Spent|5|We had never been to Hemenway's for lunch and we thought it was fantastic! Being Sunday, they only had the dinner menu, so it was a tad bit pricey. The food was perfect, and it was worth the expense. Additionally, out waitress, Debralee, was one of the best we have had anywhere. So incredibly knowledgable and well-stated. She had a strong understanding of the menu and gave very thoughtful recommendations, from the tea I ordered right down to the entrees. She is a cut above the rest and a definite reason to return. We will be back!
April 27, 2013|Food and service was excellent.|4|Food and service was excellent. Have not been here in a few years so I was disappointed in the menu change. Always enjoyed picking out a fish, swordfish etc and choosing how it was cooked. Now the menu seems to be just another Newport group resturant menu. That being said I will be back, hope they hear the menu concern.
April 27, 2013|My husband and I frequent|5|My husband and I frequent this restaurant not just for their amazing food, but especially for Bill, the server we request EVERY time. He makes our dining experience leisurely, pleasant and ALWAYS great.
April 27, 2013|Great Service and Food|4|They sat us right in front of the water-view glass, perfect! And the service was phenomenal, very caring and attentive. The options for food were all very tempting, we tried the Oysters Hemenway, Stuffed Steamed Lobster and the Seafood Boil. All were great dishes.
April 25, 2013|The restaurant has a nice|3|The restaurant has a nice atmosphere. We ordered cherrystone clams as an appetizer and they took quite a long time to arrive, but were very good. We also had to wait a long time for our entrees. It was a Thursday night and not particularly busy.
April 22, 2013|Any seafood item was OK. Waitress|5|Any seafood item was OK. Waitress was a work of art. Food on the plate was elegant.
April 21, 2013|my wife and I had a great|5|"my wife and I had a great dinner before we went to a show ""Rain"""
April 20, 2013|A group of four of us had|5|A group of four of us had an amazing dinner. Our drinks were delicious (my husband tried an Old Fashioned for the first time and our server provided excellent assistance with helping him decide whether it was a good choice for him).The King Crab appetizer and oysters on the shell were amazing. As was the tuna tartar. We each really enjoyed our meals--swordfish, seafood paella, and the filet mignon. We all agreed that the Caesar salad was one of the best we'd all ever had. To top it all off, Catherine, our server, was phenomenal. We will definitely be back!
April 20, 2013|Great Service & So-So Seafood|3|We went to Hemenways to celebrate my husband's birthday and had low expectations from what we'd heard and experienced in the past. Our server. Steve immediately cheered us up and he was amazing for the remainder of the meal. We ordered the calamari to start and a dozen littlenecks. Both dishes were perfection- the calamari was done Rhode Island style with hot peppers...and very very fresh! Our chowders were a little packaged tasting- like definitely not made in house. My husband's salad with cold shell fish was also mediocre and the shellfish was not particularly fresh tasting. The meal was not overly impressive, but the service was!
April 20, 2013|Good for Food Allergies|5|Delicious food, friendly and attentive service. The clam chowder was outstanding. The waitstaff, manager and executive chef were appropriately attentive to my food allergies without being overbearing. The setting was beautiful - as we dined, we watched a gondola going back and forth along the river.
April 16, 2013|Very stable restaurant for|4|Very stable restaurant for a good Seafood meal. Service staff that I have seen for 5+ years are still there. One of my favorites
April 15, 2013|Good food, service lags on a Monday|3|This was our third time at Hemenway's in the last year or so and it has become one of our favorites. This occasion was a rare Monday nite out and we were surprised by the number of people at the restaurant. Apparently Hemenway's was surprised too as the service was way off. Our server all but disappeared on several occasions. Food took a long time and even the check was a tedious process. I do recommend Hemenway's based on the quality of the food and past experiences, but they are now on double secret probation.
April 7, 2013|The food was very good. Our|4|The food was very good. Our waiter and the other members of the wait staff were outstanding!
April 6, 2013|A very happy anniversary!|5|We went to Hemenway's to celebrate our 4th anniversary the other night... F-A-N-T-A-S-T-I-C!!! We were greeted promptly and escorted to a romantic table overlooking the water. Our server was super nice and super attentive. Drinks were awesome. Pace was very unhurried. Steamers were ridiculously good. The George's Bank baked scallops were to to die for! The Paella was really good too. Our server provided us with a free dessert for our special night, and even presented it with a lit candle. We spent three hours in unhurried food bliss... I'm glad Hemenway's was a part of our special celebration!
April 5, 2013|We make frequent trips to|5|We make frequent trips to the Providence area, and Hemenway's is always at the top of our to-do list. It remains the gold standard for fine seafood restaurants.
April 5, 2013|Our server was exceptional.|5|Our server was exceptional. I will ask to be seated with Catherine next time I come As always love Hemenways.
April 4, 2013|When you want some scrumptious|5|When you want some scrumptious seafood in an upbeat setting, Hemenway's is the place.
April 4, 2013|The clam chowder was the best|4|The clam chowder was the best I have eaten in a while and the scrod was delicious. Our server was very friendly and responsive. A very nice restaurant. I would give it a thumbs up.
April 2, 2013|Our waitress, Annie, was almost|5|Our waitress, Annie, was almost too attentive but very efficient and friendly. This was our second time at Hemenway's (we live in MA) and we definitely would return again and again. The swordfish was done to perfection and the shrimp scampi was perfect...not over-garliced!
March 31, 2013|Outstanding food and service|5|Outstanding food and service from this fine restaurant in the Newport Restaurant Group. Food is always consistent and service is exceptional.
March 31, 2013|Our service was outstanding|5|"Our service was outstanding in spite of the restaurant being very busy. All servings were timely and we did not feel rushed. The chef special of crab and lobster stuffed salmon melted in your mouth, it was delicious.The key lime ""pie"" for desert tasted more like key lime cheesecake, excellent."
March 30, 2013|We have always been impressed|5|We have always been impressed with the Newport Restaurant Group. I am gluten free and Hemenways catered to my needs with great gluten free dinner rolls, specially made Calamari and overall expertise on each dish inquired about and ordered. The service was impeccable and the ambiance was great. Love this restaurant!
March 29, 2013|We had to wait a little while|5|We had to wait a little while for our table despite a reservation. However, the food and service were wonderful, and made up for the wait.
March 29, 2013|The service was exceptional|5|The service was exceptional and special attention was paid to presenting outstanding dishes. Great experience overall!
March 29, 2013|Everything was great from|5|Everything was great from the pace of which the meals were served to the food and service. There was good spoacing between meals so we didn't feel rushed and the food adn service was amazing. Well done
March 25, 2013|I ordered the scallops from|3|I ordered the scallops from the chef's special...scallops were cooked beautifully however the sauce was a little bit salty. Overall it was a great night. Thx:-)
March 23, 2013|The taste of the food varied.|4|The taste of the food varied. some entrees were excellent whereas others were not. my friend did not get hers packed as she said it was very salty. The lobster mac and cheese was amazing. The service was very good and attentive.
March 23, 2013|My husband and I are regulars,|5|My husband and I are regulars, due in part (largely) to Bill. He's the most amazing waiter we've ever encountered at any restaurant. (And we LOVE our fine dining) While the food is also great (never an issue) Bill is what keeps us coming!!
March 22, 2013|Disappointed in Providence|2|"Was excited to go to Hemenway's. Have enjoyed some good meals there before. This night, I was accompanied by my wife and two daughters. We had oysters and shrimp from the raw bar, ordered a nice bottle of wine and waited for our meal. And we waited. And we waited. When the meals finally arrived, the tuna I ordered (which was ordered ""as rare as you can possibly prepare it"" was cooked through. Not red, not pink, but white. I sent it back. My wife and daughter shared their meals with me while I waited for my dish to come back from the kitchen. Their fish was ok, but overcooked. Nothing special. And it should be for what they charge for their entrees. This night, the meals were average, service was slow and price was too high."
March 22, 2013|Always a pleasure to eat here|4|Enjoyed our dinner here as always Since they updated the menu it has become one of our favorite places!
March 21, 2013|We chose Hemenway's through|5|We chose Hemenway's through a recommendation from our hotel concierge (Providence Biltmore). We wanted something that gave us a sense of the character of Providence and Rhode Island, since we were first-time visitors. We were not disappointed. The food was excellent, and our server was superb. We each got the two chef's specials that night and were so glad that we did. And the local oysters are some of the best we've ever had. We highly recommend this restaurant to anyone.
March 21, 2013|Our waiter Bill was outstanding,|5|Our waiter Bill was outstanding, the food never disappoints.
Dined on March 21, 2013|A great way to end a busy day!|5|"Hemenway's is a downtown Providence favorite. Pleasant atmosphere, great service. We sat at the bar and it was totally enjoyable. Bartenders were on the ball and quick to attend to your needs. The food was ample and delicious. Great place for a business meeting, a casual drink or ""that special occasion"" and highly recommend. Parking is somewhat of a problem but valet parking is availalbe at a cost of $6 plus a tip (if so inclined). Parking is in the same building which makes it convenient."
March 17, 2013|Safe Gluten free dining|5|Hemenway's staff and chef were very helpful when my husband told them he needed a gluten-free meal. They do have a gluten free menu and that always lets us know they are aware of how the meal needs to be prepared and served. My husband asked a couple of questions and the chef came out to answer them. That is real service at it's best.
March 16, 2013|Great space and service|4|"When you want to go out to dinner with special people, Hemenway's is always a good bet. The space is dramatic and the view of downtown and the river during the daylight hours is quite wonderful. Service is always top notch and our server ""Bill"" was engaging, fun and professional. We have always found the food average. There were four of us on a very busy Saturday evening. We all ordered the Flounder special ($30) and it was okay but not great. Broccoli Rabe was cold (maybe that's the way it was supposed to be). We like to have dinner there, mainly due to the space and the service, but always go without great expectations on the food."
March 16, 2013|Disappointed in service -|3|Disappointed in service - ordered boiled 2 lb lobster and got baked stuffed at additional price because server kept saying it was their special. Manager said would adjust bill, but it was not adjusted when presented. First time ever had a problem here. Food is very good and that is why we return.
March 14, 2013|Upon entering hemenways the|5|Upon entering hemenways the staff was great. food server was the best. Food was best I have had in years. Mixed drinks were a little small, but the quality was top notch. Thats about it . Thanks.
March 14, 2013|Excellent food, great service.|5|Excellent food, great service. Definitely will return.
March 14, 2013|Steak was over cooked, didn't|3|Steak was over cooked, didn't receive the sauce for my steak even after they made it never got it. Mash potatoes were cold.
March 10, 2013|I had baked stuffed shrimp|3|I had baked stuffed shrimp and the shrimp was way overcooked - tough and rubbery. In addition, there was a vein in one of the shrimp so it was not even cleaned properly. Our first course of littlenecks and chorizo was very good.
March 10, 2013|Could have been better|3|The manhattan chowder was delicious. The seafood caesar salad was disappointingly ordinary - just cooked (boiled?), unseasoned seafood, put on a pile of romaine lettuce. The tea came in a pot which allows the tea to steep - very nice touch. The fried calamari was very good. My husband's Bloody Mary was not especially good - seemed watery. The rolls were ordinary.
March 9, 2013|terrible experience|1|Our table was tiny, the food was terrible, the service was terrible as well. The waitress never checked back after dinner was delivered so we didn't even have an opportunity to alert her. She never told us any specials, which I heard another waitress share with her tables. We been going here for years despite a 40 minute drive because we usually enjoy it so much, not sure if we will ever be back, things have changed.
March 9, 2013|I've been to Hemenway's many|2|I've been to Hemenway's many times and the other evening it missed the mark. The food was sub-par. Disappointed.
March 9, 2013|If you haven't been to Hemenway's|5|If you haven't been to Hemenway's in a while, you should try it again. The menu is fresh yet still has some of the long-time standards. And, all the food is good. Much of food is local sourced. So the good seafood that Hemenway's has had is no longer spoiled by those horrible salads they used to serve. Fresh, delicious food and wonderful service. Nice, grownup cocktail offerings, too along with good wine selections.
March 8, 2013|Have been coming here when|4|Have been coming here when in town for years And never disappointed
March 2, 2013|We started at the bar and|4|We started at the bar and moved to a table. Food was delicious and service was good.
March 2, 2013|Our experience started off|3|Our experience started off well. Our server was very knowledgeable in regards to the menu; she was able to answer several questions without hesitation, and was able to make excellent recommendations. Soon after we received our soup, a party of 14 was seated next to us. They also had the same server as us. Once they were seated, we saw our server once during the main entree and then one more time to take our dessert order. Other people brought out our main dish, took away our empty plates, and cashed out our ticket. Our original server did thank us and wished us a good night. We felt that the party of 14 took precedence over us, and that we were an afterthought to our server for the remainder of the evening. Our food was excellent!!
March 2, 2013|Have been to Hemenway's many|5|Have been to Hemenway's many times and am never disappointed. Food is always excellent, service wonderful. It cam be a little pricey, so I would save a visit for a special occasion.
March 2, 2013|This place is all ACES! Great|5|This place is all ACES! Great fish, Great service. Hemengway's will definitely be on the short list of places we dine when we are travelling through Providence again!
March 2, 2013|It is still one of our favorite|5|It is still one of our favorite restaurant in Providence. Very very good. Lunch is really worthy with a drink of cocktail....
March 1, 2013|We can't wait to go back!|4|We dined on a Friday night. Even though the restaurant was full, our request for a specific booth was honored. Our waitress Louise Burke was awesome in all aspects of serving us. We had a wonderful and relaxing experience. Oh, and did I mention the food, bisque, raw bar samplings, clams casino, lobster, steak and swordfish were generously portioned and tasted absolutely superb? We can't wait to go back!
March 1, 2013|good|4|We went when we were visiting providence. It got good ratings on open table. The food was very good but a little expensive. We will go back again when we are in the area.
February 26, 2013|nice place, food was really|5|nice place, food was really good,service very professional. The food is very expensive.
February 25, 2013|Always Reliable and Enjoyable|4|Food is always good here with a variety of cooking options for almost very menu item offered. There is experienced mature service staff that understands how to sell rather than “take and order”. The booths are very tight for a larger person. Request a table by the window, there are many to choose from with great views.
February 25, 2013|Terrific food and service.|5|Terrific food and service. The mixed drinks were refreshing. We will definitely be coming back and have already recommended it to friends.
February 23, 2013|I think we coughs them on|3|I think we coughs them on a bad night. Oysters hemenways no spinache, no onions for martini, my birth day not anniversary (stupid). Restaurant was out of mi first entree option even though we were the first table for dinner at 5:45. Manager walked around in circles all night but Stopped at only one table to see how things were ( not ours).
February 22, 2013|The food and service was excellent,|4|The food and service was excellent, especially the oysters. We will definitely visit again.
February 22, 2013|We had a very enjoyable evening|4|We had a very enjoyable evening with our friends because of the great company amd we all enjoyed our dinner, drinks, dessert and the fantastic service!
February 22, 2013|Always a great meal. Servers|5|Always a great meal. Servers are very gracious and you are never rushed to place your order. Concious of every detail-refilling water, need new napkin, etc. We have enjoyed many great meals here and will continue to come back.
February 22, 2013|My wife and I came here because|5|My wife and I came here because someone gave us a gift certificate. We both got the stuffed lobster and sirloin as our entree and the scallops wrapped in scallions and bacon for an appetizer. The ambiance was great for a romantic night for 2. I can't wait to go back.
February 20, 2013|Brandi was a wonderful waitress.|4|Brandi was a wonderful waitress. we were celebrating my daughter's birthday and everyone was very accomodating and welcoming. food as always was wonderful.
February 18, 2013|Lovely view, seafood was very|4|Lovely view, seafood was very good. Prices good for lunch and with their specials were very reasonable. Will definitely come again next time I'm in Providence.
February 17, 2013|Happy Birthday|5|Great meal and the staff was incredible. Celebrated birthday for my girlfriend. Great meal incredible service.
February 17, 2013|My wife's favorite...always|5|My wife's favorite...always good....service is great....food tremendous....expensive but worth it
February 17, 2013|First Time at Hemenway|5|This was our first time at Hemenways' we had a Gift Certificate which was given to us. It was a wonderful experience with great food and service! We will definately be back for future celebrations.
February 16, 2013|Hemmingways has always been|3|Hemmingways has always been our favorite restaurant to experience excellent food, outstanding service and fantastic people watching, untill last Saturday. My reservation time was 7;45, we were seated promptly, but we were brought to the dark room waaay in the back, which, we had no idea even exsisted, had we known, i would have made sure we were in the main room. Seating is too cramped, and too invasive. Our meal was excellent as usual, but we had to order drinks, appys, main meal all at once, the usual relaxed atsmosphere lacked, seating poor, and i noted the menu changed. This was a different Hemmingways from May, when we were there last. I found on this night, the cost of this evening was not worth the effort.
February 16, 2013|From the moment we checked|5|From the moment we checked our car, checked in with the Hostess station and were sat to a tremendous waiter (David), the experience was just the perfect balance of formality and hospitality. Service was timely, knowledge of the menu supreme and overall emphasis on us was unheralded. The salads, soup/chowder and entres were exquisitely prepared and as described! Great wine list and wonderful bar for consumers of such plus they offered non-alcohol options for all others. This was dinner for our first anniversary and 'the house' hosted us to a glass of champagne;quite unexpected and further evidence of the spirit of 'we are here for you'! Ambiance/atmosphere were elegant, warm and romantic simultaneously. Truly a restaurant to return to.
February 15, 2013|Most tender, melt-in-your|4|Most tender, melt-in-your mouth scallops I've ever had! I also had the stuffed shrimp which were to die for! Amazing food!
February 15, 2013|First time at Hemenways and|4|First time at Hemenways and we were very impressed. Food was very good, restaurant was quite busy that night but we never felt neglected by our waitress. Our only complaint and this was probably due to how crowded it was (Valentine's Day) was we were seated by the bar which as people started waiting for their tables got quite crowded and we felt like we were being observed. Would definitely go back there though.
February 14, 2013|Great dining experience.|4|Fantastic food. Server was very knowledgeable. Noise level was perfect.
February 14, 2013|Went for Valentine's Day dinner.|5|Went for Valentine's Day dinner. Very courteous staff that was attentive and knowledgeable. Food was excellent and well prepared
February 14, 2013|everything was very good-seated|4|everything was very good-seated within 15 minutes of our reservation considering it was Valentine's day I was happily impressed-over all a great experience
Dined on February 14, 2013|Def. a repeat experience!|4|Despite it being Valentine's Day and therefore very crowded, the service was excellent and the kitchen kept pace, and the food was wonderful as usual. This is the best seafood house in Providence. Our reservation was for 7 and they were just a bit behind, but within 15 minutes we were seated and in the meantime we went ahead and ordered our bottle of wine at the bar (quickly served) and were mellow by the time we ordered dinner.
