Review Title|Review Date|Review Score|Review Text
November 5, 2011|First Time Visit|4|We have recommended Hemenway's to friends. The food was outstanding alone with the service but it was a little noisey. The open table reservation was outstanding.
November 5, 2011|Our favorite Providence spot,|4|Our favorite Providence spot, terrific seafood menu and Chef's Specialties are consistently terrific. We always ask for Diane as our server.
November 5, 2011|Next door parking availability|4|Next door parking availability and service great. Food, service and cordial staff very good and nice. Look forward to returning soon in the future.
November 5, 2011|The service was outstanding.|5|The service was outstanding. Dinner specials were thoroughly explained. The food was absolutely top notch.
November 5, 2011|Our waiter was more than outstandin|5|Our waiter was more than outstanding. Service makes a dining experience, and he did a great job. Enjoy when server enjoys his job
November 3, 2011|Thank you so much for a lovely|5|Thank you so much for a lovely dinner. It was our 16th Anniversary. Our server Annie was so nice and very professional. We will request Annie for our next dinner at Hemmingways.
November 3, 2011|Still Pleasing After All These Year|5|"I live west of Boston, but had a business colleague staying in Providence and was meeting him for dinner. I had not been to Hemenway's in a number of years, so was hoping it was still a good place to choose...and I wasn't disappointed. My table was ready, and they made note of the fact that my colleague was 6'7"" and gave us a table with comfortable space. Our server Bill did a great job of describing the day's specials and highlighting things on the menu since we hadn't been there in a while."
November 1, 2011|I have dined at Hemenway's|3|I have dined at Hemenway's on numerous occasions and have always enjoyed the atmosphere, service and especially the food. At my last visit while the atmosphere and service were as good as always, the food was not. The entrees were overcooked and the vegetables undercooked. Any restaurant can have a bad day, and I feel comfortable in saying that Hemenway's is still worth trying.
October 28, 2011|Excellent!!|5|My husband and I went to Hemenway's for the first time last week after a recommendation from our neighbors. The food and service was excellent. I had the halibut with mushrooms over a bed of pine nut rice pilaf. The halibut was very thick and cooked perfectly...absolutely delicious! My husband had the 2 pound lobster stuffed with scallop and crab stuffing. His meal was pricy at $60, but it was sooo good! We also started off with the lobster ravioli appetizer....again, no complaints here. We will definitely return.
October 27, 2011|I love Hemenways but this|2|I love Hemenways but this was not a good experience. We had a reservation and even though there were roomier tables available in the dining room, four men were squeezed into a booth adjacent to the bar. Our waiter was adequate but not the most observant or attentive. I often order the crab/lobster appetizer as an entree and did so again this night. Although usually delicious, this night they were mostly bread crumbs, very little lobster and I could not find any crab. I was with business guests and didn't want to create an uncomfortable situation so I did not complain. I hope this experience is not an indication of where the restaurant is heading...
October 27, 2011|My husband and I enjoyed our|5|My husband and I enjoyed our time at Hemengway's. The food was fabulous and the service exceptional. We always experience a great time whenever we go to Hemenway's.
October 24, 2011|Just a great restaurant that|4|Just a great restaurant that I go back to again and again.
October 23, 2011|Great food and excellent service.|5|Great food and excellent service. Will continue to choose Hemenways for great food and an enjoyable dining experience!
October 22, 2011|As always, the meal, atmosphere|5|As always, the meal, atmosphere and service was outstanding. Hemenway's has been my favorite dining spot for special ocassions because I know I will always get an great meal with friendly, professional service. I have never been disappointed.
October 20, 2011|Who knew that Providence was|4|Who knew that Providence was such a rockin' place? Opentable suggested Hemmingway's on our recent visit, and it was excellent! Packed with customers, we were thankful for our Opentable reservation. We particularly enjoyed the light, flavorful seaful casserole. Great, fun, delicious evening!
October 20, 2011|First stop in Providence|5|When I am in Providence, Hemenway's is the first stop. The seafood is always fresh. The service has always been good to excellent. I have eaten here about 10 times in the past 5 years.
October 20, 2011|The Shellfish Tower is awesome|5|"I take my clients and friends to Hemenway's because the food is *always* fresh and delicious and the service is attentive but not intrusive. Don't be fooled into ordering the so-called Grand Shellfish Platter -- it's good but it's just a single plate of shellfish. Smart money is on the frequently overlooked ""Shellfish Tower"" an amazing double-decker feast which is buried in the middle of the seafood box on the menu with no adjective. If the platter o' shellfish can be called ""grand"" then the tower of shellfish needs to be called ""stupendous"" or ""ginormous"" or something worthy like that."
October 19, 2011|I thought the food was just|3|"I thought the food was just good - maybe better than good, but did not justify the prices. The hostess did not make us feel valued as we waited for a table - we did have a reservation, and, after asking us for the name in which the reservation was made and telling us she could seat us at a ""small table or shortly in the bar,"" she just let us stand around near the front door for about five minutes. The waitress, on the other hand, was very good. Overall, I did not think Hemenways was a good value - that is I did not think the food, service, and ambience justified the prices."
October 15, 2011|The restaurant was great.|5|The restaurant was great. The lobster was fantastic! The food was delicious and the servers were very helpful. A little loud for our taste, but that is probably because the place was packed. I would highly recommend reservations at least a week in advance - we booked ours about 5 days in advance and it was nearly completely booked.
October 15, 2011|Nice Seafood Spot|4|Really nice place if you love all kinds of seafood.
October 15, 2011|Always consistent, fresh seafood|4|Always consistent, fresh seafood with great oyster choices! Prices of the Fishermans Style lobster at $60 for a 2 lb lobster was very high.
October 14, 2011|The atmosphere was bustling|4|The atmosphere was bustling and festive. The food looked good but was a bit boring and flavorless. We had fun in any case.
October 10, 2011|My wife and I decided to dine|4|My wife and I decided to dine here for the first time on our anniversary during the week. I was a little unhappy with the table they chose to seat us in but figured since it was out first visit to this establishment we would not make a fuss. The choices on the menu all sounded good to my taste buds. Our server was very attentive and the food was delicious. hopefully on our next visit we get a seat by the window...
October 9, 2011|The food was excellent, the|5|The food was excellent, the waiter was xavier and you know if I remember his name that he has to be good. I was there for my anniversary and plan on going back many more times than just special occasions. I have already recommended it to all my friends.
October 8, 2011|This was our first time at|5|This was our first time at Hemenway's and we loved it. My husband surprised me for my birthday. The food was excellent although I did not get exactly what I ordered. The restaurant was out of a side on one of their specials. I would definitely recommend to anyone looking to go out on a special night as it is a bit pricey for everyday.
October 8, 2011|Very nice place for a night|4|Very nice place for a night out. Well worth your time and money.
October 8, 2011|great food, friendly service,|5|great food, friendly service, excellent food recommendations
October 4, 2011|EVERYTHING is perfect, me|5|EVERYTHING is perfect, me and my fiancé LOVE it!!!!
October 4, 2011|Never Disappointed|5|Hemenways never disappoints. Food and service were good.
October 3, 2011|Everything was okay. Service|3|Everything was okay. Service is best if you sit at the raw bar the guys there are all very nice and entertaining. Place needs a major update to the interior.
October 3, 2011|Food was very good, delivered|4|Food was very good, delivered to table within minutes of being prepared. The restaurant itself is poorly divided,and seems a bit over crowded with table placement, although the scenic view of the river and Providence skyline is spectacular from the western side of the dining area. A suggestion would be to place the smaller tables toward the windows with the larger, group tables and booths toward the street. I does seem to need more space.
October 3, 2011|I arrived at 5:00, early for|5|I arrived at 5:00, early for a business dinner, I had a great value.
Dined on October 2, 2011|My Husband and I had a great|5|My Husband and I had a great nite at Hemenways, We recommend it,everything was great!
October 1, 2011|I have dined at Hemenway's|5|I have dined at Hemenway's many times and never been disappointed. The food is amazing! The mussel appetizer is the best anywhere - and I've ordered mussel appetizers at restaurants all over the country. The service is efficient. The staff is helpful without being intrusive and our wait person was well informed on food allergies.
September 30, 2011|We had an 8:30 reservation|2|We had an 8:30 reservation on Saturday night, arrived around 8:PM, sat at the bar, and never got a table! We ended up eating our dinner at the bar, unfortunately.
September 30, 2011|We have eaten there several|5|We have eaten there several times and the food has always been excellent, and the service good. The spacing makes it a good place to talk.
September 25, 2011|Great for special occasions|5|My wife and I have been going to Hemenway's to celebrate her birthday for the last five years. They have always exceeded are expectation. The food is terrific and the service is excellent. I would highly recommend this restaurant for any special occasion.
September 24, 2011|Thank You Hemenways!|5|I go to Hemenways for special occasions... Birthdays, valentines day, etc. Every single time I have gone I have got nothing but top quality service, excellent food, and great drinks! This is by far my favorite place to go! If you haven't tried it yet, please go and do yourself a favor! It's a little pricy but definitely worth every penny!
September 24, 2011|Gloria|5|Great service. We had a great romantic table by the window, and the food was devine!!!!
September 20, 2011|Was there on 9/21/11 for a|4|Was there on 9/21/11 for a business dinner. Our waitress wasn't that skilled but okay. The Point Judith Flounder dish was excellent in terms of flavor but the flounder was a tad overcooked. Calamari app was great. Ceasar salad was adequate but not anything special. I will go again and would recommend it. On balance it is a good spot.
September 20, 2011|Excellent seafood night.|4|Excellent seafood night. Great window street on the park with fantastic fish. Lively energetic interior.
September 15, 2011|Excellent food and Excellent|5|Excellent food and Excellent Service! Thanks Annie!
September 10, 2011|GREAT GREAT FOOD!!!!!|5|AWESOME!!!!! Hands down the best seafood I have had! the Swordfish was ecxellent! the Calamari was superb! My husband enjoyed his meal as well! Good service, great food!
September 10, 2011|noise level a major drawback|4|Nice view for Waterfire. Food was good although a bit pricey. Service was very good. Noise level was very unpleasant but masked the fact that small children at the next table were screaming at each other. They were pretty much drowned out by the overall noise level in the room.
September 10, 2011|FABULOUS FOOD, SERVICE & AMBIENCE|5|Wonderful restaurant, excellent food. Can't say enough about the service as well, Catherine (Cat) and Lana were terrific. We had lunch outside and loved it so much returned that evening for dinner. Wish it was closer, if so we'd be there weekly.
September 4, 2011|GREAT|5|WE CAN ALWAYS COUNT ON A GREAT EXPERIENCE EVERY TIME WE DINE AT HEMENWAY'S.
September 1, 2011|It's a good restaurant - food|3|It's a good restaurant - food is good, service is good. However, for the money, you can do better. It's good, not great.
August 26, 2011|Best Seafood in RI!|5|Hemenway's is a Rhode Island treasure. Not only do I eat here with my local friends, I also recommend it for my out of town clients and family. Every person has always come back and said it was one of the best meals they have ever had. The service is fantastic and the seafood is so fresh.The crab & lobster cakes and calarmari are a meal alone and great to share with friends. Be sure to ask about the specials. There is always something special on the menu to enjoy!
August 20, 2011|If you Love good, fresh Seafood,|5|If you Love good, fresh Seafood, then Hemenway's is the place to dine. Our experience was wonderful; it was our 23rd wedding anniversary and everything was well taken care of. The entire staff was very nice, our waitress Louise was Awesome; she took care of everything for the evening.
August 20, 2011|The waiter we had was fantastic,|5|The waiter we had was fantastic, very knowledgeable about the menu and wine list. Food was out of this world good. We've been there quite a few time and will go back again
August 18, 2011|It was good, but not exceptional.|3|It was good, but not exceptional. Service was adequate - I had to ask for bread and it did not come unitl I was done with my salad. I had the special of the day which was a swordfish dish that was very good, but my dinner companions had a poor shrimp scampi and an adequate lobster ravioli.
August 15, 2011|We had a table that looked|4|We had a table that looked out on the river. Very pretty. And quiet because we were away from the large crowded tables. Good soup. Excellent oysters.
August 13, 2011|Food was very good...service|4|Food was very good...service not so much. Took 2 1/2 hours for Dinner. Was a water fire night so that might have had something to do with it.
August 8, 2011|Fine, not great|3|Provides a good range of seafood in various preparations (plain to reasonably creative). Quality is fine but created no 'wow' reactions in our party and does not meet the expectation created by the high pricing. The atmosphere, too, is louder and more informal than the restaurant's reputation and self-portrayal would suggest. If you want many choices of seafood, even in the off-season, this is a fine place. But in the summer most good restaurants in RI have great seafood selections, and there are many better (and cheaper) restaurants in Providence than Hemenway's.
August 6, 2011|Our party of four enjoyed|5|Our party of four enjoyed a wonderful dinner at Hemenway's on Saturday evening. The striped bass special was, indeed, special. The ceviche elevated the dish a notch and was a very nice touch.
August 4, 2011|We sat at a window table overlookin|5|We sat at a window table overlooking the canal in Providence. It was lovely and I loved that the restaurant had family groups as well as business diners and handled everyone the same way. Our waiter had great suggestions for food and wine and we loved it all:) Can't wait to visit Providence again and eat here...
August 4, 2011|Good but not Great|3|We were there on a nice summer day. Nice spot outdoors. Service was great and food was good.
August 3, 2011|It's been about 25 years since|5|It's been about 25 years since I was last at Hemenway's and it's even better than I remember. I hadn't been in Providence in a while and was surprised to see they are still in business! It's as good as Boston seafood eateries, but at least 20 percent cheaper. The special Halibut was out of this world. I hope they stay in biz for another 25 years!
July 23, 2011|the seafood that we ordered|3|the seafood that we ordered could have been fresher.
July 23, 2011|Waiter was very good. Food|4|Waiter was very good. Food excellent- nice portions for rest. week. Only thing was all fans were going and it was a little cool in the rest.--was supposed to be very hot out but wasn't so bad but i guess they put all fans on in case.
July 21, 2011|We had a reservation and waited|4|We had a reservation and waited about 20 minutes - but it was restaurant week - so I kind of expected. Everything was great: food, waiter, bartender & hostess. I would definitely go back again... and again~
July 20, 2011|Hemenway's food and service|5|Hemenway's food and service made our dining experience very enjoyable. The food was fantastic and the waiter, Bill, was very knowledgable and helpful with making our selections.
July 19, 2011|Have been here before and|5|Have been here before and this time went for restaurant week lunch. Service was fantastic as usual. Our meal was delicious and despite ordering from the restaurant week menu, it didn't taste mass produced (which often occurs at many high end restaurants).
July 18, 2011|Nice restaurant. Beautiful|5|Nice restaurant. Beautiful view of the city! Charming atmophere! I like it!
July 17, 2011|Disappointed return|3|"I recently dined for the fourth time at Hemenway's and had a disappointing evening. Outside of the still fantastic Caesar Salad, the dishes I and my companion ordered were all bland, or a combination of over- and under-cooked items. Undercooked Asparagus, over cooked Salmon, ""ranch"" style blue cheese without any flavor, bland and thin bacon-corn chowder with the flounder. Prior visits had left me quite happy with the Cioppino, Caesar Salad, and calamari."
July 16, 2011|Our reservation was for 5:00|5|Our reservation was for 5:00 and it was quiet when we arrived by the time we left it was very busy. We were there to enjoy the water fires... perfect location.
July 15, 2011|Always the freshest seafood|5|Always the freshest seafood in a beautiful location.
July 15, 2011|Haven't been in this restaurant|2|Haven't been in this restaurant in 5 years and has gone downhill.
July 13, 2011|Great food. Service was not|4|Great food. Service was not that good, but it looked to be limited to our waitress.
July 13, 2011|Pretty good food but service|3|"Pretty good food but service was a little off because of ""Restaurant Week."" Lots of workers are there for their lunch breaks.. so be sure to dress a little nicer."
July 11, 2011|it was great. however we still|3|it was great. however we still had to wait 30 minutes even though we had a reservation and the there was a mix up with our credit card and another table's.
July 10, 2011|Good Food.... service ok.|4|It was a birthday celebration and the waiter did not bring out the bunt cake I had ordered to sing Happy Birthday
Dined on July 9, 2011|This restaurant was very busy,|3|This restaurant was very busy, but we were seated very close to our reservation time. The service was very good generally. Unfortunately our food was pretty awful. My entree was so salty that I couldn't even eat most of it (and yes, I like salt). My teenage son will eat almost anything, and even his food went largely untouched. Also he ordered a bowl of clam chowder that was never delivered. The bread and salads were good.
June 25, 2011|Server was great. Food as|4|Server was great. Food as good as always. Had nice table by window and watched the gondola go by and the sun set. Always can depend on a nice dinner and this time to celebrate a 93rd birthday for our friend.
June 20, 2011|Hemenway's is always good|3|Hemenway's is always good - was there for a business lunch and it worked well
June 19, 2011|Excellent service and great|5|Excellent service and great food. Busy but the server was attentive, interested and helpful. Would not only recommend it but would go back again if in the area (it is about 25 to 30 miles from where we live).
June 19, 2011|Excellent food and service|5|Excellent food and service from this fine restaurant
June 18, 2011|The only fault to this restaurant|5|The only fault to this restaurant was that is was SOOOO loud!! But besides that the food was fantastic!
June 18, 2011|Outstanding Food and Service|5|Came on an early Saturday evening with my family. The dining experience was one of the finest I've ever had. From the attentive staff to the outstanding food, this is an exceptional restaurant that raises the bar for fine dining in Providence.
June 17, 2011|This was our first time to|4|This was our first time to Hemingways. The food was cooked just right. The service was outstanding. Nice atmosphere with a good view of the river and city from most seats. Definately worth a visit.
June 11, 2011|Waiter was great, reception|5|Waiter was great, reception was wonderful, gave are booth we requested. Food was outstanding.
June 10, 2011|The staff was attentive. The|4|The staff was attentive. The food varied. The appetizer was great. The entrees were ok. The potatoes were just luke warm. We haven't been there in a long time. We were given a gift certificate and we thought we'd try again. Making the reservation online was terrific. And the table was waiting for us when we arrived.
June 10, 2011|Great dining experience, comfortabl|5|Great dining experience, comfortable atmosphere. The waiter was well versed in the courses and types of oysters and my husband was so pleased with the fare he ordered up another round. We sampled several things and everything was delicious. It was a fine night out.
June 4, 2011|The first and only place we|5|The first and only place we think of for a special occasion or a couples getaway.
June 4, 2011|My husband ordered the monkfish|3|My husband ordered the monkfish which is served in a simple lobster broth w/ diced red potatoes. The portion of fish was decent but for the price I would have expected at least more potatoes. It was bland overall.I ordered the baked stuffed lobster which had scallops and crab meat.The lobster was overcooked unfortunately but it was lobster so it still tasted good. I couldnt help but think about the lobster roll I had recently that was a 1/4 of the price and cooked much better. I was really dissapointed with the lobster, at 60 dollars all I ask is for the lobster to be cooked well.The side I chose was the parmesan vegetable risotto which was far from a risotto,it was more like a pilaf.The 3rd star is for dessert. Not a place for real foodies
June 2, 2011|The Seafood Platter is a gem!|5|Seafood platter makes a great meal! It's listed as an appetizer for 2+ but it makes a really superb entree. Service was attentive without being intrusive.
June 1, 2011|Being made to wait five minutes|4|Being made to wait five minutes when we had a reservation was not nice.
May 29, 2011|We went here for my son's|5|We went here for my son's graduation from Brown. We were a party of 10, but had two more people added to the party before we arrived. The hostess couldn't have been more accommodating. We had two waiters, both were very attentive. Thanks for a great experience.
May 27, 2011|One of our favorites in Providence.|4|One of our favorites in Providence. Great oysters and fresh seafood.
May 21, 2011|Disappointing!|3|We had heard good things about Hemenway's so I booked it for a graduation luncheon. I ordered the Lobster Mac & Cheese and it was on the small size but what bothered me most was that there were only 2 rather small pieces of lobster in it. For $30 it was outrageous. The mac & cheese wasn't anything that special either. Two others with us got a special of 3 stuffed shrimp and a lamb chop. It wasn't a typical looking chop and it was very small and mostly all bone. The meat was supposed to be cooked medium and it was more like rare. There was such long waits in between each part of the lunch (apps/salad/meal) that we didn't send it back because we didn't want to wait any longer. I've been to other restaurants in Prov. that were far better.
May 18, 2011|Great place. Amazing seafood|4|Great place. Amazing seafood on the expensive side.
May 13, 2011|Always a treat, the waitstaff|5|Always a treat, the waitstaff is friendly, upbeat and helpful, the atmosphere is casual and elegant, but best of all the food is fresh, delicious and made to order for those with special requirements. What is not to like!!
May 13, 2011|This was the first time dining|5|This was the first time dining at Hemmingways even though we grew up in Rhode Island. We were looking for a great seafood place and we found it. Our server Tom was great and really set us up for a good meal. He suggested the 5lb stuffed lobster for the two of us and we loved it. He also suggested a beer (I dont remember the name) that was like a blue moon and that was also great.
April 30, 2011|She loved the tuna salad and|4|She loved the tuna salad and she will send it back if it's slightly over cooked. I had stuffed sole which was nicely done with an interesting cranberry walnut stuffing. She had raw oysters as well which she also liked very much, large and clean, from near Bristol RI. We also tried the macadamia shrimp with an amarreto sauce that I thought was to die for. We each had a martini, no wine, and the bill was under $100. We were pleased.
April 28, 2011|Great place with great service|5|Great place with great service abd great food!! Definately would put that on my list of places to return to when in Providence.
