Review Title|Review Date|Review Score|Review Text
May 26, 2012|The food is very good. Portionds|3|The food is very good. Portionds are too large but meat perfectly prepared, pastas are fresh and sauces delicious. The restaurant is loud and the decor is dated but good food always prevails. Service was attentive but wine knowledge is very limited.
May 24, 2012|just at my husbands 50th reunion...|5|just at my husbands 50th reunion....................happy memoris at Camilles
May 22, 2012|went on an off night (tuesday)|5|went on an off night (tuesday) so it wasn't crowded, the bartender was a dream, cute, funny and really kept us entertained, The food was exceptional, I had a salmon special served only in May and October, I'll be back soon
May 19, 2012|What a fabulous neighborhood|4|What a fabulous neighborhood gem! Exceptional service, great wine & the menu is very interesting and tasty. My only complaint is that we were there for a graduation weekend special dinner and without and notice they changed their menu to a VERY small version of the menu that is on their web site and upped their prices. Many of us didn't get the food we were so excited to try after seeing it on the menu. Overall a very enjoyable evening.
Dined on May 19, 2012|We enjoyed our lunch - the|4|We enjoyed our lunch - the only problem was the menu was very different from what was posted on the website. We had a small group and I chose the restaurant by the reviews and the lunch menu. The menu for our lunch was much more expensive than anticipated and not what we expected.
May 18, 2012|We went here for the first|4|We went here for the first time on my birthday. I had a great night and was very pleased with the food, service and ambiance. I would highly recommend this restaurant to others!
May 18, 2012|Great Romantic Night Out|5|Camille's food is wonderfully prepared. My husband and I have been very pleased each time we have gone. Their Veal Camille is outstanding!!! Excellent service!
May 18, 2012|Very expensive for what we|3|Very expensive for what we got (~$40 an entree, with one entree even $65), and the food was quite rich, with large portions (felt kind of 'weighed down' afterwards). Went here for a friend's birthday, and the ambiance was pretty appropriate. Servers were a bit overly attentive, but very polite. Didn't even look at the dessert menu after seeing what we got for what we paid for our entrees, and headed over to Pastiche instead.
May 17, 2012|Great Dining Experience|4|had a terrific dining experience for our anniversary. The food and service were particularly enjoyable. Will continue to eat at Camille's again.
May 13, 2012|Very elegant---much too dark---coul|3|Very elegant---much too dark---couldnt read the menu. Hate dark restaurants, would not go back because of that reason alone. Fine for someone else. Also, hard to park. I don't like valet parking---even if it's free. I dot want a stranger in my car---ever.
May 13, 2012|This was Mothers day. The|4|This was Mothers day. The menu was very limited. The food choice was good and the food as always was very good. Service was very good. Nice touch with a plant for the mother.
May 12, 2012|simply amazing food and service.|5|simply amazing food and service. You can't beat this place on Federal Hill!
May 11, 2012|Great meal, and great lounge|4|Great meal, and great lounge scene after the meal. Wonderful music and dancing.
May 10, 2012|Surprise Birthday Lunch|4|Went there for lunch to celebrate a birthday. The lighting inside seemed a little dark for lunch, but otherwise the food was very good and the service was excellent. Would go back again, but probably for dinner.
May 9, 2012|Excellant food and great service|5|Excellant food and great service for a group of 13 made this a night to remember. Great impression made on clients. Would recommend and will return.
May 5, 2012|Excellent service from valet|5|Excellent service from valet parking to the wait staff.
May 4, 2012|Wonderful Meal with Don Corleone|5|Since moving here a year ago, we've been looking for a go to restaurant that lives up to Provdence's reputation for great Italian food. Camille's was a great find. The food was excellent and the whole restaurant experience seemed authentic. The dining room doesn't turn into a disco at 10 (something we've found more than once on Fed Hill) and we enjoyed a great meal in the elegant yet comfortable environment. We'll be back with Friends and Family for sure.
April 30, 2012|My Go To Spot In Providence|5|Incredible food and service. I've been here many times before and it just keep getting better. However, this last time they did have these great new high end wine selections by the glass. Ruffino Gold by the glass? That's awesome. Can't wait to go back. If you haven't tried this place out, do yourself a favor.
April 28, 2012|You will be amazed!|5|The food, the ambiance, the staff at Camille's was amazing. Food selections are plentiful from seafood to pastas to meats. Great wine menu and dessert selections. Staff was extremely friendly and accomodating. We made reservations through Open Table and were seated immediately! Had put on the special comments when booking the reservation that we were celebrating an annivesary and a birthday. We were completely surprised to see arrive at our table a complimentary dessert plate for both the anniversary and birthday. HIGHLY RECOMMENDED!!
April 28, 2012|Food, service and ambiance|4|Food, service and ambiance was wonderful. We were celebrating a birthday and a anniversary and everyone was very pleased and satisfied. Will definitely return!
April 27, 2012|I have eaten there freuently|2|I have eaten there freuently in the past They recently said they were overhauling the place - so i decided to see I saw no changes I ordered veal francesse - it was veal mush Never again
April 24, 2012|Service was the best, food|5|Service was the best, food was enough to feed the NE Patriots
April 20, 2012|Federal Hill mainstay|5|This venerable classic on Federal Hill has lost none of its traditional appeal while adding modern twists to its menu. Our waiter was both professional and personable. He was knowledgeable and passionate about the cuisine and effusive in his attention to our children. We had a great meal and a fun evening.
April 19, 2012|We were celebrating our 15th|5|We were celebrating our 15th wedding anniversary -- i had requested Table #44, and that requirement was met. We did, however, have a loud group in the corner behind us and at several points it was difficult to hear each other. The dinner was awesome, and our server, scott, didn't miss a beat. It was a wonderful evening, and we will certainly return. In July 2010, we had our daughter's rehearsal dinner at Camille's (20 people) --everyone loved it, and the service/food were great.
April 19, 2012|Our whole experience at Camille's|5|Our whole experience at Camille's was outstanding from our greeting as we walked in by the the maitre dee to the excellant service from David and his assistant. The food is goumet all the way. We appreciated everything and we will definitely be back.
April 14, 2012|The Best on the Hill!|5|It was our second visit the first being in Feb. 2012 and it will certainly not be our last. The food is outstanding and the service is first class. As a matter of fact I know consider Camille's as my favorite restaurant.
April 13, 2012|Best calamari we've ever had...|5|Best calamari we've ever had... It is basically the main reason why we returned and they did not disappoint! Great meal.
April 7, 2012|Wonderful experience|5|My husband and I went to Camille's for his birthday and we were thrilled we did. With so many good choices on federal hill, I was nervous choosing a restaurant I hadn't eaten at before...but we were not disappointed! The service was great as was the food. It is pricey, but I am happy to spend the money when the food and service are worth it, and both are he case with this restaurant. Would highly recommend!
April 7, 2012|Very attentive service, beautiful|5|Very attentive service, beautiful ambiance, excellent and consistent dishes, waiter really knew his stuff and had the abundance of specials memorized....minor critique though, waiter interrupted too much the table conversation at critical juncture points and barged in without tactfully saying excuse me or something like that...zeal for being so attentive is probably the reason, which is something that is trainable or manageable - waiter was Michael - but overall, he did a superb job
April 5, 2012|Will return!|4|Very good dinner. Worth the money. Drinks were excellent! The wine list is extensive. The only complaint is that the large-party tables are very wide so you feel like you're too far from the people across from you to have a conversation. I would recommend requesting a round booth. We particularly enjoyed the chicken egg drop soup and seared sesame tuna special.
March 31, 2012|Absolutely outstanding experience.|5|Absolutely outstanding experience. Highly reccomended
March 31, 2012|Second Time Around and Still Great!|5|This was our second visit to Camille's. The first time was so enjoyable that we brought friends along. We thoroughly enjoyed ourselves. The food was excellent and the portions large. The wine list is extensive. The wait staff provides helpful hints and suggestions. After dinner we managed to find a table in the lounge and spent several hours dancing to the sounds of Tribeca while enjoying cocktails. A very enjoyable night - We will be back!
March 27, 2012|Birthday Party|5|Four of us had dinner - celebrating some birthdays. Service was impeccable, food was fantastic!
March 23, 2012|Fantastic place. Our Favorite|5|Fantastic place. Our Favorite in Providence. I only wish we lived closer to Providence so that we could dine here more often. Great staff and great service. Food is outstanding
March 22, 2012|Great experience|5|We had a group of 7 and to a person we had great food, a great wine at a great price that was recommended by the waiter and service that was unobtrusive but thorough. My coworkers and I are on the road 3 days a week so we eat out frequently. This is now our designated spot when we are in Providence. The creme brulee was one of my best ever.
March 17, 2012|Outstanding in every way,|5|Outstanding in every way, the meal was delicious, service was impeccable, the live band was phenominal. We can't say enough about our fabulous evening at Camille's!!! We'll be back to try more entrees on the menu!
March 10, 2012|The resturant was beautiful|4|The resturant was beautiful and great customer service. The food was excellent. I would defintely reccomend it to others.
March 9, 2012|This is our second time to|3|This is our second time to Camille's. Each dinner had exceptional service from the waitstaff. The food is good, but pricey for what it is.
March 7, 2012|Consistently Perfect|5|Camille's is one of my go to spots when I'm in the city. My wife and I love this place because every time we go it's the same great food and service you had the last time. You really can't go wrong here. Generous portions and a wine list that certainly won't bore you. I'll be back.
March 6, 2012|"The meal ""sealed"" the deal!!!"|4|"Business dinner at recommendation of customer. Perfect meal, great service without being a ""bother"""
March 3, 2012|My wife and have visited Camille's|1|My wife and have visited Camille's once a year for the past 4 years as she does a travel show up in this part of the country each March. We have always enjoyed the food but the service gets worse and worse. The bartenders are clueless - I waited for 20 mins to be served. I understand if it was busy, but there were 3 bartenders and maybe 4 people max waiting to be served. At dinner our waiter took approx 25 mins to come to our table to take a drink order. At the end of the meal he gave us free dessert. With this offering I decided to leave 20% (he was getting 15 prior to this) and I felt I got attitude that it wasn't enough of a tip. The service is downright awful. STAY AWAY. Plenty better places to eat in providence.
March 3, 2012|Decent food, frustrating wait|4|"I made a last-minute reservation at Camille's because we wanted to see the band playing there. We requested to be seated in the lounge. We got there at 8:15 for an 8:30 reservation. We were not seated until about 9:30, and several times we would see a table open up, and see a couple (who had arrived AFTER us) be seated. Eventually we made a little noise to the ?manager (Mike, I think) who was very nice, and eventually got us a table. So the wait was frustrating, and it felt like other people had ""ties"" and were able to cut the line. But ?Mike was very nice and tried to help out. Once seated, we had a good meal. The food is heavy, but tasty. My penne alla vodka was delicious. My fiance's shrimp scampi with linguine was not great."
March 3, 2012|Food at Camille's was great|2|Food at Camille's was great but the service was horrid. We waited 45 minutes for our table after being told we should be seated in about 10 and waited another hour and a half after placing our order to eat. Reservations were for 8:30 we finished eating at midnight!! This is a place where who you know really matters. The Maitre'D was seating people before us who he knew on a first name basis....not a good business tactic.
March 3, 2012|Amazing Food. Great atmosphere.|5|Amazing Food. Great atmosphere. Shrimp Prosciutto was amazing.
Dined on March 3, 2012|Experience a dinner of a lifetime!|5|This was a fantastic dinner that I will long remember. My wife started with an eggplant and veal rolotini which she simply loved. I started with the Scampi alla Santiago, which is like crack with a fork. The shrimps were large and succulent, grilled to perfection and finished in a Sambuca drizzle - out of this world! My better half enjoyed the (veal) Saltimbocca alla Romana, for which she was thrilled with every bite. I ordered a special, the (swordfish) Club Steak, which is a thick center cut swordfish steak served ofer asparagus and whipped potatoes with crab legs on top. All in a creamy butter sauce that was delicious. I took my time and savored every morsel. I cannot overstate how phenomenal the food was at Camille's. We will be back!
March 3, 2012|The only real issue is that|4|The only real issue is that a party was very close to us with 2 children under the age of 2. This restaurant is not geared to children, and most diners do not want children running around the restaurant when you are trying to enjoy a very good meal. Excellent chef and knowledgable and friendly wait staff.
March 2, 2012|My new wife and I enjoyed|5|My new wife and I enjoyed a very private dinner together with wonderful food. The wait staff was exceptional, very concerned with our dinning experience. After dinner we spent a couple of hours dancing in the lounge with music from Tribeca. We will definitly be back again.
March 1, 2012|Five Star|5|Top notch service. Food is outstanding. Portions are generous. A very romantic place for a night out. Can't go wrong here!
February 25, 2012|My husband and I were recommended|4|My husband and I were recommended to Camille's and we had a great time. The food was excelent and our waiter Phil was friendly.
February 20, 2012|Excellent is all that I can say!|5|This is one of our top three favorite places to visit in the country. No kidding. We try to get here several times a year. we live about an hour plus away so we have to plan the evening out. But when we want some of the best food that we have ever eaten we come here. Looking forward to our next dinner with the wonderful staff at Camille's!
February 20, 2012|Can’t wait to visit again!|5|We wanted a nice lunch to finish out our three day weekend in the Providence area and we were not disappointed. The service was excellent and the food was outstanding. When my husband and I decided to split a salad (and we were glad we did, based on the portion size) the waiter presented the whole salad then re-plated it for us. We have found this type of service in traditional Italian eateries with experienced staff. The seafood was perfectly prepared and the sauces were a great accompaniment. The valet parking and easy access to I-95 help make our visit to Camille’s a relaxing experience. Can’t wait to visit again!
February 18, 2012|The dinner at Camille's was|5|The dinner at Camille's was the best I have had! Everyone at our table of 8 was very happy with the food drinks and service was excelent. Live music in the bar area was very fun. I can't wait to go back!
February 18, 2012|Not as classic or special|2|Not as classic or special as the older version. Too much like all the other places on Federal Hill.
February 18, 2012|The shrimp scampish was very|3|The shrimp scampish was very good.. The veal Camille needed more sauce and prociutto and cheese. The brownie su dae for dessert was good. The waiters were friendly and attentive.
February 18, 2012|The food was outstanding.|5|The food was outstanding. Our table was a bit small and in a main thouroughfare when we requested through our reservation to have a quiet table. The service was great.
February 15, 2012|The decor is very inviting,|2|The decor is very inviting, a bit dark but clean. The food left much to be desired. We both ordered the special, which was sole with one shrimp served with mashed potatoes and green beans. The green beans were the only good part of the plate. The mashed potatoes seemed to have been day old. Very dry and pasty. The fish and the shrimp were heavily coated in breading and pan fried, then covered in a heavy sauce that just made the breading soggy. I do not recommend the restaurant, especially if that was the daily special.
February 14, 2012|We loved the feel of the place,|5|We loved the feel of the place, it was dark and relaxing but romantic and very impressive. I would definitely would return. The bread was good, so was the calamari. It went well with are drinks, the bartender made a very good margarita. I had the chilean sea bass with lobster mashed potatoes and broccoli rabe which was to die for, and we also had the sole with the best asparagus and parmigiano potatoes. The service was well-timed and friendly, and the drrinks were affordable. We had a few questions about a dish on the menu and the waiter was very informative.
February 14, 2012|Went for valentine's day food|5|Went for valentine's day food was delicious with good presentation. The service was good with friendly servers. The feel of the place was intimate with just the right amount of noise.
February 14, 2012|Dined on Valentines day and|4|Dined on Valentines day and was dismayed to find they had a limited menu. I should have known but didnt see it advertised anywhere. Had the chilean sea bass and it was so good. Girlfriend had lobster ravioli and they were excellent. Had nutella crepe for dessert and was one of the best things i ever ate.
February 14, 2012|Prompt and attentive service.|5|Prompt and attentive service. Great decor. A pleasurable place to dine.
February 14, 2012|Ask for Justin|5|Ask for Justin Mcdaniels as you server! Professional and on the ball. Great server.
February 14, 2012|I took my wife to Camille's|5|I took my wife to Camille's for Valentine's Day dinner. The lighting in the restaurant was warm and romantic. Our dishes were prepared as we had requested. The presentation of the food on the plate was thoughtful and artistic. Phil, our waiter, was extremely helpful in our wine selection. He was very attentive but not intrusive to our dining experience. The food was exquisite from appetizer to dessert. I was very impressed and intend to return again. I would highly recommend this restaurant.
February 14, 2012|Wonderful restaurant in all|5|Wonderful restaurant in all respects. Food fabulous,service attentive and friendly and price reasonable for quality. Great place for a special occasion or just a fabulous dinner.
February 13, 2012|The food was delicious, and|5|The food was delicious, and the service was outstanding. Great wine list. Very enjoyable experience. We will definitely go back the next time we visit Providence!
February 13, 2012|The atmosphere was delightful.|5|The atmosphere was delightful. Perfect for our romantic dinner. The evening was very slow paced because it was the night before Valentine's day.
February 11, 2012|This was my first experience|5|This was my first experience at Camille's. Our server, Justin, was excellent and the food was delicious. I'll be back.
February 10, 2012|My boyfriend and I loved the|5|My boyfriend and I loved the food and drinks. For food I ordered the chicken parmigiana. It was very tasty and had left overs for lunch the next day. The Absolute Doli is a delicious drink to try. Our waiter was amazing. Philip was attentive and friendly.
February 7, 2012|Really enjoyed it. Large portions|5|Really enjoyed it. Large portions and great service!
February 4, 2012|One of the best resturants|4|One of the best resturants in Rhode Island. Very consistantly good food and service. On Saturday nights cool music group in lounge to dance to. Fun place.
February 4, 2012|This was our first time visiting|4|"This was our first time visiting Camille's; it offers very good food, excellent service, and a very nice Federal Hill setting. I ordered a veal ""porterhouse"" steak; my only complaint was that there was more bone and fat than meat, although the meat was tasty. The veal came with potatoes and vegetables--very nicely done--and the caesar salad was excellent. My husband ordered the house lasagna and an appetizer special that included crabmeat and was very pleased with both dishes. Portions are large at Camille's; we noticed a number of other diners taking leftovers home. The service we received was excellent--friendly but never obtrusive."
February 4, 2012|The restaurant was lovely,|3|The restaurant was lovely, higher end Federal Hill. The food was excellent, servers skilled and polite but, the service very, very slow. Dinner at 6:30 and we did not walk out until 10:00PM due to wait.
January 27, 2012|Party of 6 had a great time.|5|Party of 6 had a great time. Food and service was excellent!
January 21, 2012|Everyone at Camille's from|5|Everyone at Camille's from the coat check lady to the manager are friendly and efficient. Excellent service. Good drinks. OUr group had cocktails and wine and were very happy. Great food and not overly pricey. the decor is fun (leopard carpet) but not over the top. Very comfortable place to enjoy dinner with friends. The valet parking is another plus. We've been there twice recently and will be going there again!
December 31, 2011|We went on NY's Eve so the|4|We went on NY's Eve so the menu was limited but the service was excellent as was the food.
December 31, 2011|Consistently good, good service|4|Consistently good, good service on a very busy holiday night, we really enjoyed our New years eve!
December 31, 2011|Had been 10 yrs since i had|4|Had been 10 yrs since i had enjoyed Camilles, won't wait another 10..staff and food excellent
December 30, 2011|First Visit|5|We showed up 5 mins before our reservation and were told they were setting our table, we were seated minutes later. The ambiance was very nice and the wine list was excellent. We had questions on the menu and everything was thoroughly explained. We had sea bass, veal, and pasta primavera. Everyone enjoyed their dish. Desserts were ok. All In all it was a great experience and we are definitely going back.
December 30, 2011|An institution on Ffederal|5|An institution on Ffederal Hill. Consistantly good. Kudos to Mike Degnan!
December 27, 2011|The four of us had an outstanding|5|The four of us had an outstanding experience at Camille's as none of us had been there before. The service was beyond outstanding - Fernando took excellent care of us. Everyone should try this restaurant at least once in their life! Excellent!
December 20, 2011|My friends and I had a Christmas|4|My friends and I had a Christmas lunch at Camille's. The service was outstanding and friendly. The valet was wonderful to deal with also.
December 19, 2011|We went for our Anniversary|5|We went for our Anniversary on a Monday night, the week before Christmas. There was a party event going on upstairs and just a few people in the dining area. It was very quiet and romantic. Just the right atmosphere for a delicious dinner and celebration.
December 19, 2011|Finest restaurant in Providence|5|Camille's continues to be one of the finest restaurants in Providence. Service, food, ambience are all what you might expect from a romantic, cozy restaurant, but Camille's makes even the regular night out a special occasion. It's also a perfect place for a peaceful, relaxing lunch. It's simply wonderful.
December 16, 2011|Nana Has always wanted to|5|"Nana Has always wanted to eat in the Italian section of Providence. One of our friends recommended Camille's and we were truly not disappointed at all. This evening was ""all"" about our 87 year old matriarch and she LOVED every moment. The food, the background music, our server David, the whole staff make Camille's a wonderful establishment. We all truly enjoyed our evening."
December 8, 2011|Best Service, Wine, Italian Food|5|Always a safe bet. This December visit, Camille's was full of holiday parties and the atmosphere was up-beat. Service for our little table of two was spot-on as usual despite the holiday crowd. Citrus-laquered sea bass was the big winner tonight, it went great with the Ceretto Arneis Blange from the wine list...and what a wine list. The best-picked selection of Italian and American wines in Providence, no matter how much it changes it always seems taylor-made to the menu. With the food their chef puts out, and the way this service staff takes care of you, I don't know why anyone would go anywhere else on Federal Hill.
