Review Title|Review Date|Review Score|Review Text
October 29, 2013|Its get better with every visit|5|I have been to Camille's numerous time both in a business group setting and also on romantic get away dinners (from the kids). From the moment you arrive being greeted by the Valet the tone is set for an excellent evening. We have always been seated promptly by the managers and greeted timely by the extremely knowledgeable wait staff. The food is consistently fresh and delicious. I cant say enough about how professional and unassuming the staff is. What a far cry from most restaurants that have staffs that are not seasoned. Their motto is ask and you will receive. I've already booked my next reservation
October 29, 2013|Fantastic restaurant!!|5|Everything from the food, service and wine list was great as usual!!
October 26, 2013|Overated|3|"I have been to many great restaurants in Providence and I was not happy with Camilles. I believe this restaurant is only popular in name and that it has been around forever. My pasta was overcooked to the point of breaking into pieces on my plate, not what you would expect from an Italian restaurant. My wife had one of the specials which was ""ok"". With so many better choices around the area, it is safe to say I will not be returning to this establishment. One other comment is I am surprised at the reviews that they have received. Not even close to 4 or 5 stars. Maybe Trip Advisor should have a spot for people to put what level of restaurants are they used to. If you frequent Applebees for dinner, than this place is 5 star all the way."
October 26, 2013|Very Nice|4|Camille's was very busy on a Saturday night, Reservations a must we had a short wait for our table but Mike the host bought us drinks and dessert for our Anniversary al in all very nice place.
October 25, 2013|Appertizers were descent.|3|Appertizers were descent. Sever was ok, but I think he had too many tables to attend so he was running up and down and our order was mixed up. Restaurant food is fresh , however it had no taste. Too expensive for the service and the food taste.
October 25, 2013|Expensive but Worth It Overall|4|Good food and great service but be warned - everything is ala carte. The waiter asked us if we wanted soup or salad with our entrees without telling us they were extra so the bill was a bit of a surprise at the end.
October 23, 2013|Will not return|3|I guess I came too eArly. But the amount of time I waited for a menu, bread, water, wine etc.... Was unacceptable. I saw three to four waiters talking with each other while I was sitting there waiting for a menu. When I got the menu, I hit two wine menus and had to wait again for the food menu. Food was good, nothing special though. I had the veal chop which was their special but it was ordinary....huge though
October 22, 2013|Twenty five years later|5|"I love the ambiance of this place. You walk up a few cobblestone steps and are greeted by a very large ""old"" door. The initial entrance has an old world charm. It isn't until you walk through a hallway where you will see a more modern decor. The waitstaff is extremely professional and knowledgeable. The appetizer of shrimp and prociutto was out of this world as was the Arancini (risotto balls). My husband had the chilean sea bass and I had the filet mignon. Each entree was a very sizable portion with potatoes and vegetable on the side. We were both too full to have dessert but the choices were amazing. My only regret was waiting 25 years to return to the place we had gotten engaged."
October 22, 2013|First time back at Camille's|5|First time back at Camille's in a while, and they haven't lost a beat. Food and service right on point, one of the best bottled wine lists in the state. Shrimp Fra Diavolo was phenomenal, as was the Pio Cesare Barbaresco. Dessert crepes are still a home run. We will be going back soon!
October 21, 2013|Great food, friendly attentive|5|Great food, friendly attentive service, what is not to like
October 18, 2013|Best Overall Restaurant|5|Camille's is the best overall restaurant I have been to in a long time. Every meal; from appetizer to dessert was excellent. The ambiance is beautiful and Steve, our server, was the best waiter I have ever had. We are visiting from out of town znd can't wait to come back.
October 18, 2013|Always a Treat|5|Camilles always delivers. The food, service, ambiance and decor combine to deliver the best Federal Hill has to offer!
October 12, 2013|Fantastic Service, better food!|5|"The service is second to none, the wine selection is wide, and the food is outstanding. If you are meat inclined, the Pork Osso Buco is the best I've ever had (and that is NOT an insignificant sample size)! When looking to dine on ""The Hill"" don't overlook this staple in Providence..."
October 12, 2013|Best restaurant experience|5|My wife and I were celebrating 6 years together, and i have to say it was one of the best experiences we have ever had. The food was amazing...so much food...the entree plates were gigantic servings, the service was by far the best we have ever had, our Server Steve was awesome, helped us out with an amazing bottle of wine, and the managers and rest of the staff were so nice. I recommend this place for anyone going out for a romantic night out. It was amazeballs!
October 11, 2013|Bravo Providence|5|From the very knowledgable valets to the friendly wait staff to the best calamari ever Camille's will have you covered! Superb food and exceptional service!! Bravo! We would like to thank Dan (perfect breakfast in Smithfield x2 & Columbus Feast on Sat) to Louie (Waterfire parking wa awesome) thanks also to Gary & ? At the front who made our daughters feel special and not to forget Jason who served us all with his RI accent with flair and patience BRAVO!!!
October 7, 2013|Delicious Food - Excellent|5|Delicious Food - Excellent Presentation - Spectacular Wine List - Personable Attention - And a Facility with History
October 5, 2013|Absoutely Awesome|5|Have been here before and Camille's never disappoints. Had relatives in town and wanted to show off Providence. Camille's hit the bulls eye. Fabulous atmosphere, fantastic food and service beyond expectations. Thank you David.
October 5, 2013|Dinner|4|Camille's has the old-world feel of a European restaurant. My husband and I were there for my birthday. Service was excellent. The Pasta Fagioli soup was the best I ever had! We had a 6pm reservation and did not have to wait, although the restaurant was already crowded. We each had one of the specials which were delicious. It was an expensive evening out but well worth the money.
October 5, 2013|Wonderful Experience|5|Spent the night in Providence with my husband for a quick get away. We were extremely pleased with Camille's. From the moment we walked through the door we were treated like royalty. The service is like none other and the food was amazing. Our server offered suggestions which were wel received. Can't wait to visit again.
September 28, 2013|FOR EVERY OCCASION MY HUSBAND|5|FOR EVERY OCCASION MY HUSBAND AND I CELEBRATE AT CAMILLES, WE HAD OUR REHEARSAL DINNER HERE AS WELL. BEST PLACE IN PROVIDENCE!
September 23, 2013|Italian food at its best!!|5|"Camille's is that restraint that you Must go to if you are ever in providence RI , We were there for a convention. Our group decided we wanted Good Italian food!! We asked the concierge at the omni.. They suggested Camille's.. I lookeed it up on Open Table, saw the menu and the reviews and had to go!! We were so delighted with Camille's. The staff from the waiter to the manager made us feel like we were ""home""!!! And the food was beyond delicious!! The lasagna was to die for, the lobster bake was out of this world! The ambiance of Camille's is beautiful and romantic.. The manager was so kind... He did something very special for us, and I want to say thank you for the ride!! You are a true gentleman!!"
September 18, 2013|Amazing|5|My husband and I come here once a year for our anniversary. Always delighted, food superb. The wait staff and host extremely kind. We actually forgot to bring cash for the valet parking. We tried to park our own car as we did not have cash for a tip. However,, the fellow parking cars said he had to park our car. We explained that we did not have cash to tip him so therefore we would park on street. The person was just so kind told us no worries even thou we were feeling quite embarrassed. As we were ready to retrieve our car, we again offered to get it as we had no cash. The fellow wished us happy anniversary and did indeed get our car.
September 17, 2013|Like old Italy|4|This was like stepping back in time to old Italy The food was outstanding if you like tractional Italian food with heavy red sauces The wine list was very nice and the service was good, but slow One of the original Federal Hill icons, this place is like stepping back in time
September 16, 2013|best. dinner..ever!|5|Took my boss to Camile's last night. The entire evening was incredible. Beyond all expectations! We will be back again and again!
September 14, 2013|Camille Review|4|The service was absolutely outstanding and made you feel completely at ease. The food was also beautifully prepared and tasted pretty good. The ambiance was romantic and elegant, definitely a perfect spot for dates and/or anniversary celebrations.
September 14, 2013|perfect night|5|food, service, everything about this restaurant was perfect.
September 13, 2013|excellent house gravy|4|Top notch food and wait staff. Just need to turn the lights up a bit in the dining room. Always have a great special list and the menu has great range of food.
September 7, 2013|Top Shelf menu and food|5|Dinner on Sept 7, 2013 - the fish special was outstanding and the pork chops with peppers, a regular on the menu was excellent - wait staff very professional - would suggest they indicate price of specials since the fish special was a bit pricey.
August 30, 2013|timeless|5|Camille's scores high in every category. The atmosphere is what I would call relaxed elegance - beautiful surroundings, upscale and elegant without pretentiousness or stuffiness. The service is impeccable - our waiter that evening was Joseph. Even the location tucked behind the Old Canteen on Federal Hill has a romantic timelessness about it. Be sure to have an appetizer - their calamari, stuffed portabello and stuffed artichokes are all delicious.
August 30, 2013|Fabulous service and great|5|Fabulous service and great amount of food for your money! We ate so much we had to take a walk area Federal Hill area before we could enjoy the band in the bar area! It was a wonderful time!
August 30, 2013|Great food/great service|5|We have been to Camille's several times, and I can never decide which I like better: the food or the service. We had a delicious meal, and it's incredible how far everyone at this restaurant will go to please the patrons. the hard work and effort of all staff is commendable.
August 27, 2013|Camille's|4|Very very good Italian meal calamari with peppers was outstanding. Seafood de pesce was very good and my friends rib eye was great. Portions were abundant and priced accordingly. Wine list was very expansive from $30 to $2000 a bottle. Our wait staff and maitre d were some of the best well versed in the meals , specials and making us feel welcomed. Highly recommended on Federal Hill area of Providence.
August 24, 2013|We go to Providence once a|5|We go to Providence once a year and after trying other places, we now only eat here. It's the best.
August 22, 2013|Great Dinner|4|Dined with friends and thoroughly enjoyed 4 different appetizers and 4 different entrees. All were great - thanks again!
August 15, 2013|Our Favorite|5|This is our favorite Providence restaurant. We celebrated our wedding anniversary on Thursday night. Everything was perfect. Service and food is always great.
August 15, 2013|Worth A Trip to Providence|5|We started coming to Camille's a few years ago when we had a stopover in Providence. It has now become part of our annual trip to Cape Cod. The food is excellent as is the service. The regular menu is great, but the specials are incredible. No wonder it has been in business for almost a Century.
Dined on August 14, 2013|It was as though being transported|3|It was as though being transported back in time, a good old Italian eatery. The food was good, nothing out of the ordinary. The ambiance was quiet, neat and clean.
August 10, 2013|The managing and wait staff|5|The managing and wait staff were friendly, courteous and undoubtedly enjoy their jobs. The food presentation was as beautiful as the flavors cooked to perfection. The fried calamari is outstanding! It was a Saturday night, there was live music in the lounge which attracted more patrons after the dining hours.
August 10, 2013|Fine dining experience|5|Started with the beet salad,could have shared. Then on to the main course which was a special. 16oz.grilled veal chop with a wine reduction sauce. It was cooked to perfection and would melt in your mouth. My friend had scallops and he was very impressed. We both had enough food for another meal. We will definitely go back and hopefully real soon.
August 9, 2013|highly recommend|5|I took my wife for our anniversary and had a good time. The food was great and the service was outstanding. Everyone on the staff including our waiter Al were great. If it is a Friday or Saturday stop by the bar scene and enjoy. Good restaurant for that special occasion.
August 8, 2013|Awesome!|5|"Proposed to the now Fiance here, loved the food. Can't say enough about the food. Felt like the ""North End"" in Providence (which is a huge compliment in my opinion, and it is Federal Hill area after all). I usually take her to Capricios but wanted to try something new. Such a great restaurant for a special occasion. Really friendly staff, even made a great suggestion about a craft beer they were serving (FoolProof Brewery IPA). Can't praise this fine establishment enough! Thank you, Thank YOU!!! for a great evening."
August 7, 2013|Food and Service was excellent|5|Brought a business associate here from ou of town. The service and food was exceptional. Waiter was attentive but overly intrusive. The appetizers and meal were skillfully prepared and well presented. I won't hesitate to come back.
August 3, 2013|Saturday Night Dinner|4|My wife and I were very happy with our last minute selection of going to Camille's for dinner this past Saturday night. The portabella mushroom appetizer was absolutely delicious. I had the the lasagna, while my wife enjoyed the salmon and both were excellent. We topped off the dinner by splitting a very tasty creme brûlée. First time we visited Camille's and will ensure we do a return trip!
August 3, 2013|classy|5|As soon as we arrived the Valet was there to greet. We were seated promptly. The drinks and food were awesome and well priced considering what we ordered and how much they provided. Two thumbs up for class,ambiance, as well as great food.
August 3, 2013|Great night|5|great food, loaded with ambience, loved the outside very cozy and inviting. lasagna was excellent, sea bass special was excellent, special zucchini flower appetizer was amazing! from NJ but can't wait to go back!
August 3, 2013|Great meal|5|Went for an early dinner to Camille's on a Saturday night to celebrate my mother's 90th birthday, and she was not disappointed. We had the beef carpaggio with caperettes appetizer special, amazingly tender and delicious. Then the sole, shrimp fra diavolo, and pasta Bolognese dinners. All were outstanding. Took some home to leave room for dessert: tiramisu and lemon fruit tart both wonderful. The wine list is extensive. The service is very attentive and friendly here, old-school charm. Our waiter Damon was terrific. We'll be back to Camille's for sure!
August 2, 2013|We had a great experience.|5|We had a great experience. One of my favorite places to go for a special occasion.
July 31, 2013|A Special Lunch|5|To mark the end of vacation, my wife and I had lunch on the outside patio at Camillle's. It was a warm day and a Wednesday so we had the patio and the service of our waiter to ourselves. Our meal was excellent. We split an appetizer(Cauliflower Sunflower) and we both had a pasta dish. My wife had a very tasty Chicken Francese and I had the Gnocchi Serantino complimented with a meatball. We both had wine. Although a little on the expensive side, the wine was paired well with our meals. You do not do lunch like this often, but it was well worth the trip and the expense. Additionally, Michael D. remembers everyone and makes you fell welcome.
July 27, 2013|GREAT SERVICE|5|Excellent service - Waiter was very knowledgeable and gave us time to relax between each course. I called at 7:00 to change my 8:00 reversation to 8:30 and the manager did it with no problems. Been here many times - Food is always excellent, service is great and portions are huge!!!
July 27, 2013|Dinner out|5|The food was excellent. Our waiter David was exceptional. His service was wonderful and made our evening even better. We will return again soon. Also later in the evening we enjoyed the E-Water Band. A great group to listen too and dance too
July 24, 2013|Had a group of six. Our waiter|4|Had a group of six. Our waiter was the first waiter in several days that actually knew their menu and what was in their dishes. Outstanding guy. Camilles is on a side street in Federal Hill. Beautiful restaurant, great ambiance. My sea bass and lobster mashed potatoes were outstanding. Two that had the sole said it was a bit dry, but OK. Another had the lamb chop which was outstanding. Expensive, but worth it. You could take anyone here but kids - romantic dinner, business dinner, casual dinner for two, etc.
July 19, 2013|Girls night|5|My best girl friend and I had a dinner date here to celebrate restaurant week and catch up. Everything thing from the point we walked in the door to the moment we exited to even on the outside was phenomenal. The staff was incredibly friendly and was so genuine on making sure we had a great experience. I had visited Camilles before with my family for special occasions and was always thoroughly impressed! My favorite dish on the menu, by far, is the chicken parm. This item was my recommendation to everyone I knew and my expectation whenever I went anywhere else, but of course no one else could compare. On that night though, the chicken parm was good but not as amazing as I had remembered it. The whole experience was amazing though.
July 19, 2013|I brought special people to|4|I brought special people to the restaurant which has memories for me.Jack and Camille were friends.The ambience ,the server, the food were all very good.I would recommend CAMILLE'S WITHOUT RESERVATION!
July 17, 2013|Great dinner|3|We picked this restaurant for a night out during restaurant week in Providence over the summer. I did the prefixe menu but my husband did not. It was a great meal with fantastic service. I would definitely go back for a nice night out.
July 15, 2013|When we arrived it happened|5|When we arrived it happened to be restaurant week and they had a special menu for the occasion. The food was very good and the service was outstanding. The staff was friendly and they made you feel special. My only complaint was with the cannoli. The shell was soft which meant it was filled too long ago.
July 13, 2013|Excellent Service & Food|4|London was our server and he was excellent. Even drove us home at the end if the night which was a nice touch. Everyone was very friendly. Food was really good too. Nice atmosphere.
July 13, 2013|Food and service was very|4|Food and service was very good. Wine was overpriced.
July 11, 2013|Great food, efficient service|5|Went here for a date with my boyfriend. Complementary valet, awesome appetizers and entrees. I would go back for a special occasion!
July 10, 2013|Yummy Italian-Fed Hill|4|We went for restaurant week. Wine was delicious, as were the lobster ravioli!
July 6, 2013|Our first time here and it|5|Our first time here and it was wonderful. The food and service were outstanding. Our waiter recommended a few items that were delicious. Definitely try the veal if you go. They also have an extensive wine list.
July 6, 2013|Great food, service and more|5|Joseph was our waiter and he was wonderful The food was great We will be back for sure
July 6, 2013|great food and service|5|this was our second time for a special occasion. and again they did not dissapoint. everything was cooked to perfection, even with our large party of 15 people, the service and the food was top notch. will definately return
June 29, 2013|Service and decor nice|3|Nice service and decor, but food off the menu a bit ordinary. The specials described were interesting creative combinations but a bit rich for our tastes. So, we ordered off the menu. The food had excellent fresh ingredients of top quality, but somehow the preparation was ordinary. Excellent waiter, very honest helping us avoid needless duplications. Not inexpensive.
June 28, 2013|Too quiet and pretentious|3|Italian should be more friendly and casual. Too stuffy and overdone for my taste. Food was good but the portions were ridiculously large,
June 26, 2013|Wonderful Time|5|"It has been a while since I had been to Camille's and I wanted to celebrate a special occasion with my daughter. The food was outstanding...and the service stellar; wonderful wine suggestions and great ambiance to celebrate in style! I couldn't have asked for a better ""mom/daughter"" night out and won't wait so long to return to Camille's!"
June 22, 2013|We went for our anniversary|5|We went for our anniversary and it was NOT a disappointment. From the moment we arrived until we left everything was just wonderful, the food mouth watering, the service impecabile the ambiance great!!!!!
June 22, 2013|Camille's was the epitome|5|Camille's was the epitome of fine dining. Server was attentive but not intrusive, a wine list that has styles, types, brands and prices for every pocketbook or wallet. Quality of food phenomenal as well as choices. Generous size servings as well. After dining in many of Gordin Ramsay's restaurants I can tell you that the experience of dining at Camille's was equal to those restaurants without the price! Thanks to all for a wonderful romantic dinner and fine dining experience.
June 21, 2013|not great|2|We were very disappointed. The waiter took forever to even come over to even get drink orders and took forever to even get our food. We actually put in our food order when he finally came to get our drink order. The steak was over cooked, the chicken parm was over fried and the sauce had no flavor. The veal in the veal francese was chewy. The salads we had barely had any dressing and we could not ask for more since the waiter never came back again to check on us. Will never go here again when we go back to providence and will never recommend.
June 14, 2013|Camille's surpasses expectations|5|The white salmon dish over rabbi and cannelloni was outstanding. The service was impeccable. One of my favorite places on the hill. The garden is now open also.
June 8, 2013|Camille's never disappoints!|5|We went to celebrate my husband's birthday and in true Camille'as fashion we had a great meal and excellent service! Food, service and atmosphere made it a special evening.
June 6, 2013|Exceptional|5|The best overall restaurant we have ever been to. A real gem.
June 4, 2013|Excellent service, menu, and|5|Excellent service, menu, and food. Even the bread was delicious.
June 1, 2013|Visited Providence - recommended|5|Visited Providence - recommended by friends in Newport & Boston - lovely, great service, more food than we could eat. My only commnet; If you don't try this place - your missing an outstanding restaurant.
May 23, 2013|Meal was Great|5|Our kids gave us a gift certificate last year and we finally used it for my birthday. The food was amazing. From the appetizer to the main course to dessert. We had the following. Scampi Alla Santiago Cassoulet Di Osso Buco Di Maiale Gamberetti Scampi Stile O Fra Diavolo Crème Brulee. We were not disappointed with anything. Portions were large, so we were able to go home with leftovers. I would definitely go back. Thank you for a wonderful dining experience.
May 18, 2013|Food was outstanding!!!!!!|5|Food was outstanding!!!!!! Staff very knowledgeable about the menu. Wine and drinks excellent. Is a little pricey but totally worth every cent!
May 11, 2013|Best Italian Food|5|Without question some of the best authentic Italian food I have ever eaten. If you are looking for a romantic, special occasion check out Camille's. You will not regret it!
Dined on May 11, 2013|"I thought the Italian g
Food"|5|I thought the Italian g Food was excellent including the pasta fagioli soup.
May 11, 2013|Great Italian Restaurant!|5|I visited Providence with a group. For most of us, this was our first time in Providence. I used Open Table's reviews to decide on this restaurant for our pre-marathon carb load dinner. The food was excellent. The calamari might have been the best I ever tasted, and the main course had the signature touch of a great chef. I highly recommend this restaurant.
May 10, 2013|Big Restaurant in Providence|5|We are very particular about the restaurant experience, and go to this restaurant all the time. We believe this is the best restaurant in Providence, and love taking friends from out of town here, who also rave about it. The service is fantastic as are the lengthy dinner specials. A personal plus is they have of late often had my favorite beer on tap - Allagash White. Most don't serve it, and it is one the best beers out there, brewed in Portland, Maine.
