Review Title|Review Date|Review Score|Review Text
ays ago|We booked a table at Camille's based on ...|5|We booked a table at Camille's based on a quick internet search. We were looking for a nice Italian restaurant in a convenient part of town. Camille's was all that and so much more. The ambiance, service and food make Camille's a destination restaurant. Don't miss it!
February 25, 2016|Ambience is perfect for a private conver...|5|Ambience is perfect for a private conversation.
February 19, 2016|A place to Dine!|5|This restaurant is certainly a dining experience. The staff all around made us feel special and treated us as such. The food is incredible!!
February 18, 2016|oldie but goodie|5|"We have gone to Camille's a few times over the past 20 years and have never been disappointed. The service is always outstanding. The wait staff is very attentive but not ""in your face"". The decor is beautiful and males you feel like you are in a very special place. The food could not be better. This time I ordered the lasagna which was quite ample in quantity and absolutely delicious, made with Camille's own home-made pasta sheets. My husband had the filet mignon which was cooked exactly as he ordered it and was tender and tasty. My friend had a seafood special that she said was the best of its kind she had ever eaten. The dinner was pricey but well worth it."
February 15, 2016|I enjoyed the scallops on saffron risott...|4|I enjoyed the scallops on saffron risotto with a gladd of champagne. And the rice ball/goat cheese app special was tasty too!
February 14, 2016|Great!|5|Went here for Valentine's Day 2016 with my husband. I had the lobster ravioli which was red heart shaped pasta and he had the filet mignon and they were both great. It is a bit pricey but very worth it for the quality and the romance. The server was always checking on us and so polite. The only reason for the 4 star ambiance is the tables are all right side by side so you are sitting next to strangers and have to talk over them. If you can handle that it is an awesome place to be.
February 14, 2016|Great food and atmosphere|5|Dined there for Valentine's day. What a great meal. Food and service was both outstanding. Its a perfect place for special occasions and celebration or just a nice night out. Moderate to high to price range, but worth every penny. You must go and try it for yourself.
February 13, 2016|Historic gem in Providence|5|Stunning service. Great food. Lucky to get a reservation. A bit too packed for me, but it was a wonderful dining experience.
February 12, 2016|Special Evening - Special Place|5|My wife and I dined here celebrating Valentine's Day. We have been here several times and tried many different dishes. Never a disappointment. The food was superb, the service fantastic and the evening was special! Cannot recommend this restaurant any higher - simply the best food in Providence and the service is just as remarkable.
February 12, 2016|Exceptional evening|5|Food and service was excellent, our server was professional and courteous. I would recommend Camille's for a romantic evening
February 11, 2016|Good old fashion food|4|Nice place, way of cooking is little old fashioned. Big portions, lots of oil ans salt. Overall nice expirience .
February 5, 2016|Awesome|5|Very nice place. Entertainment was fantastic. Food was very good. Waitstaff was top notch.
February 4, 2016|Welcomed a group|5|We went here for a going-away dinner for a group from the office. Everything was handled well from start to finish...literally. My wife and I arrived about an hour early and were welcomed to sit in the lounge. There we were served by Steve, the same server who handled us in the dining room. He took care of us as our guests assembled. and once everyone was there led us to our table in the dining room. One of our guests brought a young son and Steve arranged for him to get chicken fingers and fries. Everyone else had the traditional Italian specials and all were praised. My wife particularly loved her crab cakes, which she said were the best she had ever had. Camille's is definitely a jewel for Providence on Federal Hill.
January 30, 2016|Romantic Dinner|5|The food was outstanding, the service was awesome and the overall experience was great. I would definitely recommend Camille's to all my friends and will definitely dine here again soon.
January 30, 2016|GREAT DINNER|5|AS ALWAYS CONSISTANTLY A GREAT DINNER & GREAT SERVICE. THE BEST!
January 29, 2016|Good place for a good meal|5|This was a last minute reservation and it had been a while since I was at Camille's but I must admit the food the drinks and the service were all fantastic, I had the calamari (must have) the grass feed ribeye with a truffle mash my buddy had the pork chops very good (big flavor) and the girls split Sea Bass and a Gnocchi. go hungry the portions are very large. I will be heading back sooner then later.
January 26, 2016|Excellent food & service!|5|Our waiter was fantastic! Very knowledge about the wine list and made a very nice recommendation without 'breaking the bank'. Food was delicious! Looking forward to going back.
January 21, 2016|The server was really kind. I told him I...|5|The server was really kind. I told him I love the cookies! and he gave me a few extra as a parting gift. The cookies were amazing. And the food was overall alright. The decor is mix match and doesn't have any one theme.
January 21, 2016|Waiter was attentive,  food was deliciou...|4|Waiter was attentive, food was delicious. Very good experience.
January 21, 2016|Food was good but soup was warm not hot|4|We went for work lunch for 6 people and took almost two hours and wasn't busy, too long! Also very cold had to put coat on to keep warm. First time at restaurant but willing to try again.
January 20, 2016|Providence Restaurant Week|5|Camille's was an outstanding choice for food, service and ambience. What a value for Restaurant Week!
January 19, 2016|Providence Restaurant Week|5|Felix was awesome! Very attentive and excellent suggestions!!
January 15, 2016|Camille's|4|The service was impeccable. We were greeted in a warm and friendly manner, our server was very knowledgable and able to help with a gluten free meal as well as making excellent recommendations for cocktails. The meal was delicious and served in a timely manner and cooked to perfection. This was my first experience to this Providence landmark and looking forward to future visits. Thank you!
January 15, 2016|Camille's never disappoints|5|Nice place for dining with friends- good food, good service, no hustling.
January 13, 2016|Always good. I have had many wonderful m...|5|Always good. I have had many wonderful meals here and it doesn't matter when I have gone, the service is impeccable , the food top shelf , and the ambiance wonderful. Do yourself a favor and go.
January 9, 2016|See review below.|5|See review below under private note for restaurant.
January 6, 2016|Service and food were unbelievable. Ever...|5|Service and food were unbelievable. Everything was better than I could have expected.
January 2, 2016|Best of Providence!|5|Camille's is not just the best restaurant on Federal Hill (which says a lot), but the best restaurant in all of Providence! My wife and I had dinner there on Saturday night and everything - from the Oysters to the Special Seafood Casserole - was fantastic! Cooked to perfection and paired with impeccable service. We will be back again and soon!
December 31, 2015|Great little spot. The food is all famil...|4|Great little spot. The food is all family style, though, which ended up working out perfectly but caught us off guard at first. Excellent value, and a nice place especially for groups.
December 31, 2015|Happy New Year's Eve Lunch|5|Two couples from CT headed to Providence, RI to celebrate New Year's Eve. We had one opportunity for lunch and looked for a great restaurant on Federal Hill since a restaurant on the river had been recommended for dinner. We found one in Camille's. We had a relaxing, delicious meal in a beautifully decorated setting. Our waiter was attentive and knowledgeable about the menu and specials and made helpful suggestions. Antipasto salad, risotto special, and special soup of the day were outstanding. Every meal that passed by us and went to other tables had us oohing and ahhing also! Our leisurely lunch was far superior to the dinner we had later that night at another restaurant. We are looking for a reason to go back to Providence just to revisit Camille's.
December 26, 2015|Great food, excellent service!|5|The atmosphere is warn and inviting. The food is great with an excellent selection. The service is professional. I highly recommend!
December 18, 2015|fantastic|5|We went last year around this same time and the food was fabulous. This time around it was the same amazing experience. We are sure to make Camille's the destination of our yearly Christmas dinner. Be prepared to splurge though... it is not cheap; however, the service is awesome and the portion sizes generous. Mangia mangia!!!
December 18, 2015|A gem.|5|From our arrival to our departure, the experience was outstanding. Loved the menu, the sauce, and the specials. The food presentation was creative and alluring. The basic lasagna was the best I've ever tasted, and the meat and fish dishes were off the charts. The service was congenial, but with attention to detail . So much so that I remembered Chris and George our hosts and Steve, our wiater. It was an incredibly comfortable experience and will be back soon.
December 12, 2015|Five star|4|Five star food and service, attention to detail, went after 9pm for a late dinner date - too noisy in dining room- band in bar area horrible and way too loud- music choice awful for a Sat night- i should have booked an earlier time so my bad- food superlative and service second to none- presentation a work of art, waiter great- i will go back at a quieter time!
December 12, 2015|Extremely professional  and attentive staff!|4|The ambiance is fabulous - the décor is lovely - the bar is decorated beautifully and the music was excellent! There was dancing and professional, friendly and attentive staff. The food was wonderful on my first and second visits - not so much on my third. We had a party of 8 and only 3 of us enjoyed the food. The filet mignon is wonderful - Each of the 5 people in our party who weren't so thrilled about the food had a seafood dish....
December 5, 2015|Oh my!  You can not find a better place....|5|Oh my! You can not find a better place. Can't wait to go back.
December 5, 2015|Incredible Dinner|5|The food was prepared perfectly, drinks were perfection, dessert was simply amazing. Service could not have been better. You won't be disappointed in this restaurant.
November 28, 2015|Excellent outstanding restaurant|5|I have been here twice and it is by far one of the best places i have eaten. Both outside dining and inside dining is amazing from the staff, to the food, to the atmosphere.
November 27, 2015|One of best Italian restaurants I  ever ate at!!|5|Fantastic, excellent service and deco.r. A++++ Waiter Dino was attentive, professional and a gentleman!! He also provided a great restaurant for us in Newport the next night!
Dined on November 20, 2015|Everything was perfect.  Thank you.|5|Couldn't have been better. It was a perfect night for our special occasion.
November 20, 2015|OUR FAVORITE|5|As always, Camille's doesn't miss a beat. Dining room is gorgeous already, holiday decoration steps it up. Food, service, wine list have never let us down.
November 17, 2015|My New Favorite!!|5|The whole experience at Camille's is both comfortable and upscale. The service is impeccable. It is a warm and inviting space. There are no words to describe how AMAZING the food it!! You can not miss order here. This has become my hands down favorite. Just make sure you leave room for dessert!! SOOOO good.
November 14, 2015|Excellent Night|4|Camilles was a short walk from our hotel and the reception was excellent when we arrived. We were seated a few minutes before our actual reservation. The salads were outstanding, one with arugula and prosciutto, and the other one of the best Caesar salads we had ever tasted! The main courses were excellent also. Enjoyed the night very much!
November 14, 2015|Still walks the walk for great food.|4|Great place for her birthday dinner, as always the Hill comes through! From the Valet parking to the great meal, it is one of our top 5 of all time.
November 13, 2015|This was a high end treat for us and the...|5|This was a high end treat for us and the value more than measured up. Ambiance was perfect for conversation. Service impeccable in the highest traditional standards. Food was excellent from first to last course in taste, quantity and presentation. We will be back for the next celebration.
November 13, 2015|Seafood pasta was disapointing|3|Had the seafood pasta with white wine sauce. Very bland.
November 12, 2015|Excellent dinner and service!  Everythin...|5|Excellent dinner and service! Everything was described well and cooked to perfection. The manager was very welcoming and wished us a happy anniversary (from the note on our OT reservation). We will be back!
November 7, 2015|SAT NEXT TO RON PERLMAN FROM SONS OF ANARCHY!|5|Our favorite restaurant. Camille's sets the standard for service in our little state. Regular menu items are always excellent, Sole Almondine special was delicious, not sure it needed the added capers. Best calamari anywhere, the bar was hoppin with lots of stuff going on in town. Bonus to be seated next to Ron Perlman from Sons of Anarchy on this visit.
November 6, 2015|Terriffic|5|We have visited several restaurants in this area and this is the best of the bunch. This visit I had the lasagna and it was great! Very complex tastes and plenty of food. We will be back.
November 3, 2015|Old school touristy restaurant off of fe...|2|Old school touristy restaurant off of federal hill good wine list excellent bananas foster
October 31, 2015|Good food ,big portions and  high price.|4|Good food ,big portions and high price.
October 31, 2015|HALLOWEEN SATURDAY|5|It is always such a pleasure to dine at Camille's. The service is gracious, professional and unobtrusive, the wine list is one of the best in the state, and the food is reliably excellent. General Manager George recommended apple fritters (like doughnut holes with filling) for dessert. Cooked fresh to order, they were warm, cinnamony, and just crisp enough on the outside. We should each have had an order instead of just splitting one, but we knew we'd be going home to Halloween candy. Really great live music in the bar with lots of people in costume, the whole night turned out even better than we expected it to.
October 29, 2015|Making a choice on this menu was tough. ...|5|"Making a choice on this menu was tough. Everything sounded incredible and what we ordered between apps, entree and dessert was phenomenal. There were no ""wrong"" choices to be made. Service was attentive and consistent throughout the night. We never felt forgotten or neglected by our server. Everything was top notch!"
October 27, 2015|Camille's - Not For The Financialy Challenged|5|The restaurant is a great place to bring your significant other for a romantic night or to celebrate a special occasion. The waitstaff are friendly, the food is excellent, although not economically priced.
October 26, 2015|Tourist|5|Camille's was recommended to us as the oldest and best Italian. After checking out the menu we decided to try it and we loved it. Food was excellent and very large portions. Pasta was fresh, veal was tender and calamari was very tasty
October 24, 2015|Dissapointing|3|We arrived before our 8pm reservation and were not seated until 8:20. We were a party of 4. The veal masala and the lasagna we excellent but the rigatoni alla norma was mushy with not a lot of flavor. We did decided to split a dessert and I think the waiter forgot about us. When we called him over he got snippy and had an attitude the rest of the way. We will not be going back.
October 24, 2015|Great dining experience|5|The service and the food were absolutely fantastic . We were visiting my daughter at college and took her and a few friends out for dinner. We all had a wonderful meal here, and would definitely go back the next time we are in providence.
October 24, 2015|Great service!  We took our daughter her...|5|"Great service! We took our daughter here for her 30th birthday. It was more than we expected. This will be our ""go to"" spot. Thanks to the staff , it truly was a memorable experience for her."
October 24, 2015|The food and service was amazing!   My w...|5|The food and service was amazing! My wife even commented that even though the place was packed, the service was impeccable. We went into the lounge afterwards and danced the night away!!! Great night
October 23, 2015|Fun Birthday with the Adult Family|5|Food was great, wanted to try more thing but portions are very big!
October 23, 2015|TWICE IN ONE WEEK|5|Thanks for another greart meal Camille's, everything was perfect as usual, love the higher-end wines available by the glass on that preservation system thing. We had such a great meal Tuesday that we came back Friday! Wonderful from start to finish, best service in town.
October 20, 2015|Old Friends|5|I was meeting a friend I hadn't seen in a while for dinner. Camille's was our first choice. Perfect setting, great services and excellent food. We will be back soon.
October 19, 2015|food was decent but very expensive for quality.|3|The atmosphere was nice and the service was quite good. I got chicken Parm and it was certainly OK, but not anything special and fairly pricey given that it was average to good. Definitely recommend it but I thought it was overpriced for a moderate quality
October 19, 2015|Dissapointing|3|My husband and I wanted to go somewhere special for our anniversary. I've heard people mention what a wonderful place Camille's is so we decided to try it. The valet service was a nice surprise. The inside was decorated beautifully and the ambiance was quiet and romantic. Unfortunately the food and staff were another issue. I ordered the veal special. The veal was delicious but my vegetables were luke warm and some were over cooked and some almost raw. My husband ordered the ribeye but while the waitstaff was adding red pepper flakes he over shook it on the steak then said oops then walked away. My husband tried to brush off as much as he could, but it was too spicy. The waiter apoligized and put in for another steak. Unfortunately because mine was already on the cool side by this time, I continued eating. His didn't come out till I was done. So much for a romantic dinner. The hostess did comp us dessert, but by that time our waiter seemed impatient and not nearly as pleasant as he was when we sat down. He actually rolled his eyes when I asked for coffee! We suddenly felt uncomfortable and unwanted. I know we will ever be back.
October 17, 2015|Amazing service but a little disapointed with meal|3|Let me start by saying the food wasn't bad by any means. I just expected a little bit more. The calamari and beat salad were delicious. My filet mignon tasted a little too charred on the outside. It look away from the flavor of the meat. My husbands veal parm was good, but not even close to the best we've had. When you pay the fine dining prices, you expect an unbelievable meal. The service was outstanding though. I would go back for drinks and apps. The atmosphere was fun and romantic.
October 16, 2015|Amazing time|5|Brought my parents here last Friday for dinner. And everything was amazing. They have an amazing menu and have an exquisite wine menu as well. Server couldn't have been nicer and manager checked in periodically to make sure we were satisfied.
October 16, 2015|Never disappoints|4|Camille's is always a sure thing for good food, good service and an outstanding atmosphere.
October 14, 2015|Absolutely the best!|5|Service was professional, ambiance relaxing and elegant, food was out of this world!!! Iron chef quality with specials that are creative and unique
October 10, 2015|Camille's delivers!|5|Excellent dining experience with fantastic service and delicious Italian cuisine.
October 3, 2015|Service is Superb|5|Was a great choice for an anniversary dinner. While the wine selections were quite pricy ($40 and up), the ambiance and food quality was sublime. Our sever was young but had a great grasp of a rather complex menu and never seemed overbearing or pushy. We were treated to a dessert of cannoli to celebrate our special day, without any prompting by the wait staff. Highly recommended
September 30, 2015|Outstanding, as promised|4|Went to Camilles based on reviews, and I was not disappointed. Amazing food and great service. The pork was one of the best I have ever had.
September 30, 2015|A good time was had by all|5|Our guests were treated with terrific customer service, from seating, to menu choices and selections. The wheelchair ramp was a great addition for those important elders who meant to much to our guest of honor. The food was terrific, choices were delicious, our guests were so happy. Kudos to you!
September 29, 2015|A nice find|4|Came here during a recent stay in Providence on the recommendation of a B&B owner in New Hampshire where we had stayed the day before. Really enjoyed the food - veal porterhouse for my main was outstanding. Overall a very pleasant night out.
September 29, 2015|Best in Providence|5|I don't know what was going on in town on this particular Tuesday night but Camille's was full of large dinner parties. Even so, the waiter was fun, efficient, and knowledgeable about the food and the wine list. The swordfish special was over-the-top delicious. Such a great spot for a date, we're going to try Christmas Eve this year too.
September 29, 2015|great experience|5|Everything from service to food was beyond exceptional. Will be sure to return for dinner.
September 29, 2015|Short and Sweet|5|Just a quick lunch today, even skipped the wine list (it wasn't easy). Service and food were excellent as always
September 29, 2015|Client Lunch|5|Camille's is my favorite spot for business lunches. Valet parking means no driving around in circles and the competent service can be counted on.
September 28, 2015|Only thing missing was John C...|5|Only thing missing was John C...
September 26, 2015|Great place|5|The food was good. The service was even better. Great wine selection and delicious cocktails. The staff are amazing and friendly.
Dined on September 26, 2015|The restaurant is beautiful.  It's like ...|5|The restaurant is beautiful. It's like something out of an old mafia movie. Food and service do not disappoint.
September 26, 2015|Camille's Is Top Notch|5|From the time you arrive at Camille's, you know you're in a special place. The service is exceptional. The food is so beautifully delicious that we all finished even though we were full about halfway through. A treat for your palate.
September 24, 2015|Great lunch!  Took a first time client h...|5|"Great lunch! Took a first time client here. Staff was excellent. Great service and our food came very quickly! They realized that we were on our lunch ""hour""! Made it back to the office for our next meeting with time to spare."
September 22, 2015|Terrific Tuesday Night|5|Our go-to spot when we want attentive service, a great meal, and a great bottle of wine in a beautiful room. Fresh pasta with lamb ragu was the hit of the night. Thanks again Camille's!
September 22, 2015|Second dissapointment on a Tuesday Evening|2|"Want so much to like this place but our last two experiences, both on Tuesday evenings, were very disappointing.......service was robotic, and the food was not well prepared. We raised the issue on the shrimp appitizer, and the server's lack of empathy or concren shut us down.... Very, very disappounting......... Too many other great choices in Federal Hill, to give them a third chance...... To the credit of the front end Manager, he chased us to our car, encouraging us to return....but unfortunatly....""Elvis had left the building"" thank you ...and good night"""
September 21, 2015|Classic Italian Food|4|Right in the middle of the Federal Hill district. Decor and ambiance like stepping back in time. Food was classic Italian and very good. And the service was helpful and attentive.
September 17, 2015|Great Federal Hill choice!|4|We really enjoyed Camille's. The inside is beautiful but we chose to eat outside because it was a lovely night. It isn't quite as pretty to say the least and it's where they allow smoking... but the food was superb and the service excellent.
September 16, 2015|Great first time at Camille's|5|I had a very pleasant time at Camille's. I had dinner with a friend and we were able to eat, drink and have a nice conversation with a quiet atmosphere. Prices are reasonable, food and wine were excellent. I will certainly be back
September 12, 2015|"Great service
Excellent food"|5|Great service Excellent food
September 12, 2015|Italian all the way|5|As someone who's grown up with pure Italian Grandparents and having actually been to Italy knowing what real Italian food tastes like, this is definitely a place to have great food.
