Review Title|Review Date|Review Score|Review Text
January 23, 2014|We went during Restaurant|4|We went during Restaurant week which was great for us because we leave in the building adjacent to CAV and we were always skeptical about price but not anymore. We were amazed as to how delicious the food was, the best Duck Confit I've ever had; steak cooked perfectly. We definitely will frequent CAV much more often now that we have a memorable experience to live off of. Tasting is Believing!
January 20, 2014|Perfect 25th anniversary Dinner|5|My husband and I were looking for an interesting but special place to celebrate our 25th wedding anniversary, and found CaV at this site. It was delightful. the restaurant was hidden away from the street, and appeared like an oasis out of the old factory buildings. Our service was impeccable, with cheerful, helpful and professional attentivenes. And then, there was the food! It was varied and delicious. Crab cake appetizer was crab meat with a bit of a bite from the aioli. Port wine pears with the chicken were unique and well-deserving of the awards it has won. Jim's filet was the best medium rare one he can remember being served, and there wasn't even a smidgen of bordelaise sauce on his plate when he finished.
January 18, 2014|Magical, spiritual, a lot|4|Magical, spiritual, a lot of soul and feelings. A very special place with character. The good is really good . My favorite in town.
January 18, 2014|Consistent pleasure|5|The atmosphere and decor are comfortable, filled with African art, and interesting lighting. It's cozy, comfortable, and always a great meal.
January 18, 2014|Great Evening|5|Food was delicious and service was perfection. We had an amazing time and will be back! highly recommend for fine dinning. Attire for dinner business casual or elegant and you would fit right in!
January 18, 2014|Beautiful Decor, Horrible Service|2|Walking in, we were immediately impressed by the beautiful decor of the place. It seemed really cozy and charming. However, the food wasn't very good at all (risotto was mushy and ravioli was overly salty). The service was also very poor. It was busy, but they largely ignored our table and were not friendly at all.
January 17, 2014|Perfect night out!|5|My husband and I decided to try CAV during restaurant week. We are so glad we did! Not only was the food delicious but the building is full of character! Our waiter was great too! Can't wait to go back....we will be bringing friends too!
January 17, 2014|Must try|5|Took too long for me to try this neighborhood gem. My loss. Thoroughly enjoyed the decor, the food was great.
January 17, 2014|Great dinner outing|4|This is the first time back to CAV in a few years. They were extremely service oriented, with the host giving us a little silver angel made by a local artist. The restaurant is a little off the beaten path but well worth the trip. The goat cheese croquettes and Lobster Bisque with Tahitian Vanilla were excellent.
Dined on January 17, 2014|OMG...the shrimp risotto with|5|OMG...the shrimp risotto with Gorgonzola cheese and brussel sprouts was absolutely heaven in a plate....I would have never thought it to be so yummy but thankfully the waiter made the suggestion and I went with it...SO happy I did! We were there during Restaurant Week and I would definitely recommend it and go back again! Thanks for the experience!
January 13, 2014|A Great Find|4|While traveling on business we went with OpenTable's suggestion on CAV Restaurant. The food was well prepared and had amazing flavor. The main course and sides were well matched and the portions were perfect. The inside of the restaurant is worth the visit itself. The dining and bar area is filled with many crystal chandeliers and decorative glass hangings. The ambiance is not formal, but more eclectic for the lack of a better term. The service is average. I believe the restaurant needs to polish up their waiters presentation and service. Drink glasses were going empty for too long and the staff seemed very occupied with socializing with each other. Still a very good experience.
January 12, 2014|Old favorite|4|Haven't been here in years and were drawn to the Providence Restaurant week event. Great variety of selections to chose from on both menus. Ambiance was interesting and fun. Service was well done. Will have to go back to try their brunch menu.
January 10, 2014|Always a pleasure|5|I have never been disappointed in my dining experience at CAV. It has a funky yet elegant atmosphere. The food is always superb, as is the presentation. The wait staff couldn't be more accommodating. And free parking!!! I never hesitate to recommend CAV to a friend. We dined before attending a show at the PPAC. A great beginning to a great night!
January 9, 2014|Food is ok, although somewhat|3|Food is ok, although somewhat lacks creativity. The soups I have tried have ranged from a watery lentil soup (Progresso makes a much better lentil) to a very subpar almost tasteless clam chowder.
January 1, 2014|Again met my (high) expectations|4|Late-ish (1:30P) lunch on NY Day. Between mid-week holiday / cold temps, was understandably only modestly busy. As a result, food came out quickly. That said, we were never rushed. In fact, server (doubling as host) picked up on fact this was a first date for us and, instead of seating us next to another table as he initially intended, offered us a quieter, more remote table. Having not been to CAV in 6+ months, wasn't sure if it would live up to my expectations and prior experiences (2-3 times; always great). It did. Menu has much to offer regardless of diet (my date is vegetarian; I don't eat red meat). If I have one very slight criticism it's the relatively limited 'by the glass' wine selection. This is a 'can't miss' option.
December 30, 2013|Worldly spot|4|The ambience of CAV is so eclectic and magical making it a wonderful venue!
December 28, 2013|Seriously a hidden gem!|5|The inside is so unique and so cozy and comfortably warm. The concierge and every single waiter was friendly and attentive. The bar and the selection of drinks was great. The food was ridiculous. It was so good that if we could have licked our plates we would have. My fiancé had the lamb and it was amazing. I had the scallops and they were cooked so perfectly. We both didn't know where to go that night so thanks to OpenTable we found this place and made our reservations. We were really happy we did. In fact we're going again this weekend with a couple of our friends. And when you see the location of it you understand why it is a little hidden gem of a restaurant. It's one of our new favorite places!
December 28, 2013|unique dinning|5|loved it good food ,atmosphere is amazing...must go
December 27, 2013|Excellent Meal!|5|Excellent meal - compliments to the chef! Great place to hit before PPAC!
December 24, 2013|Solid choice for many occasions|4|Nice variety of foods for people with varying tastes. Relaxed atmosphere but still elegant. Friendly and attentive staff without being obsequious
December 24, 2013|We had a delicious meal for|5|We had a delicious meal for xmas eve. Everyone loved their choices - from the duck/gorgonzola cheese pizza and the wild mushroom crostini and house salad with champagne vinaigrette dressing, to the sesame encrusted tune, monk fish, pasta florentine, and filet mignon and then yummy desserts, The waiter paired the wine perfectly as well. We would definitely return. Atmosphere was festive.
December 14, 2013|No other place like it|4|I'm so glad to have found this place. The food is always great, the wine is good Added to this, the building it's located in and the decor are what makes this place stand out. The owner has collected art from all over Africa and Asia and it lines the walls and ceilings, giving it an unusual and exotic atmosphere. The overall effect is second to none. Try it for a special occasion and you won't regret it.
December 7, 2013|CAV Experience|5|We are not from Providence and CAV was not easy to find, especially with some road closures and construction, but I was glad we persevered because it was a great restaurant. Excellent service, cocktails and food all made for a delightful experience. I would definitely return.
December 6, 2013|A little mix up...|5|When we first arrived there was a little mix up with our reservation - they had us down for 7:30, instead of 6:30. However, the owner apologized profusely and personally sat us at the bar, and ordered us a couple drinks and an appetizer to make up for the error. She also continued to stop by on occasion to check up on us. When there still wasn't an open table at 7:30, because of the large parties that still hadn't left, she insisted on comp'ing the whole meal for us. We did get a table around 8:00, but it almost didn't matter at that point. The owner and her staff had been so gracious, and the food was so good, that it didn't matter that we sat at the bar. Because of the great hospitality and delicious food we will be returning!
December 5, 2013|Delicious!|5|I've eaten here many times and always love it! I had my usual entrée of Diver Scallops & Shrimp with lemon risotto and it was as good as ever! Others at the table enjoyed a duck dish, chicken and pears poached in red wine and cavatelli pasta with white beans and shrimp. All the plates were empty at the end of the meal. Yummy!
December 1, 2013|Unique Atmosphere if not Food|4|The room outshines the menu at CAV. The room is a trip in-a-half: part curio, part antique shop, part world wide flea market, the owner is either well traveled or a hoarder. Knickknack's galore; priced not to sell! Dinner was a pleasant surprise on the Sunday night we visited. The large dining room was very empty at 6:00 (always a cause for concern). Apps were not exciting but frankly, tasty. The French inspired meals for our table of four were made well and enjoyed by all. If not memorable it also was not disappointing! The red wine was too warm when served, taken care of by my asking for it to be slightly brought down in temp by resting in the fridge. It is in an out-of-the-way industrial part of Providence, but, all in all worth the trip
November 29, 2013|Enjoyable!|5|Spur of the moment get together with friends. The food was superb and atmosphere was enjoyable because the noise level was low.
November 23, 2013|CAV is fantastic!|5|The service was fantastic! We had a minor problem with one of the dishes. The owner not only addressed the situation but brought out an additional entree AND made the initial entree over so that we could enjoy it at home the next day! IN addition she did not charge us for the first entree. All in all one of the best experiences at a restaurant EVER!
November 16, 2013|Great food with vibrant surrounding|4|Cav was hopping when we arrived. The host greeted us and led us to a cozy table in the mid section of the restaurant. Beautiful fabrics drape the area along with lovely chandelier lighting. The wait staff were very attentive, drinks were fantastic and the food was beautifully presented and delicious! We will be returning to CAV!
November 7, 2013|Mediterranean Delight|5|Awesome decor, ambience, food and service. Wonderful experience. Can't wait to go back.
November 5, 2013|My Duck Breast and crispy|3|My Duck Breast and crispy leg confit were reasonably Tasty. The presentation was nice but the leg was not crispy. The sauce was flavorful but too syrupy. My wife's chicken special with poached pears looked and sounded much better than it tasted. The chicken was not particularly flavorful and the poached pears were hard and too spiced. We went there at the last minute, the ambience was nice enough, and other people seemed to be enjoying their meals. All in all, it was an OK meal but nothing great.
November 4, 2013|Great food & atmosphere|4|I took a small group here for a business dinner, and we had a great night--the restaurant is quiet enough to allow for table-wide conversation, the service was simple but good, and the food was fantastic,. It would be a hard call between CAV and Pane e Vino, where we were the night before--both were excellent. In nicer weather, the courtyard would be great, too. The decor is a little overwhelming at first, but it works for the place--we will definitely be back!
November 3, 2013|Brunch|4|We had a lovely brunch here. The menu is varied but short. We had variations of eggs and each was delicious. The service was very good. Would go again.
November 3, 2013|Quirky and good|4|The place is a strange amalgam of a restaurant and an antique store. As the menu says, everything is for sale. We went for Sunday Brunch. While there was not a wide variety of brunch options (you cannot order from the lunch menu despite what the web site may imply), the food was DELICIOUS. This was one of those occasions where everyone in the party ordered something different and everyone consumed every morsel of food delivered. The egg dishes were exceptional.
October 26, 2013|One of the best in Providence.|5|We've dined here a few times and it's always excellent. Decorated funky cool. Everything was very good, service, food, wine list etc. Reasonable prices. You are not rushed, not a lot of tables stuffed next to eachother. I find myself saving this place for special occasions because it is so special but I think I should come here more often. One of the best in Providence.
October 19, 2013|Delicious Food & Excellent Service|5|Our waiter was excellent. Very attentive, but not overbearing and could speak about the menu items with knowledge. Our food came and we were blown away. It was all incredibly delicious and each of us cleared our plates.
October 19, 2013|Fantastic place. Haven't been|5|Fantastic place. Haven't been there for years and went this past Saturday night for my anniversary. They gave us a special table and treated us like royalty. The prices were very fair.
October 19, 2013|Warm friendly spacious|5|We go for the ambiance, the warm welcome and friendliness, the inventive modern menu. The food has always been fine, and now is better... New chef they say. With advance notice, they are wonderful about accomodating large tables and private parties. Beautifully eccentric and heartfelt decor
October 19, 2013|Great Ambience; Food uneven|3|Four of the 5 entrees were very good. The fifth, the veal chop special, was under-cooked for medium. Even after it was sent back for further cooking, it still came back undercooked. Great atmosphere. Very good service.
October 19, 2013|Eclectic food and decor|4|We had a delicious brunch. The bruschetta was some of the best I've ever had. The pizza and omelette were very good. The coconut shrimp was okay. The decor is a feast for the eyes. I would definitely go there again.
October 18, 2013|Eclectic decor and food & all good!|5|First time here and really enjoyed both the menu and the setting. Outdoor seating in the courtyard would also be lovely during warmer times. Located in a non descript neighborhood but certainly not the case inside where find a wide range of items on the walls and hanging from the ceiling. Went for dinner during Brown Family Weekend and will certainly return to try more dishes and drinks!
October 18, 2013|old and new|4|in the back streets of the city, factory district turned into fine dining also keeping the sense of history (antiques and wood beamed ceilings). Not so easy to find but part of the fun to go dine there. Eating where a city had grown up, factory buildings of red brick with granite stones, old style with ambience and well thought out food. Unusual and exciting.
October 12, 2013|Really enjoyed it!|5|Great food, great service. Will definitely be back!
October 6, 2013|nice, but not amazing|3|I found the food to be a B and not higher. with so many fine choices in RI, I will look elsewhere on my next visit. ambiance is very cool.
October 5, 2013|Excellent|5|This restaurant exceeding my expectations. My friend and I were seeing a show at PPAC and wanted to have a nice dinner beforehand. The food was beyond delicious (probably the best crab cake I've ever had) and our waitress was lovely. Within walking distance to the theater. I would definitely go back the next time I'm in Providence!
September 29, 2013|Secret. Spot|5|A hidden place A surprise for sunday night! We had a birthday romantic celebration Food was wonderful
September 29, 2013|Awesome Brunch|5|We went for brunch, it was great. Very interesting decor, helpful staff and delicious food. Definite keeper.
September 27, 2013|Great time with my wife|5|Took my wide for her birthday. This is the second time we have been to CAV and love the place, the people, the atmosphere. The wait staff is VERY pleasant and took care in making sure we felt special. There are a few restaurants in Providence that tend to be stuffy. Almost like you should be honored to eat here. Not CAV. The food is first rate. CAV is up there in innovative and well thought out dishes. Everything is appropriately priced as well. Not over-priced. Wine list is excellent and again reasonably priced. highly recommend this restaurant. We will go back... I rate this very high because they truly deserve this.
September 21, 2013|Off the beaten path gem|5|While the walk to CAV from downtown Providence made all my friends doubt my choice for a dinner spot, their fears were allayed once we got to CAV and saw the great ambiance and decor. Food, drinks and desserts were great and our server was really nice. Will def come back when i'm in Providence
Dined on September 20, 2013|I consider myself a world-class|4|I consider myself a world-class expert on calamari, and these were by far the best I have ever had. I have had them twice. Tender, fresh, and flavorful.
September 17, 2013|The best meal in Providence|5|Believe me, this is the best meal in Providence. The eclectic interior of the restaurant is worth the trip. The wine list is exceptional, (the first time in any restaurant with a Rhone Valley selection that includes an affordable Gigondas). My wife and I ordered several appetizers so we could get a taste for the chef's ability. Crab cakes, Lobster, and cocoanut shrimp were nothing short of culinary art and exceptional. We opted to pair the Gateau Concorde and the Coconut Sorbet for dessert. Both were exceptional.
September 13, 2013|Nothing exciting here.|2|Boring menu, drab restaurant. My friend and I had chicken and both were dry.
September 1, 2013|Fantastic Gem!|5|We went to CAV for our first time on 9/1/13 with friends after a friend highly recommended it. She insisted we go there when I said we would be in Providence for the night. Well she did not steer us wrong. The food was creative and delicious. I had a mushroom risotto that was quite good. All 4 if us really liked the food. Service was great & did not rush us. The ambiance is quite interesting & eclectic because they sell the antiques on display, as well as the chairs we sat on & the tablecloths! I highly recommend CAV (stands for Cocktails, Antiques, Victuals)!
August 23, 2013|Very good service and a good meal|4|I ordered the shrimp and tomatoes and garlic and asked that it be served over polenta instead of pasta and they accommodated my request. Thanks
August 19, 2013|Outstanding!|5|This restaurant was AMAZING in every way. Creative menu, delectably excellent food, beautiful location. Can't recommend it enough! We will be back!
August 10, 2013|Lovely meal on 8-10-13|4|Staff here in this eccentric yet cozy restaurant are a key to this restaurant's success I'm sure. (The host even walked with us out to the sidewalk to explain walking directions back to our hotel after our lovely meal.) Add to that a tender calamari appetizer with peppers and a wonderfully made martini and your evening can't go wrong. First impressions are so important. CAV you had us at hello.
August 10, 2013|not the usual performance|3|Have dined at Cav several times and always thought food and service excellent (although menu does not change much) Took my brother 8/10/13 there when he was visiting from out of town; not crowded but our waiter had trouble with drink orders (only a table of three) and then forgot about the bottle of wine we ordered; when we reminded him he still didn't bring wine until we had finished entrée (we declined the wine at that point) Brother and wife had tuna which wasn't very good; Caesar salad wasn't made with romaine (?) Disappointing
August 2, 2013|What a wonderful night out!|5|Overall we had a great dinner at CAV. The food, service and surrounding were great, except I prefer it to be a little bit quitter. When we arrived, the restaurant was half full with just the right ambient (less noise). However, when the restaurant fill-up with people, the noise level had become a bit unbearable.
July 26, 2013|Dinner|5|Dinner was excellent from the appetizer to the entrees. Great wine selections also. Service was a 10, very accomodating
July 25, 2013|Eclectic menu and atmosphere !|5|We took some friends from the San Francisco area here for dinner. They were very pleased and one person said the scallops were the best he's ever had. Food is always delicious here and the menu changes often enough to keep it from getting stale. the atmospher is very eclectic as well with crystal chandeliers coupled with African art. I highly recommend Cav if you are in the area and do try the calamari. It is the best anywhere !
July 19, 2013|Restaurant Week|2|My dining guest & I were both disappointed in the portion size of the meals. I do understand that the menu is modified for Restaurant Week, but 4 thin slices of watermelon is ridiculous for a salad...especially when watermelon is such a cheap ingredient! The flavor profile was great, but only two bites worth! And one tiny scoop of a store bought sorbet was a letdown. Even a garnish of a few berries or mint leaf would have elevated the dessert and made it seem a bit more special. Restaurant Week is time for your establishment to shine, so diners will want to come back for more. This visit just left me hungry.
July 17, 2013|Pretty darn good|4|Finding or getting to the door was a little tough, but once inside my experience improved. The decor is fascinating and eclectic- I appreciated the combination of the antiques and the food. The wait staff was very attentive and the food was pretty good (I went for restaurant week). I really enjoyed my meal of the black truffle ravioli. My boyfriend got salmon, which he liked but felt the presentation was a little sloppy and the proportions of the food were a little off. There was no starch served with his meal and a heck of a lot of salad on the plate with little in it besides the arugula. However, the salmon was cooked very well. So, the food was delicious even if the proportions were a little off.
July 16, 2013|Lovely dinner|4|We had a lovely dinner during restaurant week. The food was prepared excellently and tasted delicious. The servers are very attentive. The ambiance is great, and we loved the decorations. I had the black truffle ravioli and my husband had the duck confit, and they were both wonderful.
July 13, 2013|It had been a number of years|5|It had been a number of years since we dined at CAV and were happy to go back. Very nice atmosphere with a lot of antiques and a very, very nice staff. The menu is quite extensive plus they had a restaurant week menu with 3 courses. My wife opted for the restaurant week menu and I ordered off of the regular menu. I had scallion dumplings for the appetizer and duck (a combo of duck breast and confit) for the main course. The waiter gave me a complimentary sorbet for dessert! All in all it was a great dining experience and we need to go back more often. I highly recommend CAV.
July 12, 2013|Restaurant week failure|3|Usually a great place but I will never go back when Restaurant Week. Poor dishes... Very small... Bad quality meat. Go to Mc Donald's first.
July 12, 2013|Dinner for two|4|Excellent service. Filet was perfectly cooked and dressed. Apps were outstanding.
July 12, 2013|Cozy and eclectic|5|I love the shabby chic/ ethnic decor. I have only attended for lunch, but the food is amazing and well priced. Staff is excellent.
July 10, 2013|Variable Depending on Order|3|Some of the dishes we had were delicious and some were just OK. The service was good, the server very nice and knowledgeable about the food and the history of the restaurant. Love the 'art gallery' style of decorating the space and shopping opportunity for unique items.
July 10, 2013|Wonderful place|4|I cannot believe I haven't been here before . It was so so good !! We had great service by Jennifer so much so we came twice in one week. The duck was amazing as was the pork chop. So worth it and now that I know they have brunch I will be back!
June 20, 2013|First time at CAV. We will|5|First time at CAV. We will definitly go back. Our waiter took the time to explain the history of the restaurant, the building. The menu hwa s a good variety of of options, but is not so large that it becomes to big for the diners or the kitchen. We are planning to taking a group of friends to dinner to celebrate our 50th wedding anniversary, and CAV will be the place.
June 16, 2013|Father's day|5|I have loved CAV since it opened 20- something years ago! brought my husband and 16 year old twins for father's day and at first they didn't get the vibe, but now they talk about it, and want to go back! Cav is cool....
May 28, 2013|Great with friends|5|It's a wonderful place to go with friends. Servers never rush you, and the food is very good.
May 21, 2013|Not bad|3|The food is far from bad, but not terribly interesting and not prepared with extreme attention or refinement. The ambiance is pleasant but chintzy, and I found the service to be warm but remarkably inattentive.
