Review Title|Review Date|Review Score|Review Text
July 24, 2014|Birthday dinner|5|My husband and I took my parents out to CAV to celebrate my mother's birthday. They said it was perhaps the best meal they've had at a restaurant in years. It also happened to be the restaurant week so they had specials for a 3-course option. The service was wonderful, very thoughtful and pleasant. It was also where we had our rehearsal dinner so it holds a special spot for us. The food was absolutely delicious, blowing us away. They were also able to accomodate my food allergies including gluten, dairy and cane sugar.
July 19, 2014|Great food!|5|The food, the service, everything was amazing! I would recommend with eyes closed.
July 19, 2014|Elegantly funky|5|The decor of CAV is definitely unique - we love it and the atmosphere it creates. The food was wonderful as well - the steak cooked rare to order and the duck confit (with blood orange brandy demi glaze) melted in my mouth. Our appetizer, a minted white bean bruschetta and the Blackberry Merlot Sorbet for dessert were also excellent choices. The service was attentive without hovering.
July 19, 2014|Excellent Cullinary Experience|4|This was our first experience at CAV. There were four of us, and the food throughout the meal, from appetizers, mains and desserts were all outstanding - presentation, flavor and serving size were all first rate. The décor is eclectic, but don't let that throw you off from an outstanding culinary experience. Our server seemed a little distant at first, and did not explain the restaurant week menu despite our request. However, he became more engaged as the meal progressed, and the service overall was attentive and very good.
July 19, 2014|Very interesting restaurant in concept, ...|5|Very interesting restaurant in concept, decor, location, etc. My wife and I thouroughly enjoyed the food and thought that the service was excellent. We definitely expect to return.
July 19, 2014|fabulous night with dear friends|5|Outstanding service and attention. Food beyond great. Would recommend to anyone interested in an memorable experience.
July 18, 2014|Hidden away|4|On a Friday night, I got the Restaurant Week fixed price menu with the appetizer add on. All the food was well prepared. The only thing I would say is that the Minted White Bean Bruschetta, while delicious, wasn't Bruschetta. The long skinny toast points that came with the dish were not large enough or substantial enough to put the beans on. I ended up eating the beans with the spoon provided for serving and the toast separately. Also, as a hint, don't sit facing the windows if the sun is setting - the light will shine directly into your eyes blinding you. The staff was very attentive. The wait between courses was a little longer than I am used to, but that is not necessarily a criticism. I didn't feel rushed to finish up.
July 18, 2014|ALWAYS wonderful- we took visitors|5|On this episode of dinner at Cav- we brought our family, visiting from DSM, IA. They found the scallops to be delectable. I had the Cavatelli made Vegetarian style and it was scrumptious. The surroundings provide ample opportunity for world travel and spiritual discussion. If you haven't yet dined at Cav, what are you waiting for? :) GO
July 18, 2014|First visit|4|Went to CAV on recommendation of a friend and enjoyed everything about it. Lovely room, good service and food. Will definitely be back
July 17, 2014|Excellence|5|CAV remains a superb choice for an eclectic evening
July 16, 2014|A delightful experience|5|Went during restaurant week. Both my companion and I got the price fixe menu. It was fabulous. Waitstaff was attentive and friendly; not intrusive. Happy to engage in conversation when we initiated. Pacing was relaxed, which was good. Food was prepared to perfection and looked beautiful on the plate. House chardonnay was fabulous. We walked from a hotel on Matthewson St. and the neighborhood on the way there looked creepy and sketchy. But once we rounded the corner to the charming little courtyard and entered the place, it was like leaving Kansas and entering Oz. A completely delightful and satisfying experience.
July 15, 2014|Great food, just ok service.|4|It was busy and our waiter was nice, but the service was a little slow. Only 3 of 4 dishes came out at first and the woman assisting the waiter forgot to bring out the 4th. She started doing other things instead. After 5-7 minutes I had to remind her. The food was amazing as always and I will still be back.
July 13, 2014|We decided to try it out because it was ...|5|We decided to try it out because it was on the restaurant week list. We were very impressed by the menu and how delicious the food is. I will definitely be back.
July 12, 2014|CAV is a great restaurant with an amazin...|4|CAV is a great restaurant with an amazing decor and a lovely courtyard to sit outside in the warm weather. I love this place.
July 5, 2014|Interesting Location|4|My wife and I walked to have dinner here after seeing a show at the Dunkin Donuts Center. I guess this is a new section of town, because as we got closer, there were a lot of empty buildings, vacant lots and new roads. Nothing bad, just a little odd. Once we got to the restaurant, it was all good. Interesting decor, great wine, good variety of menu options. Everything we had was delicious.
July 4, 2014|very cool unique spot. We love the food ...|5|very cool unique spot. We love the food here. Never had a bad meal
July 4, 2014|6 people in a tropical storm|5|In lieu of postponed fireworks due to inclement weather- we impromptu made a reservation for 6 at CAV using Open Table and as we walked in the door, they were setting up our table. Food and service were impeccable as always. I do wish there were more vegetarian options on the menu. I highly recommend CAV for lunch, brunch, dinner etc...
July 3, 2014|Romantic spot|5|The cav is beautiful operating resturant in the old jewelry district in prov ri it's run so nicely hope it stays for many a more years.
July 2, 2014|The dining room is very interesting with...|5|The dining room is very interesting with the various displays of antiques and art a very comfortable setting. Service was prompt and attentive. The calamari as an appertizer was very good, and very tender. The duck entree was excellent with the confit and breast. The shrimp entree was also very well prepared. They have a very good wine selection. Definitely a good choice for a nice dinner.
June 28, 2014|Overpriced, mediocre food|2|One small piece of lobster in pasta for $29. Rip off. Mediocre steak for $33.
June 28, 2014|Amazing find in a strange location|5|"This isn't in Federal Hill where most Providence restaurants are located but this was an unexpected great find! The interior decor is snazzy and fun. Service was excellent, and menu offerings were eclectic and ""oh so delicious"". We'd definitely return!"
June 21, 2014|A Gem!|5|We went to this wonderful restaurant while in Providence ri on a visit last weekend. The food was fantastic...the place is alive with interesting African art and the service was wonderful. I would definitely return. The seared tuna was delightful and I loved the salted carmel gelato. A wonderful treat...
June 20, 2014|Excellent restaurant|4|Four of us went to dinner at CAV. Each had something different from appetizer to dessert and everything was very good - fresh and uniquely prepared. Service was very good and the atmosphere was interesting and not fairly quiet. The prices are above average but normal for a restaurant of this level. We particularly liked the striped bass with risotto but the salmon and lobster pasta were also good. The fruit tart for dessert is also recommended.
June 19, 2014|Best place in Providence|5|We just loved dining at the CAV Restaurant. It was our favorite night out while staying in Providence. The food was superb and the atmosphere was like we were dining right in the middle of an antique shop. Love, Love, Loved this place.
June 15, 2014|A great find|5|My wife and I were introduced to this unique restaurant at a wedding reception and loved it. We have come back here for special occasions, or just on a whim, and love introducing others to the place. I would highly recommend it.
June 15, 2014|Went to CAV for Father's Day and we had ...|5|Went to CAV for Father's Day and we had a great meal! We got there early but they sat us even though it was 30 mins before they officially opened! They were so gracious about our screw up and served us right away. The food was delicious although our teeanage son thought there should have been more food to an order. We will definately go again if we are near Providence.
June 7, 2014|Magical|5|The restaurant is gorgeous--- from the moment you walk up. The food is incredible- easily the best meal I've had in a long time. The service is wonderful- every single person is friendly and helpful. It's clear they love the place as well. The only thing we didn't love was the parking situation... it's just a desolate parking lot- nice to have free parking, but I wouldn't want to park there late into the night.
June 7, 2014|blingbaby52|5|We picked Cav for my husband's birthday dinner. We loved the bruschetta appetizer. For dinner I ordered the encrusted seared sesame tuna. I like mine barely seared and it came out perfect. My husband ordered the hangar steak with pepper sauce, which was almost too peppery, but he was enjoying it. Our waitress offered to replace it, but he said it wasn't necessary. For dessert they brought him a flourless chocolate cake that was filled with a rich chocolate mousse. The presentation was gorgeous and the cake was delicious! When we left our server brought us a new hangar steak and the leftover dessert. She made sure nothing spoiled his birthday! We had a spectacular meal with superb service. We'll be back!
May 31, 2014|Bad first and last impression |2|Heard it was the Chef's last night cooking at CAV and was disappointed by not only the food but our horrible service!!! $262 total bill for four and gave a portion of our waiters tip to another waitress who repeatedly kept covering for his horrible service. Truffle ravioli lacked flavor and was 90% all oil in the dish. The staff was standing aside eating a laid out spread of desserts while we sat there and waited for our own dessert menus. We almost asked to join their party since they apparently didnt care about ours. Not the way I'd like to be remembered on my last night cooking.
May 30, 2014|Birthday Dinner|5|I had a great birthday dinner at CAV. I enjoyed the duck entree and my wife had the fresh pasta. We shared a great plate of bruschetta too! I'll be coming back!
May 22, 2014|Marcia Parks|5|Delightful dining experience: the food was delicious, presentation was attractive, service was prompt and polite without being intrusive.
May 21, 2014|Excellent food ,service, ambience. Defin...|5|Excellent food ,service, ambience. Definite find!!! Love it.
May 18, 2014|Enjoyed the wonderful brunch|5|We've been there twice for brunch and found the food, ambience and service to be top notch. Very reasonably priced with a nice specialty drink menu as well.
May 16, 2014|Hidden Jewel|5|Cav is one of those places that you walk in and your blown away. Everytime I go there I notice something new. The decor is great with beautiful chandeliers and jewels hanging everywhere. The service is impeccable each and every time. My friends and I always enjoy the banter we have with our server and how on point they are every time. Some of my friends are rather particular when it comes to places we eat and this has turned into one of our favorites. I would recommend the parmesan encrusted chicken, yummilicous...
May 10, 2014|Pleasant and Tasty!|5|Although it was tricky driving through the dug up streets of Providence, dinner was very enjoyable. The service was excellent at the beginning, but it did slow down a bit once we got our food. The ambience is special, and clearly sets CAV apart from most of the typical restaurants.
May 10, 2014|Lovely|4|We chose Cav for a pre-show dinner and could not have been more thrilled. The food was delicious and our waiter incredible in tune with our needs.
May 10, 2014|Slipped|2|Have dined here before, always good. Quite a bit off this time. My favorite appertizer of Butter Poached Lobster was sold out at an early dinner time of 5:30. My guest,s Entree of Diver Scallops was very good. My Appertizer of Duck Confit Stuffed Zucchini Blossoms was terrible. Way too much Tempura Batter, looked like a plate of Corndogs. Not a good match. My Entree of Grilled Amberjack Fish with Dill, a dinner special, was very bland and underseasoned.except for Dill, which is all I tasted. Hope it was just a bad night, as I have always liked this restaurant
May 8, 2014|Fabulous!|5|We had a birthday in our family group of 6. We arrived on time and were seated immediately. It was a slow night, which is nice because we were able to take in the full ambiance without rushing,.The service was spectacular, the food was Fabulous. My 14 year old is a picky eater and was able to find the chicken dish extremely enjoyable. He is a slow eater and the server never rushed him. Kudos to the server for that. we highly recommend CAV...
May 4, 2014|Mostly good|4|Our meal was very good overall. The bruschetta was superb. The caeser salad was slightly underdressed and a bit bland. We each ordered a pasta dish, one of which was very good and the other a bit too rich--more focused on the butter and cream rather than the pasta and lobster meat. One of our drinks was excellent (St. Germain margarita), the other watery and disappointing (cosmo). The bottom line: this was a very good meal, but incredibly pricy. When I spend close to $100 per person, I expect to see stars!
Dined on May 3, 2014|It Was Ok|3|I had been wanting to go here many times. The first time we tried, we got bumped by a private Christmas party which really stunk. We finally made it! The food was good and our server was nice. The first impression what bad though because they had someone greet us at the door that spoke no English. I tried speaking Spanish hoping that he was either a Spanish speaker or spoke Portuguese, but no luck. He couldn't even direct me to the bathroom. It surmised my initial opinion of the place after we were booted due to the party on 12/15/13, then the owner promised to get us something to make it right but never did and then we got there and voila, another miscommunication snafu. Frustrating. We will not go here again.
April 27, 2014|Great brunch|5|Enjoyed a wonderful Sunday brunch. Had a reservation and seated right away. Large number of choices on the menu. Good service and great food. Ample size portions.
April 27, 2014|Wonderful find in Providence|5|As out-of-towners, we were looking for a place to meet up with family from NH for brunch on a Sunday in Providence. What a find CAV was. It exceeded our expectations. The food was fabulous. Two of us had the crab cake with poached egg on sweet bread. Another had the feta and spinach omelet, and two others had the wonderfully looking French toast with apples. The service was impeccable with just enough attention without being intrusive. And the Bloody Marys were very fine! The décor also adds to the experience. It is eclectic and interesting. Although I don't know that we have an occasion to be back in Providence anytime soon, it will definitely be on our list to return to for another wonderful adventure. You will not be disappointed.
April 26, 2014|Love this place!|5|My daughter goes to college in Providence and I get to CAV as often as I can. The service is friendly and efficient and the food has never disappointed. The food is fresh and the flavor combinations are always such a pleasure. One of the guests in my party last Saturday night had the salmon with lichee, I had blackened grouper with pineapple salsa and two others had the mushroom risotto. Everyone loved their food and we had every sorbet for dessert. I highly recommend CAV.
April 26, 2014|Hopeless Romantic Hit|5|The place was absolutely beautiful and the food was wonderful! If you are looking for a great date night or just a place to enjoy a special meal at the CAV is the place to go. Food was great and the presentation perfect!
April 15, 2014|Eclectic|5|It was very different than any other restaurant in Providence. A unique atmosphere but very warm and comfortable, I would go back again for sure.
April 10, 2014|Birthday lunch|5|Took my best friend to the CAV for her birthday and it was a hit! We both love the ambience, staff is very pleasant attentive good selection of Entrees salads yummy desserts. Lots of time to chat we were not rushed. Will be back!
March 30, 2014|Great brunch|5|The brunch has a well-executed, imaginative menu and very good service.
March 29, 2014|Remains a standout|5|I agree with NYT that lists CAV as one of the top five restaurants in Providence. Many visits and always a good experience.
March 29, 2014|Always a dining pleasure|5|Although I don't live in Rhode Island, I have been dining at CAV for over 20 years...my go to restaurant in Providence. I have never been disappointed...this time was no exception. I have introduced many people to CAV and they have all loved the food, the ambience and the service. Can't wait til my next visit!
March 27, 2014|Great spot|5|I was there for lunch, but I wish I could go back for dinner soon! The menu looked great and our lunch sandwiches and salads were fresh and super tasty. Service was attentive, but not pushy. The atmosphere was great, even during the day. I can imagine that it's a pretty romantic spot at night.
March 23, 2014|Very good food|5|My wife and I have been here twice for Sunday brunch and have not been disappointed. We are considering dinner here in the future. Very romantic setting.
March 22, 2014|Ambiance, Food, Equally Wonderful|5|The Cav provides a uniquely beautiful and comfortable setting for elegant dining, matched by innovative dishes perfectly prepared and presented. The service is top notch. Altogether, it makes for a memorable evening.
March 22, 2014|Consistantly Fantastic|5|My wife and I have now been to CAV on multiple occasions and each time the food, service, and ambiance has been outstanding! The restaurant is very eclectic and the menu offers something for everyone. The Point Judith Calamari appetizer is awesome and tuna entree is AMAZING. I had the Spanish clam special appetizer and the seafood around the world special entree and both were dynamite. CAV has quickly become our FAVORITE.
March 15, 2014|most try|3|my 1st time here with my boyfriend celebrating our 3 month anniversary - pei mussel as appetizer was awesome where we wish we had more bread to dip into the broth but our server was too busy waiting on other tables. i had the Pan Seared Diver Sea Scallops and Shrimp, finished with lobster butter where i could not taste the lobster butter and the riosotto was not what i excepted to be alittle more season or cheesy. my bf had NY strip from the special menu and it was cooked to his liking but there were parts of the wine reduction that was very pungent and needed to cook down a little more. overall, lovely and romantic night-lighting and glass/crystal decor hanging from the ceiling. the service is good just little more attentive.
March 13, 2014|Eclectic dining|5|CAV is a unique gem hidden in the heart of the Jewelry District of Providence…a haven of exotic global decor...
March 9, 2014|A hidden gem|4|This has become one of my favorite restaurants. The food was delicious and the prices are reasonable. The atmosphere and decor make this spot a hidden gem.
March 8, 2014|disappointed|1|Although we have dined numerous times in the past, we were disappointed in this visit and honestly probably not come back. The food was excellent as usual, but service was very slow and scattered. Our waiter seemed very distracted and it felt like he would have preferred not to wait on our table. We were there for our sister-in-laws birthday. She asked me to pick the restaurant because she likes my taste, but I felt bad that experience did not live up to our expectations. We spent nearly $400 here, won't do it again.
March 8, 2014|Excellent night out|5|Went there last minute, got right in. Food, service and atmosphere were superb.
March 4, 2014|Outstanding service|4|Another notable Providence restaurant that satisfied all diners in our party. Ambience was artful and warm, and the service was outstanding.
March 3, 2014|Nice venue, food was good,|3|Nice venue, food was good, but nothing special. Overall it was overpriced as well.
March 2, 2014|fun environment/excellent service|4|Thoroughly enjoyable, somewhat eclectic environment; prompt and attentive service; excellent menu for brunch
March 1, 2014|Solid restaurant, but underwhelmed|3|Had dinner here before a show in Providence. Very weird decor, as it is basically an old antique / curios shop, but that had a sort of charm to it. The service / staff were excellent, perfectly attentive without being overbearing. Had the crab-cake appetizer.. tasty and nice/large chunks of crab, but a tad dry. Nice sauce to spice it up though. For dinner, I had the duo of duck. it was a solid dish, but the breast was more medium and the skin wasn't crispy and the confit was over-sauced. My wife's seafood / risotto dish was also solid, but not spectacular. I have no real complaints, but for the price of the place, i had higher expectations
February 22, 2014|Never disappointed!|5|Have been to CAV on many occassions..... Took friends who had never been..... As expected, they enjoyed their experience at CAV.... A bit pricey but the food is always exceptional.... Friendly and attentive wait staff..... Will be back soon.....
February 14, 2014|valentine night disaster|2|i had heard good things about CAV from friends and from reviews on yelp. we have been to many higher end restaurants in the providence area. as we walked into the restaurant we were overwhelmed by the amount of extra tables CAV had squeezed in to accomodate extra reservations. the tables were literally a foot apart in some areas. as we sat down our waiter was clearly frazzled by the amount of tables he had. the bottle of wine took approx 30 mins to get to the table. we had to ask for bread 3 times before we received it.we ordered goat cheese croquettes for an app and were dissapointed after waiting 1 1/2 hrs for it!!!. both our entrees were ok but for $30 i expect excellent. i expect great service and great food and got neither.
February 14, 2014|Great Food!|4|I went to CAV with my wife for Valentines Day dinner for our second year in a row. The place was a lot more crowded than normal. They definitely crammed in extra tables because it was valentines day which made us feel a little less comfortable than normal and likely contributed to the mediocre service we received that night. The service was much better on previous trips to CAV. However , one thing that didn't change was the quality of the food. I had the filet and my wife had a lobster pasta dish. Both were extremely tasty. I would recommend this place if your looking for something unique and new.
February 8, 2014|Recommend|4|Found CAV on OpenTable with no prior knowledge of this restaurant. Nice atmosphere, broad selection of menu choices, attentive service and good food. Definitely recommend.
February 4, 2014|Satisfying but not special|4|I hadn't been to CAV in five years and returned for a small birthday dinner. The restaurant is lovely - the warm colors and decor made it a cozy spot for a cold winter night. The food is good but not outstanding. The menu seems safe and without much surprise. It is a good safe choice but not special enough to make me rush back for more.
January 27, 2014|Dissapointing experience|2|The place looked uniques and I took 2 colleagues there for lunch. We were not asked if we wanted anything to g to drink. No bread basket for our table. Everyone else around us got one. There were 2 waiters for the whole restaurant who were not very friendly at all and pretty curt. When we walked in place smelled funny and looked dirty as well. We ordered the bruschetta as an appetizer and it was toasted bread with ice cold toppings in the middle of the plate to make your own. The tomatoes were so cold you could not bite into them. The rest of the food was mediocre as well. The Italian tuna wrap was really salty and garlicky. Very dissapointing and I will not go there again. dirty.
January 25, 2014|A little disappointing...|3|We've been here before and it had been a great experience. This time seemed more busy than usual. Maybe that made a difference. This time around the service was very slow. The kitchen was backed up because of a large party. They brought out some wine while we waited. It happens. Calamari, tuna, hanger steak. The calamari was good, but not amazing. The tuna was very good. I recommend it. My wife's steak was ok. She said she's had better. It was undercooked and had to be sent back, but that happens too. The desert was great (salted caramel ice cream) as was the espresso. I hope it was the backup... We'll probably try again.
January 25, 2014|Bustling Antique Shop/Bar|4|The restaurant and bar are fairly small, you have to walk down a small path to find the nearly hidden entrance. Once inside it's warm and inviting with lots of unusual antiques and nick-nacks to give visual interest. The lighting is low to give it an intimate feel. For me, the prices were a bit on the high side, but the food turned out quite good. If you're looking for a cute date night or someplace different to go to, I would recommend Cav. Also, I looked over the lunch menu and those prices seemed much more on point with my typical dining budget, so you might want to start there!
