Review Title|Review Date|Review Score|Review Text
April 10, 2015|Outstanding new seafood restaurant!|4|We had read overwhelmingly positive reviews and were very excited to try Garde de la Mer. Our expectations were more than met. The wine list was impressive. The food was beautifully prepared and presented but even so, it was apparent that the kitchen prizes taste even more than style (not always so with modern restaurants). Our waiter was an obvious foodie and helped us to create an amazing meal. He was also surprisingly well versed about the wines and turned me on to a Chardonnay I actually loved. Kudos!
April 4, 2015|perfect for special occasions|5|This restaurant is absolutely perfect.. The seafood is fresh and the creations are inventive while maintaining and highlighting the freshness of the food . The service is impeccable but in the background they seem a bit informal ( chatting, laughing etc) but maybe they just really enjoy working there?
April 2, 2015|Great new addition to fine dining in Prov|5|really fabulous bartenders and edit staff, great oysters, squid and tuna. Gorgeous decor. My halibut was the only downside, wrapped in seaweed and a little mushy.
March 20, 2015|Fantastic food|5|This new restaurant is a real gem. Menu is creative and exquisite. Wine list is extensive. Our waitress was very attentive. The atmosphere is nice with low lighting and table cloths but the television over the bar diminished the romance of the place a little. Overall fabulous experience here.
March 12, 2015|a new favorite in providence|5|"Upon entering we were impressed with the beautiful interior architecture work. Service was prompt and welcoming throughout. Our waiter was a familiar face transplanted from Bacaro, another providence favorite. The food was excellent - from simple things like hot, freshly baked bread, to the tasty lemon semi freddo dessert and everything in between. I had the salmon and my wife had the scallops, both were as delicious as they were delightfully presented and prepared. When it was time for our entrees our server has plenty of help to deliver everything at exactly the same moment. I had the clam chowder appetizer and it was not only tasty but the presentation of pouring it at the table was a fun (and practical) twist. There were good non seafood options on the menu but we didn't opt for them. While dining we saw the owners of Persimmon, one of our favorite foodie finds in the East Bay, come in. Clearly the new Garde de la Mer has a buzz and is attracting foodies. I am told all the windows open up to provide an al fresco experience in the summertime. It is not yet ""discovered"", as there were many open tables in early March when we went just a few weeks after opening, so it seems they have not yet put much into marketing the place. If anything it felt a little empty but I am sure that will change as the word gets out. The bar has a towering tall ceiling and great artwork, with oysters on ice displayed at one end. It's a fun place to sit for a drink. The kitchen is open, visible and immaculate which is fun to watch. Only negatives here were that it would feel better if it were more discovered and full. Also they do not have any airlock by the door so on the chilly night there is a very cold draft as people come and go. I am sure they can figure that out, the core experience here is terrific and we will be back often. One of our new favorites in the city."
March 8, 2015|This was our first visit.  It was truly ...|4|This was our first visit. It was truly amazing. We were very pleased. It was early on a Sunday, so a bit quiet, but that made for a great opportunity to check out the view from the upper level. The food was excellent. Creative, fresh, and just enjoyable. A nice menu without too much to cause stress. We dined at the bar and the service was top notch. Very professional and well informed. Can't wait for the snow to melt and to go back!
March 6, 2015|Great dinner|4|We had dinner at Garde de la Mer with another couple--each couple split an appetizer that was excellent, and all 4 main courses were good to great. We would recommend it to friends.
February 21, 2015|Second time and we'll be back.|5|Great server. Free valet. Nice ambiance. Food yum! Loved the Maine Lobster and the Delmonico Steak. Clam chowder was very good served in a lovely manner. Great wine list too and the specialty cocktails were great.
February 21, 2015|BEST Seafood, Oysters, Atmosphere !|5|"We have been here twice, and the food has been outstanding both times. The wine list is robust, and they have some good cocktails. Their oyster bar is LEGIT with several different varieties and we have always asked them to bring the ""shuckers"" recommendation for their best selection. The seafood dishes have also been great! They also make some other great French/contemporary style cuisines. FREE Valet at the Providence G directly after the restaurant."
February 18, 2015|Fine dining for french Seafood|5|This is a very upscale restaurant at very fair prices. Creative preparations, wonderful service, delicious fresh seafood. Our second time dining there and both times excellent.
February 18, 2015|French upscale|4|New restaurant in a rehabed building will become crowded fast. May take several visits to decide if food is worth the price.
February 14, 2015|Unique Decor/ Great cuisine|5|Lovely atmosphere with romantic vibe. Delicious food, but very small portions. For the high price tag, meals should be more substantial. I am not a heavy eater and am a small person too, but I found I was hungry afterwards! Other than that it was really nice.
February 13, 2015|Good Prix Fixe Valentines dinner|5|Day before Valentine's, dinner before theatre. Wasn't expecting prix fixe, but it was very good, and reasonable (if you want 3 courses). Food was excellent -- from chowder to fish to dessert. Service was also very good, and prompt, once we told our server we had an 8 pm show. Ambiance is classy and welcoming. Good drinks, too!
February 13, 2015|Wonderful New Spot In The Providence Foodie Scene|4|I love this spot. Fresh oysters, lovely wine, and creative entrees. I've been twice. The second time however, my fish was overcooked, so maybe they need to work on consistency. The chocolate dessert is luscious.
February 12, 2015|Great addition to Providence Dining Scene|4|Garde de la Mer is a wonderful addition to Providence's fine dining scene. The food has Modernist elements and the options are interesting and beautifully presented although I'm not sure I detected any specific French influence. Rhode Island has long needed a fine dining seafood restaurant and this is it.
February 7, 2015|Thoroughly enjoyed this new dining experience....|5|Garde de la Mer is a new restaurant. My husband & I went there for his birthday and it was lovely. The ambience in the main room is very French urban with a lovely bar and cozy booths for four or more. As a party of two, we were slated to be seated in the room you enter as you come into the restaurant. We asked to be moved closer to the bar as this feels like the heart of the restaurant. The wine list was varied and had offerings across price ranges to appeal to all. The service was excellent. The staff was accommodating and helpful. The menu, as one would expect from the name, has a heavy emphasis on seafood. My husband had an octopus salad and salmon for an entree. He loves seafood and had a difficult time choosing because there were several unusual options with the specials. Each dish was creative, and would appeal to foodies. As in France, the offerings are done in numerous courses and they are portioned accordingly which was expected but the piece of salmon was particularly small. Everything was delicious, fresh and unusual. Looking forward to going back.
February 7, 2015|Top notch new restaurant|4|Found this place from Open Table, and I could not be happier. Started with oysters and squid app with black ink (outstanding). Followed this with an entre special (halibut sous-vide). The complexity of this dish was as surprising as it was delicious. Layers of flavors that you do not find often outside of big city foodie restaurants. My wife had the Delmonico steak, which arrived overcooked. We returned it without a problem, and it was a wonderful dish as well with a rich brown gravy, morel mushrooms, roasted sweet potatoes and parsnips with a base of mashed. Terrific stuff. Deserts were fantastic as well. Definetely will dine here again. They do need to beef up the menu a bit, but a great start. The server Destinie was informative, professional and attentive.
January 23, 2015|Great food and service. We'll be back.|5|Had the lobster bisque and sautéed squid appetizers - terrific. Dinner was Arctic char and the roulade of chicken both were excellent. Dessert the chocolate torte and lemon semifreddo yum. We shared everything. Loved it. The hostess is awesome and our server was great too!
January 22, 2015|Really enjoyed our time here-- the servi...|4|Really enjoyed our time here-- the service was exceptional-- really stand-out. The food was very good-- not a Farmstead (RIP), but definitely well done. Would go here over Gracies, Salted Slate, and some of the other comparable restaurants. It's very pricey, so definitely won't be a regular. I wish they had a bar menu or some substantial apps at a moderate price (so I could be more of a regular). The decor is comfortable, so would be easy to hang out here after work for a drink or for a casual work meeting if it were a little more affordable. Overall-- would recommend.
January 22, 2015|Nice vibe but still new|3|I decided to visit Garde de la Mer for restaurant week because it looked beautiful and was new to the Providence food scene. However, it seems like its relative newness worked against me because they still seem to have a few kinks they need to work out with food and service. There were long waits between dishes, not very well spaced out, and the service overall lackluster. The dishes were also salty, and the lobster bisque came out cold. Overall, a beautiful restaurant that has potential if these flaws are worked out.
January 21, 2015|I did not really read anything before I ...|5|I did not really read anything before I went there, but after being there and reviewing some comments I really must say that the others are right - what a pleasant addition to the Providence food scene! Absolutely great, from decor to presentation to taste. And I was told that there's going to be a restaurant on the rooftop during the warm season - I look forward to having that experience hopefully soon! Specifically I would like to suggest that you try their cocktails - wow! Really different from the standard fare.
January 21, 2015|Best restaurant week place I've been to!|5|Food was fantastic, presentation was beautiful, even the teabags were hilariously posh! The normal menu was a bit pricey for impoverished students such as myself (though really not that bad by Providence standards), but I definitely hope to be back here again for the next restaurant week!
January 17, 2015|Another Homerun at the G!|4|The physical space is beautiful! The wine list is awesome with gat prices...I liked the the restaurant week menu better than regular menu because I got the scallops with lentils which were heaven...but missing on regular menu (need to add either scallops or a white flake fish if you are going to be a seafiod restaurant)...waiter was great (even when fire alarm went off)...and dessert was also perfect! We will go back to eat when they add scallops to the menu, but will go back sooner just to grab drinks at bar!
January 17, 2015|Very upscale, wonderful service|5|This new restaurant has a very NY feel with excellent service, attractive and well prepared Frence Seafood
January 17, 2015|Excellent service. Love the ambiance. Fo...|3|Excellent service. Love the ambiance. Food had very little flavor. Clam chowder was too liquidy
January 15, 2015|You must go if you love fresh seafood|5|Excellent and fresh seafood with strong customer device. Desserts are also phenomenal. Try the sweet potato Genoese. Everything was spot on.
January 13, 2015|New Kids knock it out of the park|5|Let's start off with the fantastic decor. This place is just beautiful. The black and white interior, the killer marble bar, it's just classy as classy gets. And then there's the food and drinks. The Cote Garde was very nice and refreshing. The food was outstanding. My friends and I went here for Restaurant week, but I'll definitely be back sooner rather than later. The squid was tender and tasty and the aioli just tied everything together nicely, kinda like The Dude's rug. The arctic char was downright sublime. And the sauce, good lord! The torte was good, but the brown butter ice cream definitely blew everything else on the plate away. I cannot wait to go back for more. We also had a couple of oysters at the bar. Samantha, the raw bar chef/cook/shucker at the bar (not sure what title she has) was awesome. Friendly, funny, knowledgeable, and she steered us in the right direction with her recommendations. I hope this place lasts because it's a gem
