Review Title|Review Date|Review Score|Review Text
ays ago|CAPITAL GRILL NIGHT OUT|4|Food was good but like the old restuarant atmosphere was much better.
February 27, 2016|Excellent food and staff.   Will come ag...|5|Excellent food and staff. Will come again.
February 27, 2016|Top Steak house|4|This was the second time in 2 months we dined at Capital Grille , both times were special occasions (50th birthday celebrations) The food , service, ambiance were all top notch. It was such a great experience both times. My thirteen year old daughter absolutely loved it. The only misgiving is the cost , it is at the high end of $$$$ which limits going there to special occasions
February 25, 2016|Just Ok Lunch Experience|3|First time visiting the new location and was happy with the water views and sleek modern layout. Greeted warmly , seated promptly, nice server engagement. As it was a business lunch, ordered their signature cheeseburger while colleague had caesar salad with grilled shrimp which he enjoyed. Unfortunately the burger was underwhelming, cooked closer to medium -well vs the medium requested... liked the handcrafted aspect of the burger but it appeared too small for the bun! Lightly grilled onion on top with tomato along with very thin slice of cheddar was it for topping if you offer grilled onions then actually grill it as it was translucent:'(. Tasted decent but left hungry. Fries were tasty but a little on the salty side. For almost $20 was expecting more. Will try something else next time.
February 21, 2016|The food was good but definitely overrat...|4|The food was good but definitely overrated
February 21, 2016|not my favorite|3|Service was extremely poor. Bread came way after food. There are many better places to visit in Providence. Will not be my choice again unless it's a work group dinner.
February 20, 2016|Consistent with Capital Grille expectations|4|This location was similar to any other Capital Grille - the steaks were perfectly prepared to order. The macaroni & cheese was the highlight - delicious. The restaurant was very busy but not too loud. The waiter was a bit awkward at times, but he was attentive.
February 19, 2016|Best steak in town!|5|Best steak in town!
February 19, 2016|My experience at the Capital Grille|5|The Capital Grille is a very nice, upscale dining experience. The steaks are excellent, the staff extremely knowledgeable and attentive, and the ambiance is great! I would highly recommend the Capital Grille to anyone who wishes a fine dining experience.
February 17, 2016|30th Birthday Lunch|5|Our server Joe was amazing!!! Great service makes a simple lunch extraordinary. Kudos to Joe!
February 15, 2016|Capital Grille Experience|5|The whole experience was outstanding . The food, ambiance, and service were all that could be expected of the Capital Grille. The one down note was that the valet turned on my headlights from their automatic setting causing me to wake to a dead battery the next morning.
February 15, 2016|Restaurant is superior; service is poor|4|It may have been the Monday lunch hour, but the service staff was simply not engaged. The restaurant was nearly empty, but still it took forever for our waiter to take our order; for the food to come; for the plates to be cleared - even for the bill to be presented. The food was very good, but not spectacular. Prices are moderate.
February 14, 2016|It was Valentines Day, so they wanted tu...|4|It was Valentines Day, so they wanted turnover to be quick. We ordered Scallops and my husband ordered Tuna. It was ok, but we should have ordered steak I think. Dining room was very comfortable, bar area was very nice. Reservations were kept ontime. Very nice, I just think we ordered the wrong food. I also think they are over priced. Ruth Chris was very expensive, and they are not there anymore.....
February 14, 2016|Always Top Notch!|5|My wife and I visited for Valentines Day. The table had rose petals and small heart shaped confetti type decorations on the while table linens. Always a class act. We enjoyed a number of appetizers, our entree's and some wine. The food is always superb. Wait staff are true attentive professionals. We had a wonderful time.
February 14, 2016|Valentine dinner|5|Great service, great food and great way to celebrate Valentine's Day!
February 14, 2016|Presentation was wonderful and food was ...|5|Presentation was wonderful and food was excellent!
February 14, 2016|Wonderful food, attentive server, & love...|4|Wonderful food, attentive server, & lovely ambiance, but was a bit pricey. Also, 2 women at a neighboring table were obnoxious once tipsy. Otherwise, a nice time.
February 13, 2016|Amazing food, great service!|5|The coconut cream pie is life changing! I had the tomato mozzarella salad, filet, creamed spinach, and scalloped potatoes. They are literally to die for! The food is always so good! Everything is made fresh in house, down to the cookie on the coconut cream pie.
February 13, 2016|almost always good|5|Ken is always amazing. We usually gives 5 star reviews because of him. The food was good but my steak was overcooked which I understand because it was valentines day. The 2 things that made me most upset was the fact that It took 20 minutes for us to get to the valet. We were waiting inline 20 minutes just to park our car. Second We wrapped 2 steaks because we got apps and could not finish all of our food. When we got home only one of the steaks and none of our sides made it into the bag. The Capital Grill is usually our favorite place to go. Ken was still awesome and it was a fun night. I was mad that we paid for a steak we did not get (all of)
February 13, 2016|Over-Hyped|2|Went Saturday night before Valentines day. #1 accident downtown, not Capitol Grille's fault but every reservation was backed up at least 30 minutes. We sat at 8 for our 7. Other tables had hearts and red confetti on the table, not us. Waiter really did not give us his full attention. Only the filet was worth any of the a la cart pricing. Fiancee had the chicken which she said was almost not edible. Sides are cooked in a funky flavored oil. For much less money, CAV is the place.
February 13, 2016|Excellent restaurant|5|The food was excellent cooked exactly as we liked it. Our waiter was Mark Deland , he was first class and made our night very enjoyable, and the view of the city was wonderful. I would recommend this restaurant to anyone, just be prepared because it is a little pricey but worth it.
February 12, 2016|reservation was changed by the restauran...|3|"reservation was changed by the restaurant I had 9:15PM they pushed me back to 1/2 an hour..we just sat in the lounge area.Food was really good service was solid Hostess ""seemed"" stuck up..."
February 12, 2016|DownHill...Not the Value for Money|2|It was my wife & I anniversary dinner...+$350 dinner you would expect better food. And not asking for the wine you ordered when the plates hit the table. We go out a lot & were looking for a high end experience -- like Maloney & Porcelli of NYC but in Providence. We were at the Grille in old location & it seemed more high-end & better quality then. Our servicer was a nice guy but he had ton of tables on a very busy night....
February 12, 2016|Treat yourself as frequently as possible!|5|The food is wonderful: the steaks can't be beat, but I had a pork chop on Saturday night, and it was the best I'd ever eaten. It was difficult for me to order something other than a steak, but I'm happy I did.
February 12, 2016|Fabulous Steakhouse|5|A great steakhouse to visit a few times each year. The food is fabulous!
February 12, 2016|Just as we expected.|5|We had been to the Capital Grille in Boston and expected nothing less than a great meal, attentive service and a memorable evening. The restaurant delivered on all three counts. Loved it!
February 6, 2016|Great birthday dinner!|5|The food was great. The waiter was outstanding. Highly recommend!!
February 5, 2016|Birthday celebration|5|We celebrated my daughters birthday. The nice touches, rose pedals on table, a sample appetizer and the desert were all great touches. These things made the night feel special ! Only negative is they didn't have my Malbec!
February 3, 2016|Anniversary Dinner|5|When I made my OpenTable reservation for The Capital Grille and let them know it was an anniversary dinner, I had no idea just how special they would make it for us! From the handwritten card and confetti on the table and the champagne toast to the delicious dessert platter that ended our romantic meal, the staff went above and beyond to make it a night to remember. On top of that, the food was simply outstanding.
February 3, 2016|The new location is beautiful. Much larg...|5|The new location is beautiful. Much larger bar area. What can say the food, service and ambiance is always top notch. We have never had a bad experience there.
February 2, 2016|Great service and setting, but they didn...|3|Great service and setting, but they didn't know how to cook a filet medium...when you pay $50 for a 10oz I would expect to get it cooked right!
January 29, 2016|First Time in Providence|5|My wife and I travelled to Providence for a long weekend getaway. We wanted to dine at a nice restaurant, but Providence is inundated with highly reviewed restaurants and we chose The Capital Grille. Wow! The moment you walk in one knows there are high expectations. The ambience, the patrons, and the staff complemented the experience. Every part of our meal, including, drinks, were uniquely remarkable. Our waitress, Meaghan Lombard, had a command of her service and amiable personality. Superb choice!
January 26, 2016|Good but...|4|Overall, the Grille is great. You typically can't beat the quality/level of service, the food and the atmosphere. My most recent experience left me wondering if they were slightly understaffed. It took about 7-10 min for the server to greet us. We then had ordered a bottle of Champagne, only to find out 10 min later that they were out of stock. So after not being greeted, then running out of stock and then finally choosing another bottle, it was 25 min before we were able to take our first sip. The rest of the evening went a bit better. This isn't a typical experience at the Grille and certainly shouldn't discourage anyone from going, but it's worth mentioning. We'll be back again.
January 25, 2016|A birthday fete|5|Service was impeccable as always. We were seated right away. I've never had bad food, ever. Yes, it's pricey...but you get what you pay for and you won't be disappointed. oh...the salted caramel ice cream- DREAMY!!!
January 23, 2016|Snowstorm birthday|5|I had made a reservation for my husbands bday before I knew we were getting snow. The restaurant was still open so we went an hour before our reservation and there was plenty of openings. This was our first time in the new location. Our server Nicole, was very nice and was very attentive to us. Our food was delicious. We both had the filet and the lobster Mac and cheese which is so decadent. The birthday dessert was delicious. My only detractor was that we were seated near the kitchen which was a little noisy. There were plenty of other tables so it was an interesting choice to place us. We will definitely be back.
January 23, 2016|The Capital Grille never disappoints.  T...|5|The Capital Grille never disappoints. The potato chips at the bar are fantastic and the the best stole doll around. Thats not to overlook the fantastic steak and always wonderful service at this location.
January 22, 2016|Great place|5|Excellent Resturant enjoyed the meal and the service was excellent.
January 22, 2016|Solid place with consistent quality--new location|4|The Grille has been a solid and consistent location for many years and that hasn't changed. The new location is terrific inside with nice outdoor views. The big negative however, is the lack of any parking and poorly executed valet parking. A restaurant of this stature needs a better solution. The balance, the food, service, ambiance, etc. are all solid. The old location had the superior parking solution.
January 22, 2016|Always a good meal!|5|Love the Capital Grille, was disappointed when they moved as I liked the old, original one but love the new one. The bar is bigger and open and love the decor. It is by far the best restaurant for Providence restaurant week you will find.
Dined on January 22, 2016|Food was great as usual. Busy night due ...|5|Food was great as usual. Busy night due to restaurant week but it didn't affect the service at all. Love the new look at the new location.
January 22, 2016|Absolutely delightful!  Outstanding serv...|5|Absolutely delightful! Outstanding service, delectable food and the their new digs are quite impressive. :-) Took advantage of the restaurants week special, it was a great value.
January 22, 2016|Always Outstanding|5|"Capital Grille - Providence, is the place to go for a special occasion. Have been there for wedding anniversaries, business dinners and special out-of-town guests. This most recent visit was to celebrate an upcoming retirement for the only Jesuit priest assigned to Rhode Island. The priest got caught up in his duties and we knew he'd run a little late but then he got lost. While lost, he called the restaurant for directions which were happily given. Despite our not being ready to eat for 40-45 minutes after our reservation time, our server, Megan, and staff were consistently cordial, friendly and understanding. The service, as always, was excellent and it happened to be the last night of ""Providence Restaurant Week"" and all the things I was going to order were there for a reduced price. Can't beat it!!!"
January 20, 2016|Perfect for birthday dinners. They made ...|5|Perfect for birthday dinners. They made my birthday extra special.
January 19, 2016|My fave for Providence Restaurant Week|5|Great value for Providence Restaurant week! Steaks were perfectly cooked. Made for a great dinner with friends! Gorgeous location and excellent service combined!
January 19, 2016|Nice view in expansive restaurant|5|I like the new location in old Ruth Chris Steakhouse building. Steaks are the reason to go. Delicious. Service is very attentive.
January 18, 2016|Dining as it Should Be|5|We went here for Restaurant Week. We've been to other restaurants that skimp and give a lesser dining experience for Restaurant Week. Not Capital Grille! Three steak options were available, as well as two delightful desserts to choose from. Our server, Matt, was helpful and fairly on-top of things - offering anchovies for the Caesar Salad and getting the name of that excellent Claret for us to take home. The food was exactly as you would expect it to be at Capital Grille - delicious and impeccably presented. Over all a very good dining experience.
January 17, 2016|We had another great meal at The Capital...|4|"We had another great meal at The Capital Grille. We've been to The Capital Grille Providence several times, but this was our first at the new location. The more modern decor adds some excitement or ""life"" into what used to feel more like ""your father's"" chop house. The steaks, sides, and cocktails were superb, as usual. Everything was perfectly prepared. My complaint, which I hate to make but cannot let pass, was the service from our primary waiter. Never at a restaurant of this caliber have I witnessed a waiter reaching over and across a patron, but ours did it routinely to place new silverware, pick-up dishes, even passing hot soup across my daughter to serve to my wife. There was plenty of room for him to work around the table, but maybe he was tired due to a long Providence Restaurant Week. Regardless of excuses, at a restaurant like The Capital Grille, I expect better. I expect near perfection."
January 17, 2016|restaurant week|5|was a fantastic deal; food was phenemenal. Waiter was knowledgeable - will definitely be back.
January 16, 2016|A little disceiving, not as advertized!|2|We made our reservation through Opentable from the advertised restaurant week website. Once we sat at our table the waiter informed us that they don't honor the restaurant week menu on Saturday's. We sometimes try new restaurants during these promotional weeks, it’s a great way to try a premium restaurant without over paying for a potential disappointing night. The food and atmosphere was good but I dislike misleading deceiving advertising.
January 15, 2016|Delicious!!!|5|The service was absolutely amazing! Very friendly and tentative. We had a 30 min wait on our reservation and received complimentry appetizer because of the wait, which was really nice because normally that doesn't happen at other restaurants. Food was amazing and cooked to perfection! Atmosphere was very mellow and welcoming.
January 15, 2016|Very disappointed|2|We made reservations through open table for 7:45pm.. We arrived at 7:30 and the desk person told us they were running late. So we headed to the bar.. It was very hard ordering drinks at the bar (very busy, bartenders were overworked.) The wines by the glass only offered 4 different Cabs (for a steak house I find this very strange.) At 8:15pm we approached the manager to find out how much longer our wait would be. She was very apologetic about the lateness and very nice. However we did not end up sitting down at our table until 8:30. They did give us calamari on the house (my sister is allergic to fish so she could not eat it.) the food was excellent, but inadequate service. My sister asked for a diet coke 3 times and my mom had to ask for her wine a couple of times before the waiter brought it... We were very disappointed... The creme brûlée was actually very runny too.... I think that they were overbooked because it was restaurant week... My sister and I used to go to the old capital grille in providence and the service there was always impeccable .
January 15, 2016|Great Time|5|great food as usual. Super attentive waiter. Decent value w/Providence Restaurant Week. Valet parking pickup is painful
January 15, 2016|Great meal in beautiful surroundings|5|This was our first visit to Capital Grille since they moved into their new location. There new site is beautiful! You feel like you're in NYC! The waitstaff is wonderful - helpful without being over-present. I had a nice clam chowder - smooth and flavorful and my friend had the Wedge Salad & enjoyed every bit. I had tenderloin which was cooked perfectly and was very tender and flavorful. My friend had surf & turf - a perfect filet with beautiful, huge shrimp. For dessert I had the flourless chocolate cake - best I've ever had and my friend had a wonderful crème brûlée. Interesting was that for the first time in almost 2 years, he was pleased with his very dry martini - perfection! We can't wait to go back. Hope you get Matthew as a waiter...he is charming and knowledgeable :)
January 15, 2016|Always consistent|5|Just dined at Capital Grille Providence during Restaurant week. Martinis at the bar with Bobby were perfect. Three course dinner with Mark as our waiter was cooked to our liking and consistent with other times we have dined there. Great steaks! SAMs mashed potatoes are very good. We love this restaurant for special occasions.
January 14, 2016|This place was outstanding, our first ti...|5|This place was outstanding, our first time left a great impression. The steaks were great and the restaurant menu was a great value. Make sure you try the lobster Mac and the stolie Dollie!
January 13, 2016|Always an excellent experience.|5|Always an excellent experience.
January 13, 2016|Restaurant Week|4|Wonderful petite filet mignon during reastaurant week. Mine was cooked perfectly however, my dinner guest's was over cooked. True to being an upscale restaurant our waiter made everything all right.
January 13, 2016|Great steak bad service|2|Steak was delicious. Sides were cold. Took 20 minutes for a drink refill. Waiter never checked in on how food was after it was delivered by staff. Waiter had arrogant rude demeanor. I have frequented this place for special occasions often throughout the years and this time it will be my last.
January 11, 2016|Happening Place|4|"We were here on a Monday night, and oh boy this place was hopping. Maybe because it was Restaurant week in Providence or its just busy all the time. Anyway, the food was great the service was very attentive, very friendly staff and will certainly return. I liked the mashed potatoes very much, they didn't have that ""restaurant taste"" more like home made and also the green beans were very good as well. The filet was cooked perfect and was fabulous!!!! Anna"
January 10, 2016|We went for restaurant week, the menu wa...|4|We went for restaurant week, the menu was great. We really thought the meal was very good. I even liked the flourless cake. I am not usually a dessert person.
January 10, 2016|wonderful dining experience|4|Don't be upset having to wait for Valet. Once you get into the grille, the experience makes everything worthwhile. The food is consistently excellent and the wine menu is out of this world
January 10, 2016|providence week|5|providence week is something we always enjoy. It is wonderful food and we really like the value.
January 10, 2016|Capital Grill, Providence|4|I'm glad it was Restaurant Week. The meal would be vastly overpriced if I hd to pay the menu prices for it.
January 9, 2016|Excellent Evening|5|From start to finish, an amazing time. Hostess couldn't have been sweeter, bartender make an amazing French Martini and dinner was, absolutely fantastic. Ken, our server, was truly the best. A fantastic sense of humor and white glove service. If you visit, you must ask for him. Even thought though I often dine in Boston I would travel to RI for this experience.
January 9, 2016|Amazing|5|The food was out of this world. Service, from the greeting to the bartender to the server was fabulous. If I could give this place 6 stars, I would. My wife and myself will definitely be back.
January 4, 2016|I met a few friends there for dinner. Th...|5|I met a few friends there for dinner. The complimentary valet is a nice touch. The food was exceptional and Zo took special care of us! We were impressed by every step of service, every course of food, and that management took the time to come around to say hello to guests.
January 2, 2016|The Capital Grille is always a good take...|4|The Capital Grille is always a good take and this time was no exception. It was our 1st visit to the Providence location since they moved into the old Ruth Chris space and the ambiance was spectacular. With outdoor seating available it should be even more spectacular in the warm weather. Our waiter Tom, who has served us before, is the finest server we've ever had. Everything was timed perfectly and we did not once find ourselves looking to find someone to provide any type of assistance.
January 1, 2016|We celebrated my mom's birthday on New Y...|5|We celebrated my mom's birthday on New Years day. Joel, our server was excellent. He paid attention to every detail. The food was fabulous and all the extras greatly appreciated.
December 31, 2015|First time at new location and...|4|Really like the new place. Makes me realize how cramped and dated the old place was. Definitely an upgrade - larger bar, larger dining room, more private dining options and while packed for NYE, it wasn't like you were sitting on top of other patrons. That being said, I do have some issues... The parking garage is a lot less convenient if you decide you don't want to valet. The prices at CG, across the county, have increased significantly over the years (seriously, my bone in filet mignon was $60 - while delicious, really???). On a busy holiday night you might get seated in a private dining room. While they're nice, it's obviously designed for a dinner program with a sales company and not fine dining (e.g., credenza, large screen tv on the wall, limited artwork). Same pricing, less scenic seats. Coat check appears to be gone. While they might take your coat, no one offered and I didn't see it. And, lastly but certainly not the least important, they're not participating in Restaurant Week 2016 on Saturday nights - so it's full price. Also, if you go for Restaurant Week lunch, you're paying for parking. Not much of a deal. Beyond that, though, a really good CG with really good food. Just be prepared to really pay for it...
December 28, 2015|"I liked the capital grille before. 

I L..."|5|I liked the capital grille before. I LOVE it now since they moved across the street. Amazing ambiance!! This is the place to experience an amazing meal with great customer service.
December 27, 2015|Very accommodating.  I asked if they wou...|5|Very accommodating. I asked if they would swap the lobster with the sea bass (surf and turf dish). They did so happily. About their new location: I have to say IMHO the old location at Union Station seemed to have more ambiance. In their defense it may be because our usual waiter (Matt Walters) was not on duty, plus it was a rainy day. Since we dine there multiple times a year, I shall review again.
December 24, 2015|Wonderful !!!|5|Our dining experience is always extraordinary at this restaurant. The menu provides many excellent choices. Service is beyond expectation.
