Review Title|Review Date|Review Score|Review Text
October 10, 2014|Visited Rhode Island and left Happy|5|I am not one to enjoy a extremely quiet evening at dinner, so from the very beginning I felt comfortable with the noise level. It wasn't too loud nor was it so quiet you have to lean into your spouse to talk because you feel as if the table next to you is listening. The pace at which the food came out was superb. Kevin was our server in the Providence, RI location and he was a delight and was very thorough with the menu descriptions and was open to all questions. My husband's steak was perfect, but mine was MW when I had asked for Med. The manager came around to ask how everything was, he kindly and immediately took my steak and returned with a new Med. cooked steak in 5 minutes. Great service, great food, great staff, great experience.
October 10, 2014|How to Begin a Great Weekend!|5|Friday evenings at the Lounge in the Capital Grille create a special feeling. Phenomenal onion soup adapted to our tastes, tasty salads, and the fantastic Wagyu burger along with the best waitstaff and top-notch entertainment in the lounge are all the components one needs!
October 10, 2014|Fantastic Evening|5|Everything was fantastic. Food was fantastic, service was great. We had a spectacular date night!
October 4, 2014|23rd Anniversary|5|The Capital Grille took care of us from the time I made my reservation. They had our table ready in a very nice area with rose petals on the table. They had my wife's favorite drink brought to the table for her (from my request when making the reservation). Our waiter Tom did a great job so did the table help. All were very friendly and always asking if everything was the way we wanted it.
October 3, 2014|Our dining experience was great. Service...|5|Our dining experience was great. Service and food fantastic
October 2, 2014|Excellent steak|4|I had the steak au poivre and it was very good. My spinach salad with warm bacon dressing was to die for...
September 27, 2014|Capital Grille|4|The food and service were outstanding as usual. Not much else to say.
September 27, 2014|Exceptional|5|My wife and I celebrated our fifth anniversary here. I made reservations through Open Table as usual. The table was covered in rose petals, all servers knew it was our anniversary, everything was phenominal. Food was out of this world. I had the filet with poached butter lobster tails and so did my wife. That dish is so delicious words do not suit it. The coconut creme pie was for dessert, I highly recommend it!!! Overall, 5 star visit!
September 24, 2014|Perfect|5|Need we say more? Expensive, yes. Worth it? We think so.
September 20, 2014|Second great evening in one week|5|We so enjoyed dinner at The Capital Grille, Providence - that we returned on our last evening in the city. Again - it was delightful. It was a Saturday night - energy and noise was multiplied - and it was hard to talk with my husband across the small table. We gave up trying to talk for the most part and saw other couples doing same. The restaurant was so busy there were some challenges - we felt a bit rushed by staff - clearly anxious to keep tables turning - and two people offered us fresh cracked pepper - the second started to grind without waiting for the answer - we both dove to save the meat. Then the manager stopped by - and offered to send for our waiter to bring fresh cracked pepper... So I'd recommend a weeknight visit, not Sat.
September 20, 2014|Beyond Amazing!!|5|Everything about our visit was perfection..Our waiter, Mark, made sure everything was beyond our expectations!! Food was outstanding!! Steak tartare, Delmonico for me...couldn't have been any better..steak cooked perfectly!! Lobster bisque (loaded with lobster!!) and porterhouse for my husband also the best!! When they asked if we were celebrating a special occasion, we said not tonight but a big anniversary in a couple of weeks..we assumed just conversation ..Nope!! We were surprised with a beautiful dessert platter with Happy Anniversary stenciled in chocolate!! Beautiful and so appreciated!! But, to top it off, we were given champagne glasses to take home to use on our actual anniversary!! Can't say enough how perfect the night was!!
September 20, 2014|Out of this world!|5|This place is out of this world fantastic! I wish I could give it 10 stars. I have always heard wonderful things about the Capital Grille so was looking forward to trying it. We eat out quite a bit and it is one place I have not eaten at before. Exceeded expectations. It was my husband's birthday so I asked if we could have a romantic table. Well, not only did we get that, everyone wished him happy birthday, there were little sparkly foil leaves on the table when we arrived, we received a free glass of champagne and dessert. Our server, Josh, was awesome! Very attentive, friendly, and just made the night that much more special. The food was terrific. A big thumbs up. Many thanks for a very special evening!!
September 17, 2014|This is a GREAT Capital Grill|5|We arrived in Providence tired and ready for dinner - - we opted for the capital grill because it is reliable - and it was close to our hotel. And days later we are still talking about our evening there. Everything was great and our waiter helped us unwind from our travels. We were able to relax and enjoy a memorable evening together. everyone - from the hostess to other waiters we passed as we left - smiled and acknowledged us kindly. We left feeling so much better than when we arrived - with a really great meal to boot! Thanks for being the highlight of our trip.
September 17, 2014|well prepared food, extensive wine list,...|5|well prepared food, extensive wine list, my only complaint was a food being served barely lukewarm.
September 16, 2014|Great|5|Great service and made our special occasion memorable.
September 13, 2014|Outstanding service|5|Outstanding service by our waiter Mark and bartender Tim. Expensive, but you know that if you know anything about The Capitol Grill. But, you also know the good, service and dining experience is outstanding.
September 13, 2014|Great evening|4|Went for a special anniversary. The entire staff seemed to take the time to offer congratulations. Rose petals on our reserved table. We were seated near a large party of approx. 20, made the noise level very high.
September 11, 2014|Never disappoints|4|We go to Capital Grille for many special occasions. We are never disappointed. Service, food, wine. All good!
September 10, 2014|Menu is considerably over-priced. Food i...|3|Menu is considerably over-priced. Food is reasonably good although the steak tartar appetizer was far too piquant and the serving was far too large for an appetizer - and of course the price was commensurately high. The serving was bulked up with excessive egg, capers, onions. Entree prices were very high relative to the quality of the items and were again larger than necessary serving sizes. Service was excellent.
September 6, 2014|Wonderful evening|5|Great food and warm friendly service- will not disappoint for a special occasion.
September 5, 2014|Royal Treatment|5|My son's choice for his 23rd Birthday. It was wonderful. We all enjoyed the evening, food, service and experience. We expect nothing less from Capital Grille, we were treated like we where family.
September 2, 2014|Great Service & Food|5|My wife and I had dinner on our wedding anniversary. We could not have been treated better or made to feel more special. Service was outstanding and the food matched it. Can't say enough good things about this restaurant !
August 26, 2014|Amazing meal and impeccable service! Gro...|5|Amazing meal and impeccable service! Group work dinner- perfect location and delicious food! Our server Ken was the BEST!
August 23, 2014|Great for Waterfire nights!|4|Food was top notch..however out of asparagus at 7pm?? 2 dinners 2 sides no alcohol $180 Great time..not rushed.
August 20, 2014|Great|5|Never disappointed. I have always a great meal and great service no matter the size of the party.
August 17, 2014|Over-Priced|3|We went on a Sunday night - very few people there. The restaurant is elegant and understated. Service - while not immediate - was very good overall - lacking small details such as not removing used sweetener packets until the end of the meal. Biggest disappointment was the food - not that it was bad, but it does not merit the extraordinarily high prices charged. Our bill, including tip, was $190.00. This was with one appetizer and one dessert, which we split, one glass of wine, two entrees and two sides. The heirloom tomato and mozzarella appetizer was OK, the tomatoes were good, but the mozzarella was at best pedestrian. Our entrees (sliced filet and lamb chops) were ordered medium but came medium-well. Dessert was OK.
August 15, 2014|Never Disappoints|5|Brought some people who had never been before, they were blown away. The food from beginning to end was perfect. Kona crusted bone in sirloin is the best steak I've had anywhere. The Capital Grill finds away to exceed my expectations every time.
August 12, 2014|Best Birthday Dinner Ever|5|"My sixteen year old daughter wanted a ""fancy dinner"", and chose Capitol Grille. The ambience, table setting, food and service were exceptional and without flaw. This is a dinner she will never forget."
August 9, 2014|won't go back|2|Too bright, mediocre service, food unerwhelmed, over priced. Loaded with 'special occasion' diners - HS and/or college graduation, retirement party, kid's b'day dinner, HS proms probably in the spring, etc.
August 9, 2014|Although we had to be an HOUR late for o...|5|Although we had to be an HOUR late for our reservation -- they held our table by the window with a nice view, as I had requested!! That was really nice of them. We were also given a champagne toast for the birthday dinner and a plate with desserts at the end of the meal that had happy birthday written in chocolate on the plate!! Nice. Food was good - service was done well - great night!!
August 9, 2014|Good as always|5|"My wife I had dinner here for her birthday and we had a fantastic meal. I am rarely let down by the Capital Grille. The one surprise (and it is was positive) was that we decided to try ""the Generous Pour"" wine selection they are offering this summer. It was actually a really good deal, which is not something I usually walk away from the Capital Grille saying. $25 per person to try several wines and then have glasses of those you like the most was a great way to sample some wines. I would highly recommend it."
August 2, 2014|Great Food and Service|5|Food and service was fantastic . Atmosphere is loud
July 29, 2014|First Date|5|I meet a woman it was a our first date and i normal would pick a nice resturant but this was top five nice in all of new england. she was sophisticated and intelligent. so that being said the crowd there is very upscale and please dress nice not jeans and a nice shirt nice but slacks wingtips and collard shirt nice. a must have is the wine tasting. but i ordered a champaign bottle much better then by the glass. truffle fries aren't as good as a years ago when i went there but that would be my only complaint and if you have to complain about the prices. you really should go or have gone to another place. this place is it when you won't to splurge.
July 26, 2014|Perfect Night!|5|What a treat! I took my boyfriend here for a birthday surprise, and the two of us shared a leisurely dining experience with the most pleasant server. From start to finish, everything was divine. The blue crab cocktail melted in your mouth, as did the kona-crusted steaks and butter-poached lobster tails. Seating outside is especially nice, and even though there are people walking by and close enough to talk with, it doesn't feel intrusive. We were there on a full-lighting WaterFire night, and the restaurant is within a minute walk from one end of the display. I wanted this to be a special night, and The Capital Grille raised the bar! Thank you!!
July 25, 2014|We were at the Providence,RI Capital Gri...|5|We were at the Providence,RI Capital Grill. It is a favorite. This one is lively and fun even for older folks like us. We were celebrating an anniversary and our waiter,Ronny, could not have been finer, even bringing us dessert and champagne as a gift on the house. Also has a great location near Waterfire for which Providence is famous.
July 25, 2014|Lovely|3|Wonderful evening dining outside with music sung by Tony Cerbo Food was good as was service but neither were outstanding.
July 19, 2014|Great experience!|5|I celebrated my birthday at the Capital Grille with 6 of my best friends and it was a wonderful experience. Our server was excellent- funny, friendly and attentive. But the true reason to go here is for the food! It is to die for! The steaks are cooked perfectly and the flourless chocolate cake will be something I dream about for months to come. I'm definitely going back!
July 19, 2014|Anniversary|5|My husband and I went with another couple to celebrate both of our Anniversarys. Was amazing, food was wonderful and the service was awesome. We have never been, we will be back. If your looking for a special night out with your spouse, this is the place--great food, great wine--you will not want to leave. At the end they came out with cheese cakes and Happy Anniversay spelled out in chocolate---so yummy. Getting all dressed up and having great food and wine is the way to go! Love it we will be back!
July 19, 2014|Excellent Evening|4|Had a wonderful dining experience with my wife as we celebrated our anniversary. From the moment we entered the restaurant we felt like special guests at someone's home. The staff went out of their way to acknowledge our special occasion and to make the night memorable. Our waiter, Matt, was super attentive and allowed us to dine at a very enjoyable pace. From the hostess, to the bus boy, and all the way up to the general manager everyone was professional and friendly. The food was absolutely wonderful. Everything was prepared precisely to our liking and tasted wonderful. I've dined at most of the fine restaurants here in Providence, but I'd have to say that the Capital Grille is certainly in my top three. Well done Capital Grille!
Dined on July 19, 2014|You won't be disappointed|5|We had a wonderful experience at the Capital Grill. A strong pour at the bar, being seated at our table on time, a very thorough and friendly waiter, and then the food itself, which was just perfect.
July 19, 2014|The food was very good, steak was cooked...|4|The food was very good, steak was cooked to my liking.
July 18, 2014|mistake to go during restaurant week.  w...|3|mistake to go during restaurant week. we weren't even offered alternatives and service was not friendly. The food was good in this usually reliable dining experence
July 18, 2014|Another Perfect Evening|5|Capital Grille's Outside Dining on a Friday night cannot be beat with great food and Tony Cerbo 's entertainment!
July 18, 2014|Love the guys on the bar at the grille. ...|5|Love the guys on the bar at the grille. All super friendly and can have a chat with you over lunch. The only small negative is that they end the lunch menu early. Pity they didn't offer it until 3:30 as some of us like a later lunch with drinks... Chose off the bar menu instead.
July 17, 2014|Very good service-OK food.|4|Service was very good-food was fine-just did not knock my socks off as it has before.
July 16, 2014|Great Service, Food, and Ambience|5|Great place for a special occasion. Prices are high, but that is compensated by the excellent food and service
July 16, 2014|Excellent Service|5|Very efficient, non-invasive service. Excellent waitperson (Meaghan) was extremely professional.
July 15, 2014|A Great Evening Out|4|We went during Providence Restaurant Week, besides being a bargain it was a delicious meal. Loved the rich and creamy clam chowder and the Caesar's salad. The service as expected was friendly and cordial. We each had the sirloin steak and they were perfectly cooked as ordered. The mashed potatoes were creamy, the string beans had a nice crunch to them, The basket of bread had a nice selection. The cheese cake was a good ending to a great meal.
July 15, 2014|Very accommodating|5|The food and service were outstanding. We had to change the time of our reservation at the last minute and they were very accommodating despite it being restaurant week and extremely busy. We had a party of seven and every individual enjoyed their meal choice. The portions were just right and the meal options were varied. The service was attentive and at no point was there a beat missed nor did anyone feel rushed. I would definitely dine here again.
July 15, 2014|Terrific in all respects!|5|Four of us decided to have lunch here as part of restaurant week in Providence. We were not disappointed. The choices on the menu gave a idea of the quality that The Capital Grille is renown for. The food was excellent in all respects. We'll definitely return.
July 13, 2014|Really exceptional food|5|I always dismiss this place as a chain of sorts, but every time I'm back, I remember that it has really great food. Even being here for restaurant week, where quality amongst some places undoubtedly drop, the service and food remained outstanding-will be back soon!
July 13, 2014|not so good servive|1|Food was very good as usual. The service was bad. We were asked if we would like additional sides. We said yes and they never came. They just collected our dishes. We were not asked if they could validate our parking ticket until we asked them. They supposedly validated it but had to pay $11 to get out. There was no validation. Even getting water was slow.
July 12, 2014|Great Meal|5|Outstanding meal, service and ambiance! Both the Kona steak and the salmon were excellence, and we always love to dine outside if we can get a seat.
July 12, 2014|Pleasant surprise|1|We hit restaurant week without knowing ! What a super deal. Everything was perfect from food to service to dining outside in July!
July 11, 2014|Our dining experience was decent, howeve...|3|Our dining experience was decent, however, the service was truly terrible. It took our waiter over 10 minutes to greet us and over 30 to place our order. This continued throughout our meal. He did not apologize, nor would he even make eye contact with us as he passed. When spending so much money, you hope to be treated special, and this was the opposite.
July 11, 2014|Outstanding Evening!|5|"My husband and I made reservations and requested a particular server who happened to be working outside this evening. It was a beautiful night and to our surprise there was live entertainment outside as well!! We had a fabulous dinner and participated in the ""Generous Pour"" which was a real treat! We danced to the tunes of Frank Sinatra and truly had a wonderful time."
July 11, 2014|First disappointing visit|2|"We have been to this restaurant many times and have given it very good reviews prior to this. 1. We were not seated where we requested although there were tables in that station that remained available throughout our meal. 2. Approximately 10 minute wait to be greeted by our server who then said he would be with us in a few minutes. 3. A different server brought our our steaks while my wife had 1/2 of her chowder still in the bowl and asked her, while she was literally taking a spoonful, ""Do you want to hold onto that for a while?"" He then waited for my wife to move her bowl so he could set down the steaks. 4. Salad with steak was soggy and seemed to have been dressed for a long while."
July 10, 2014|Anniversary dinner|5|Took advantage of Providence Restaurant Week to try some place a little out of our price range. We were not disappointed! The food and service were terrific! The noise level was pretty loud, so it was not as easy to carry on quiet conversation. Overall, excellent!
July 10, 2014|Food and service was excellent! I would ...|5|Food and service was excellent! I would recommend it to all my friends.
July 9, 2014|I love restaurant week|4|It was restaurant week. The menu even restricted had enough choices for every taste. The service was outstanding and the sirloin steak owas tender and juicy cooked to perfection. For once the green beans were crunchy but cooked, and the mashed potatoes were like velvet. Because we started with a delicious Cesar salad , we could not handle the dessert which we took home in a nice box and a small brown bag. I had the dessert two days later and the chocolate espresso cake tasted as fresh as the day it was made. In conclusion a very positive experience.
July 9, 2014|What a Perfect Night!!!|5|Everything was Fabulous from the moment we walked in the door, our table looked beautiful with rose petals all over, to the yummy drinks, the food was absolutely delicious and the dessert was to die for and a big shout out to our server Nicole Egan for making our first of many visits to The Capitol Grille a very memorable one, everyone was friendly, asked how the food was, even struck up conversations about other things, it was very relaxed and comfortable evening. I felt very fancy but yet down to earth, my husband and I will definitely be back to dine!!! Thank you 😊
July 9, 2014|Great Lunch|5|The Staff here are wonderful. Polite, friendly and very helpful. We were there for lunch and it was served at a very leisurely pace. The food was excellent. The restaurant is very elegant inside. It is a great special occasion restaurant. The acoustics are not ideal and at times I could hear a hum of conversations in the background. However to put this in perspective it is very typical of restaurants in general.
July 8, 2014|Superb food and service|5|Although our visit was during restaurant week, the food and service were superb.
July 7, 2014|Great experience|5|The food was outstanding and the wait staff was attentive. Excellent!
July 7, 2014|Good restaurant week choices. Excellent ...|4|Good restaurant week choices. Excellent service. Perhaps slightly too quick
July 6, 2014|One of the Best in RI|5|Enjoyed a great meal and perfect service while dining with my wife, sister, and brother-in-law. Perfect place for many different occasions.
June 28, 2014|Anniversary dinner|5|The food and service was wonderful. The restaurant went out of their way to make our anniversary feel special. We received champagne, appetizer, and dessert free of charge along with our table decorated with rose petals. I definitely plan on going here for future special occasions. I expected the food and service to be excellent and they did not disappoint. The restaurant exceeded my expectations with the little attention to details.
June 28, 2014|Had a wonderful time.|5|We were a little skeptical about visiting a restaurant which is part of a chain. We had negative experiences at other restaurants such as Flemings, who are part of a chain. But The Capital Grille was the complete opposite. The staff was wonderful, the food was delicious, and the environment was clean and comfortable. My wife and i would recommend this restaurant to anyone, and we definitely would become repeat customers.
June 28, 2014|satisfied/ disapointed|4|The ambince was verygood we had window seating, our server Joshua B. was outstanding it was my wifes birthday and he treated her great even gave her a birthday desert. I had the portherhouse and my wife had the filet migon both med meaning hot pink center which i felt was not cooked to a guality of a high level steakhouse, the beef looked like it was cooked at a low temp/ broiler outside of our beef had little color and 3/4 of our beef was med well. I would have expected our beef to be cooked at 1100' to give it a good seared.
June 21, 2014|Always fantastic!|5|We love the service, the extra little perks (free: lobster appetizer!!!!) and the food is always perfect!!!
June 17, 2014|Birthday|5|Took my son out for his 21st birthday. The wait staff went well above and beyond what I had expected! On top of that the food was excellent.
June 14, 2014|anniversary celebration|5|Went there for our anniversary. Very professional but friendly at the same time. The appetizers and meal were outstanding and our waiter Joel was excellent. Would love to try this experience again.
June 14, 2014|outstanding|5|I live in CT and was in RI to visit and came here for dinner let me tell you that was one of the beat meals I have had in a long time. Will definitely come back
June 14, 2014|Dined Saturday 6/14|3|We celebrated my birthday and Fathers day as we always do. Food is always fantastic as well as the service. Out Waiter was excellent. Our food was perfect until my hisbands steak arrived at the tabler. He ordered the Steak Special Medium and it was cooked well done. The steak was taken back and cooked another one, but my meal was already there. We ordered AuGratin Potato and we where served Mashed. We shared my steak. The right order of Potatoes came to us 3/4 of the way throught the meal. Husband steak was brought to the table still not cooked properly now it was to rear. This has to be one of our favorite resturants in RI and we where disappointed.
June 14, 2014|Upon entering we were asked what was the...|5|Upon entering we were asked what was the occasion for our visit. We explained that we are celebrating our birthdays. The wait staff decorated our table with birthday confetti and everyone that interacted with us wished us a happy birthday. When finished with our exquisite meal, the waiter and manager came over quietly with a happy birthday plate holding two delicious pieces of pastry and wished us a Happy Birthday. What a nice surprise! Between the food, wait staff, and finishing touches, our experience was very satisfactory. I would definitely dine here again.
