Review Title|Review Date|Review Score|Review Text
July 6, 2012|If you are not from the area|4|"If you are not from the area this restaurant is upscale pricing (not Pub 99). The service was excellent, it was perfect to celebrate our anniversary... everything is ala carte so beware & share! The sides are almost family style. The steaks were very good, I probably just chose the wrong sauce/flavor which is why I only gave it a ""good"". The desserts were great and just overall, if you have the money to go for it, just do it. For 2 people w/desserts and cocktails the bill was over $200 just to give you an idea... but ... you get what you pay for. Its a great place to get dressed up for, bring excitement back to your date night... its well worth it..."
June 29, 2012|Food was good, lobster bisque|3|Food was good, lobster bisque great - can't say anything wow'd me...we were celebrating a birthday and they brought over champagne and dessert - gratis - which was very nice! We will be back, but won't rush.
June 27, 2012|We enjoyed a wonderful evening|5|We enjoyed a wonderful evening celebrating our anniversary. Food was as expected, fantastic. To say the service was excellent does not do it justice. Our waiter was attentive, but we were not rushed. Our special occasion was aknowledged quite nicely. Will return. Easier to go to Providence vs. Boston. Really nice evening.
June 23, 2012|We were celebrating a birthday.|4|We were celebrating a birthday. The waiter and manager were noted to ask surrounding tables if there was a special occassion. But not at our table. Kinda disappointed that we were not recognized for have a special occassion. They gratefully split an appetizer for us and presented it nicely without an extra charge. Entrees were good.
June 9, 2012|Always great...always costly!|5|The cost makes it a special occasion place in my household, however you will never be disappointed. Carnivore heaven!
Dined on June 9, 2012|The occasion was my wife's|5|The occasion was my wife's birthday. Made reservations for 2 and changed to 5 24 hours prior with no problem. Although not served by our favorite waiter, the fellow that did work the table was fantastic! But then again, all people are there. The service was very timely with plenty of time to talk, determine choices and place the orders. The food for all was perfectly prepared with everyone pleased with every aspect of the meal. The Bar and Bartenders were also exceptional with all drinks nicely priced and prepared. We will go back again for our anniversay in early July!
June 9, 2012|We enjoyed the Capitol Grille|5|We enjoyed the Capitol Grille very much. it was a great choice.
June 8, 2012|Consistently impressing!|5|The food is always outstanding and the waiters always remember to ask if there are any time constraints so that they can point out options on the menu that take less time to prepare. There is no question that the quality of the food and service at this capital grille is exceptional in every way.
June 5, 2012|The food and service were|5|The food and service were wonderful! Our server was very good and we enjoyed a truly lovely evening!!
May 28, 2012|Superb food/excellent service|5|We went to Capital Grille to celebrate my daughter's graduation. The food was impeccable and the service was truly outstanding. Attention to detail made this celebration memorable. I would definitely recommend this restaurant for any special occasion. Kudos for our server that night, Mr. Cy Lotito. He was knowledgeable about the dishes in the menu, funny and very efficient. Overall it was a great experience.
May 28, 2012|One of the best, if not the|5|One of the best, if not the best, steak restaurant there is in town!
May 27, 2012|Awesome dinner!|5|Last minute pick for anniversary dinner. Awesome choice! It is expensive, but relative to other restaurants in town, quality of food and service it is well worth it. They deliver for a high-end restaurant. The service was spot on, our waiter Tom was excellent. He did everything just right, never missed a beat. Excellent trained staff!The quality of the food is very good, portions are on the large side which is unusual for a high end restaurant. My wife and I were both very pleased!
May 25, 2012|Our overall experience was|4|Our overall experience was Excellent. The food was superb! We had a great waiter who was very attentive and conscious of each of our needs. We truly enjoyed it and will return again. The ambiance was very nice, however, the jackets that the waiters wear (beige lab coats) takes away from the ambiance. A simple white shirt with a black tie or a white tuxedo shirt with a black bowtie would look better.
May 20, 2012|The food and the service were|5|The food and the service were great. It is a wonderful place to go for a celebration or special evening out.
May 19, 2012|Reliable class|4|Classy and always reliable food quality. I come often for business dinners but finally come to leisure. A favorite, no matter where I am in the country.
May 18, 2012|Very expensive, but it is|4|Very expensive, but it is The Capital Grill. If your looking for a special event to show off or impress The Capital Grill is your place. If you are looking for a great all around dinning experience you may want to look at other options.
May 17, 2012|Capital Grill is always a|5|Capital Grill is always a delightful experience. The food is delicious and prepared exactly they way it is ordered. Service is terrific as is the ambiance. Portions are huge!
May 13, 2012|Extire experience was excellent,|5|Extire experience was excellent, Mother Day at Capital Grille has become a tradition. This year marks our 10 time.
May 13, 2012|Fabulous service, food and|5|Fabulous service, food and attention to detail - somewhat of an anomaly on Mother's Day at other establishments on busy holidays. Our steaks were expertly prepared and even appetizers and desserts offered a decidedly different and flavorful accompaniment to the main course.
May 7, 2012|We had a wonderful evening|5|We had a wonderful evening from the appetizers to dessert. The food, service and ambiance was outstanding. We would definitely go there again!
May 4, 2012|Best steak in town, Great service|4|Great place to go for a special occasion. Staff is very attentive & knowledgeable about the menu. You can't get a better steak in Providence. We enjoyed it very much & will go back again.
May 4, 2012|Although we have been to the|2|Although we have been to the Capital Grille many times for special occasions, this visit was less than satisfactory. From the time we arrived our servers seemed to be in a race to see who could bring out items faster and remove items from our table before we could finish the content. Although the manager intervened after our complaints, the mood for the evening had been ruined. It might be awhile before we return to this location again.
April 29, 2012|An outstanding 5-star experience!|5|An outstanding 5-star experience! Would highly, highly recommend. Food, service, attention to detail, ambiance ... all exceptional!
April 28, 2012|For the first time ever, we|2|For the first time ever, we had a bad meal at Capital Grille. We were quite surprised because it wasn't just one particular dish but the entire meal in general. The lobster bisque was fishy tasting, the onion soup was tepid at best. We all ordered dry aged bone-in sirloin. All but one was overcooked, one had a huge line of gristle going through the middle and all agreed the meat was tough. Nowhere near worth the $40+ price per steak. The steaks did not appear to be dry aged but regular sirloins and not great ones at that. The other appetizers were fine and dessert and coffee was good. Very disappointed.
April 28, 2012|Very Good Steak House! Good Service|4|"Very good steak place. Nice relaxed atmosphere and very good service. Not as ""stuffy"" or formal as one might expect upon first impressions. Service was friendly, attentive and helpful. Steaks were very good and cooked as ordered. Overall, food was very good. Not cheap, but prices are consistent with other competitive high end steak houses. Portions and cuts of meat are generous. Would definitely consider a return."
April 28, 2012|Thank You|5|Having been a guest of several locations I took my son there for a celebratory evening as he made Headmasters List for his grades. I let our waiter Matt know it was his first time there. Matt gave him the Royal Treatment, explained more about steak than my son knew existed. Our meal was wonderful, the service was fantastic and left me hoping for another great report card next quarter. With any luck we will be back soon
April 20, 2012|I have been to the Capital|5|I have been to the Capital Grille in Boston many times, mostly on business, and have always been pleased with the food, service, and overall experience. This was my first trip to the Providence location and the purpose was a little different - a first date. I had requested a private table when making the reservation and it was duly noted. From the moment I walked in the door, the experience at the Capital Grille was outstanding. The service, the food, the wine, the ambiance, and the romantic setting provided a perfect experience for my date and me. The staff was attentive to our needs, but respectful of our privacy. Kudos to the Capital Grille....
April 8, 2012|We were at The Capital Grille|4|We were at The Capital Grille for Easter Brunch. It was done very well- excellent assortment of foods, well prepared.
April 7, 2012|Loved our dinner and our server,|5|Loved our dinner and our server, Ken, was more than efficient and knowledgeable.
March 24, 2012|Portions are huge, food was|4|Portions are huge, food was very good and ambience mainly loud. Service was exceptional.
March 16, 2012|Everything was excellent,|5|Everything was excellent, food, service, etc. Our server (Eric) made our evening very enjoyable. We had a small birthday party (8) and he handled his reposibilties perfectly. I would highly reccomend.
March 10, 2012|Great service, only slight|4|Great service, only slight negative was that one of our three steaks wasn't quite up to the normal high standards. Still an all-around excellent dining experience.
March 10, 2012|Always a great night out!|5|They know how to buy and cook meat...always AWESOME!!!!!
March 3, 2012|Nice and elegant!!|4|Very nice and elegant place, great service and the food was really good!! I would go back!!
February 19, 2012|The service was excellent,|3|The service was excellent, and most of the food was pretty good; However, my steak was way overcooked, and the portion suggested by the waitress was sooo big that there's no way we could have finished it.
February 18, 2012|hate to say it the only thing|5|hate to say it the only thing wrong were children screaming, yes children screaming. Our reservation wasn't even until 10 pm! ayiyi
February 14, 2012|Marvelous dining experience|4|Everything was great; well worth the price. Even with this being our assistant waiters first night, The Capital Grill is a marvelous dining experience.
February 11, 2012|Highly recommended|5|Great food, efficient service from knowledgeable, pleasant and attentive (but not overdone)waitstaff.
February 3, 2012|This was our first time to|5|This was our first time to the Capital Grill and the food is outrageous! In my opinion, this steak house is the best in the area. The steak was tender and cooked to perfection and just melted in my mouth. The service was so overly vigilant, I couldn't even believe it! This restaurant is a must.
January 28, 2012|This was a great meal for|5|This was a great meal for a great value that can't be beat during Providence's Restaurant week!
January 28, 2012|Have been here a number of|4|Have been here a number of times, mostly business lunches. On this occasion, we went for a Restaurant Week dinner. The food was excellent, as usual, and the Restaurant Week menu was an outstanding value. Our salmon and steaks were perfect. However, our waiter was clearly off his game. He spilled some calamari in someone's lap as he served it. Furthermore, one diner would order something (a glass of wine, a cup of coffee), and he would scurry off without ever asking the other diners if they wanted something. I would definitely go back, but would hope for a different waiter.
January 28, 2012|Proven Providence legend...|4|While there are a dozen or so great restaurants in Providence that aren't chains, it is important to remember that CG started as a Providence-only restaurant when a lot of places were going under and Ruth's wouldn't have set foot in the city. It is a great steakhouse in a great city, with touches of Chicago and New York thrown in (think Gibson's and Old Homestead). The service is formal but very friendly, the steaks and sides are all very good, and you feel like you're truly dining out. Fun for groups, families, dates...and maybe best steak in RI.
January 28, 2012|Had an amazing dinner at an|5|Had an amazing dinner at an excellent value during restaurant week.
January 27, 2012|The waitress we had, Nikki,|2|The waitress we had, Nikki, was excellent, but every other part of the experience was not up to par of what I would expect from Capital Grille. We were seated at a table that was so tight, every person that walked by had to turn sideways to get by. The other waiters were incredibly rude as they walked by. One even took our menus that he thought were in the way to passerbys and put them on the floor by our chair. The food was just okay. Glad it was restaurant week and we didn't pay full price.
January 27, 2012|We went restaurant week and|5|We went restaurant week and the food and service was great! The value price even better.
Dined on January 26, 2012|Outstanding food and excellent|5|Outstanding food and excellent location. The restaurant week menu was diverse, inexpensive, and just enough food.
January 26, 2012|The food was very good and|4|The food was very good and the wait staff is very attentive.
January 25, 2012|My husband and I think Capital|5|My husband and I think Capital Grille is perhaps the best restaurant in Providence: consistently excellent food and excellent service.
January 25, 2012|Food and service are excellent.|5|Food and service are excellent. We went during Providence Restaurant Week and selected our meals from the reduced menu - but had absolutely no complaints. We will go back again for sure.
January 25, 2012|Dined as part of Providence|4|Dined as part of Providence Restaurant Week. Steaks were excellent. Choice of side dishes fair (Mashed potatoes or creamed spinach - No healthy choices available). Desserts very good! For the price ($30/pp), it was a good deal.
January 23, 2012|It is very expensive and the|3|It is very expensive and the food is nothing more than any decent cook would prepare at home. The first steak was ordered rare and hot inside, and arrived overcooked. It was replaced by another one cooked perfectly.
January 22, 2012|Fabulous Food, Presentation|5|Fabulous Food, Presentation and Ambiance! Can't wait to go back!
January 20, 2012|Even though we went for the|5|Even though we went for the special Restaurant week menu, the staff treated us like VIPS! Food was excellent, wine superb, service outstanding.
January 19, 2012|lways excellent food and service|5|lways excellent food and service even when very busy!
January 18, 2012|Excellent food and service.|4|Excellent food and service. Great for special occasions.
January 18, 2012|Went for the first time during|5|Went for the first time during restaurant week. They served a large basket of various breads and someone refilled it quickly after we finished what was there. I ordered the dry aged sirloin and it was delicious and cooked medium rare as asked. My boyfriend ordered the salmon and though it was terrific. He loved the sauce and wants to go back again for it. A friend ordered the filet mignon; he's picky and loved it. They served a large dish sides: mashed potatoes and creamed spinach. The mashed potatoes were creamy and smooth but still had small soft chunks and skin, which I liked. The creamed spinach was a surprising pleaser, I even went back for seconds. Creme brulee is best I've had and oddly goes well with the tangy raspberry sorbet!
January 17, 2012|We had the restaurant week|5|We had the restaurant week menu and it was terrific. It was a wonderful meal for a very reasonable price. There were a lot of choices. I had a 14 oz. steak and Diane the salmon. She said it was the best she has had. The steak was great, cooked perfectly, black and blue. Waitstaff could not have been nicer. Just a couple of days left. Don't miss it.
January 17, 2012|Consistently excellent|5|Had a wonderful dinner during Providence Resaurant week. This was our second time and the first was just as good. Will definitely return.
January 16, 2012|My husband & I went for Restaurant|5|My husband & I went for Restaurant Week to celebrate his birthday and what a great place! We were seated right away in a nice booth out of the way from traffic. Our waiter was fabulous and not only was he knowledgeable about the menu but the historical events of the building too. We ordered appetizers and then from the special menu. The filet was a melt in your mouth choice, the sides and dessert, everything was delicious! The Capital Grille puts such a nice personal touch on everything, it's like you are their only guests! Nice place to go for any occasion, certainly you will leave with a memorable evening!
January 15, 2012|Great food and great service.|5|Great food and great service. We enjoyed ourselves.
January 14, 2012|Anniversary dinner|5|My husband and I went there for our anniversary! To our surprise there were rose petals on the table when we arrived! Our waiter, Ken, was phenomenal! Great service!! Great food!! Overall superb! We had a great evening!
January 12, 2012|Never disappoints. Wait staff|5|Never disappoints. Wait staff could not be better.
January 11, 2012|The best of all the steak|5|The best of all the steak houses overall. Not cheap but top quality and the best service.
January 2, 2012|This was the first time I|5|This was the first time I had gone to the Capital Grille and let me tell you I plan on returning on a regular basis. Food, service, location, overall everything was spot on and beyond amazing.
December 31, 2011|Once again a superb evening|5|Once again a superb evening in every respect. Service outstanding with our regular server and friend Mark Deland...nobody finer or friendlier. All food wonderfully presented and precisely prepared. We'll go back again and again and again.
December 31, 2011|Right in the heart of Providence.|4|Right in the heart of Providence. Food is very good. However it is very expensive and very loud. Wait staff was not very nice at all. For 4 people our bill was over $500.
December 28, 2011|Outstanding meal. Trust your|5|Outstanding meal. Trust your servers! They won't steer you wrong.
December 24, 2011|We enjoyed Christmas eve dinner|5|We enjoyed Christmas eve dinner at the Capital Grille with my parents, and our children. The food and service were both excellent. Our entrees were all cooked perfectly and the sides were all awesome as were the cocktails and desserts!
December 24, 2011|Great service and food! We|4|Great service and food! We had a table right near the kitchen so it was very loud. All we heard are crashing plates, slamming etc. Next time I will request a seat far away.
December 23, 2011|Our waiter must have had an|3|Our waiter must have had an off night. Totally forgot to bring the appetizer.
December 17, 2011|Can't go wrong. |5|This was a special occasion and it was excellent. They treated our kids spectacularly and everyone had a great meal.
December 10, 2011|We had another great meal|5|We had another great meal at the Providence Capital Grill. Had a party of six and everyone enjoyed their meal. London our server did a great job?
November 25, 2011|My husband loved the food.|4|My husband loved the food. The grill lamb is the best lamb he ever tried. My kona aged steak was good and flavorful. Service was a disappointment. My waiter is too busy. I have to ask other staff to get me milk for my tea, and tea was way too strong. I also waited 20 minutes and have to make an effor to call my waiter to get me my check as he was busy serving other table.
November 25, 2011|My daughter and I had lunch|5|My daughter and I had lunch here during our shopping excursion on Black Friday, after three hours of Christmas shopping, it was nice to get away and spend an hour in an upscale environment. The Lobster Bisque (soup of the day) was outstanding, very creamy and true to the server's description there was a good amount of lobster in the cup as well. The Lobster and Crabcake sandwich was a wonderful choice, light with almost no filler, we will definitely eat here again.
November 12, 2011|Food is very good but very|4|Food is very good but very noisy and luck of music.
November 11, 2011|A propos|4|We took our time ordering, and asked many questions, as I don't frequent the establishment. I asked for water with lemon and didn't receive the lemon until I asked a second time. I also asked for an olive oil, hot pepper and garlic mix for the bread and only received the garlic with it on the second helping. The scallops special was delicious and the a la cart servings of creamed corn with bacon and au gratin potatoes were overwhelming in size. The corn was flavorful but the au gratin potatoes lacked much taste. The stuffed shrimp, crab and lobster dish my friend had was also very good and tasty.
November 5, 2011|Too Loud, Boring food|3|This restaurant is very loud. We went to celebrate our 1 year wedding anniversary. Our seating was so close to other diners that we could not talk to each other without hollering. The father and son sitting beside us had a conflict where we had to hear the son use profanity, as punctuation. Though we were seated before others around us, we were served last. The food tasted fine, but not 'divine' as the price would suggest. The portions were too big, with nothing subtle for flavors. All in all loud and boring food.
October 30, 2011|Wonderful in all aspects.|5|Wonderful in all aspects. I have not had a better service experience anywhere else in New England!
October 29, 2011|Capital Grille - CAPITAL Restaurant|5|The service was EXCELLENT and was only exceeded by the quality and taste of the food!!
October 28, 2011|We recently had dinner at|5|We recently had dinner at Capital Grille, where we've eaten often since it opened, but had not been here in almost a year. Food was very good as usual. But especially impressive was our waiter Matt Walters. He just did everything right - personable, helpful, and had just the right, knowledgeable touch that made the evening especially enjoyable for us. He understands his customers. Matt alone is worth the visit. One small example of CG's attention was when I commented to Matt that I surprised how empty the restaurant was but we had a problem on Opentable making a reservation. A few minutes later, manager came over, apologized, said they would take steps to correct and seem to have followed up.
October 23, 2011|CG our favorite for Special Nights|5|Capital Grillle continues to set the bar high for steak houses in Providence. Although not inexpensive, the quality of food, service and ambience make CG our favorite for the special night out.
October 22, 2011|Great Anniversary!|5|My wife and I recently celebrated our one year wedding anniversary by having dinner at the Capital Grille in Providence and we couldn't have been happier with our choice. The service was extraordinary and the food was delicious! From the moment we arrived to the momenet we left, we felt like they were attentive to our every request and did so with a smile on their faces. Our table was decorated with rose petals and upon sitting they brought us two glasses of champagne so we could toast our anniversary. We both ordered steak and it was delicous and done just the way we like it! To top it all off, they brought us a piece of flourless chocolate cake that was also delicious. We couldn't have asked for a better way to celebrate!
October 21, 2011|Very good meal, but at the|4|Very good meal, but at the prices they're charging, it should have been outstanding.
October 8, 2011|Perfect with one exception,|4|Perfect with one exception, very loud. Probably because it was a very busy night, Flames of Hope Water Fire. Food and Service were great as usual.
October 8, 2011|We ate outside during a Waterfire|5|We ate outside during a Waterfire night, and still felt like there was some privacy from the crowds passing by. Dependably great food.
Dined on October 5, 2011|Had been here once before|5|Had been here once before and wasn't overly impressed. This time it was excellent in every way. Had the rib eye. Incredible. Server was extremely knowledgeable and helpful. Every aspect of the meal was first rate. Looking forward to next visit.
October 1, 2011|Seated near kitchen. Would|5|Seated near kitchen. Would have preferred being in a more quiet section. However, food and wine were outstanding.
September 30, 2011|Capital grille is always outstandin|5|Capital grille is always outstanding. The food is cooked to perfection every time. I've never ordered something a particular way and been disappointed. The staff is friendly and professional, however they could speed up service a little bit. They ask at the beginning of your meal if you're in a rush and if you say you're not, the meal is very drawn out, which I understand as far as relaxation goes. Overall outstanding and worth the money every time. The specials are fabulous, too!
September 29, 2011|Dining at The Capital Grille|5|Dining at The Capital Grille is always a positive one..Food and service is outstanding.
